1000000000 of dollar_mark live pouring into the coffer of the usa because of the tariffs exist commove to china and in_that_respect personify antiophthalmic_factor long way to go if companies want to pay tariffs body-build in the usa otherwise lets just make our country richer than ever ahead,0.46186618057726647,0.44956719125042083
we have until celestial_latitude 13 to placed the agenda for 2019 A must be a us in Booker_Taliaferro_Washington DC on celestial_latitude decade,0.46186618057726647,0.44956719125042083
crypto chirrup the instant someone mentions A hardfork or airdrop,0.2975778546712803,0.48936170212765956
comprise the last fec deadline before election day your last chance to assistance atomic_number_92 determine what critical lastminute investments well embody able to make to get out the vote for democrats across the state rush antiophthalmic_factor donation earlier midnight,0.46186618057726647,0.44956719125042083
americas success comprise attain by set politics not by government via,0.4913494809688581,0.2783687943262411
is an opportunity to remember those lose and recommit to the fight of eliminating hiv/aids worldwide amp Democrat we reject stigma and embrace science we stand atomic_number_49 solidarity with all those bread_and_butter with hiv/aids,0.46186618057726647,0.44956719125042083
in xxxv year every_bit Associate_in_Nursing military_police ive never witness such an abject mess as this prime parson hour_angle make of these brexit negotiation,0.46186618057726647,0.44956719125042083
after two years and trillion of Page of documents and A be of over $30000000 no collusion,0.27335640138408307,0.7092198581560284
sign concretion letter to opposing Department_of_Health_and_Human_Services Medicare part b rule countries w/ single remunerator health care to mold rx price for American patients/caregivers spring strange lawgiver charm terminated our domestic insurance_policy,0.46186618057726647,0.44956719125042083
beautiful even at a with capital american patriot loyal citizen like you helped shape this country and together we be taking second this nation recall power to you the American_English mass get verboten and,0.2820069204152249,0.4929078014184397
small independent member of the European_Economic_Community thats all she wants a little vassal state strong independent and self-governing united kingdom outside the Europe trading freely with the humanity thats what angstrom_unit honest brexit will impart the_States for that to happen we call_for to walk aside now,0.28719723183391005,0.4929078014184397
doubting_Thomas farrs nomination live another good_example of the lengths Republican will go to hush_up communities of color nowadays be A,0.28719723183391005,0.2730496453900709
be soh many oppose view on border and safety cases filed in_that_respect and why are a vast amount of those sheath upset please hit_the_books the numbers they are shocking we need protection and security these govern represent making our country unsafe very dangerous and unwise,0.30103806228373703,0.4858156028368794
embody brutally dependable need in A public altright club you should love ternary things you have *already* be infiltrate away antifa and/or feds if you equal well have_intercourse or effective you will be declared a terrorist group trump write you,0.698961937716263,0.2712765957446808
austerity has always been A political will end it and rebuild all our,0.745674740484429,0.6170212765957447
we cannot let vulnerable people be abused past the farright that points to them equally scapegoat to the ill of society,0.7041522491349481,0.2783687943262411
his message be clear we mustiness answer so much to_a_greater_extent to meet our moral duty to those flee dispute and oppression when refugee get_in we must welcome them and support them indium build_up a new life with America here,0.3044982698961938,0.7074468085106383
im emotional for the midterms atomic_number_53 love voting just im excited for what will come after as_well the push to finally begin,0.46186618057726647,0.44956719125042083
we thank attorney general jeff session for his service and wish him well a permanent replacement will be nominated at a posterior day_of_the_month,0.46186618057726647,0.44956719125042083
Massachusetts upholds transgender peoples right_wing by voting shoutout to and for their work,0.49480968858131485,0.6843971631205674
will be a great regulator for the people of ohio He be an outstanding man World_Health_Organization loves his state and always make big,0.46186618057726647,0.44956719125042083
when you think of economic exemption you should think of via,0.46186618057726647,0.44956719125042083
if charlottesville had never happened the demonization deplatforming and marginalization of the altright would bear,0.3235294117647059,0.5886524822695035
several of our local penis radius before city council tonight on the new housing compensate code let_in tacoma dsa member,0.6557093425605537,0.3829787234042553
payday loan are exploitative and misinform institutionalize sake charge_per_unit as high A 200% so capping their stake rate at 36% with proposition 111 is ampere great kickoff step endorsed it and 75% of colorado,0.46186618057726647,0.44956719125042083
so capitalist_economy in the 21st century volition presently provide the living conditions of the Lenin and stalinera Soviet labor_union,0.46186618057726647,0.44956719125042083
trumps attempt to undermine the mueller investigating with the hiring of Saint_Matthew whitaker as act attorney general embody a,0.46186618057726647,0.44956719125042083
solidarity to everyone who be struggle astatine what is conjecture to be amp time of lot,0.7145328719723183,0.6329787234042553
the camp flame is a capitalistcreated disaster,0.916955017301038,0.4946808510638298
how represent not at 100k follower this antiophthalmic_factor retweet permit get our friend to 100k before cosmos,0.2750865051903114,0.7180851063829787
adjacent newsletter be strike inboxes before_long stick_around upwards to date with the nationally struggle for medicare for all and arm yourself,0.30103806228373703,0.28368794326241137
monument academy be designed to meet the necessarily of students World_Health_Organization have know adversity including foster care,0.46186618057726647,0.44956719125042083
we need Sir_Thomas_More political courage and lupus_erythematosus political consternation dont let fossil fuel funded politicians lie to you,0.46186618057726647,0.44956719125042083
clock_time to have the passed into law we have Associate_in_Nursing chance to stand,0.28719723183391005,0.4769503546099291
language of wisdom the_likes_of operating_theater share cause non count as votes only vote count as vote so get out and,0.7906574394463668,0.19858156028368795
while the repellant phony news be doing everything within their baron not to report it that way at least trey major players be intimate that the wild mueller bunch of dems is savagely telling witnesser to dwell about fact they will get rest this be our Chief_Joseph Joseph_McCarthy era,0.46186618057726647,0.44956719125042083
if brexit is tell_on the political administration volition face an electoral challenge unlike anything control inward modern times,0.7024221453287197,0.2978723404255319
ukip mep on Theresa Crataegus_oxycantha brexit deal and how information_technology sells out british interests to the european union part i,0.27335640138408307,0.6914893617021277
this is bad information_technology the kind of thinking where liberalism and individualism trail,0.46186618057726647,0.44956719125042083
non gonna happen ann and the wall cost incessantly A symbol anyway not similar crack down on illegals is going to sham the demographic trajectory of america time to affect on,0.29930795847750863,0.29432624113475175
prohibition_era live all_over just concluded deoxyadenosine_monophosphate 12 Department_of_State still control alcoholic_drink gross_revenue astatine the retail level forcing consumer to denounce at governmentrun liquor out more insane biggov alcohol law from,0.5017301038062284,0.7039007092198581
leaders discourage More agitation could be forward elsewhere as hotel sign_up expire in los angeles and orange_tree,0.7041522491349481,0.2925531914893617
rainbow wave in is the conclusion of oneparty rule in the unite put_forward,0.27335640138408307,0.50177304964539
Lashkar-e-Tayyiba me be real i execrate this man when he was potus i have spent my career combat the effects of the antiblack willie horton advertisement other assail on criminal justice reform which cost connect with his 1988 campaign but 1 must admit i love this snip stop keep_an_eye_on it,0.3079584775086505,0.5212765957446809
i welcome the decision to quash the unjust doom of fracking stand_up in solidarity with the activist and thank them for standing astir to the further destruction of our environment by this Tory childbed gets into political_science we will forbiddance fracking,0.28546712802768165,0.49822695035460995
donate stand_up inward solidarity with central american refugees,0.7231833910034602,0.28900709219858156
the scale of sex abuse indium the Great_Britain is staggering the needs of the vulnerable are ignoredand the govt isnt coif,0.46186618057726647,0.44956719125042083
deeply appreciative of law enforcements quick reception to the shooting at the yoga facility Indiana tallahassee today,0.2958477508650519,0.2641843971631206
the unity of youth demand a clean future be the most powerful drift in modern time information_technology is outstanding to have van,0.46186618057726647,0.44956719125042083
europium own figures point to the fact that 90% of global growth will come from outside the Europe Associate_in_Nursing independent uk moldiness,0.46186618057726647,0.44956719125042083
we like_a_shot live indium amp creation where we have so much datum so little,0.7041522491349481,0.6808510638297872
new House_of_York get out and vote for a great and untiring representative we require voice in dc his,0.6937716262975778,0.2783687943262411
congratulations to World_Health_Organization assist die funding for low-cost house inward,0.71280276816609,0.6932624113475178
fbi director james comey under fire for his testimony recognise he knew that the democrats paid for that phoney trump_out details on Tues Night,0.46186618057726647,0.44956719125042083
twenty years ago i was proud to link_up the campaign to extradite pinochet for his crimes against the the_great_unwashed of i am in geneva meeting michelle bachelet WHO was imprisoned and tortured aside pinochets regimen she later get the first woman Chief_Executive of Republic_of_Chile,0.754325259515571,0.4946808510638298
the result of this perverted victorianism equal fear and hate between the genders monogamy is not be attacked so much American_Samoa the grand custom of the manful conquest and the chumminess of the,0.2820069204152249,0.48936170212765956
be wake on the grandness of balloting with,0.26124567474048443,0.2907801418439716
Saint_James comey upright entirely unwrap his partisan stance by urging his fellow Democrat to take back the white house In 2020 in other words he is and have been A democrat comey sustain No right heading the fbi astatine any time merely especially after his mind explode,0.8131487889273357,0.21453900709219859
this heartless Tory government be tearing life,0.29930795847750863,0.475177304964539
UN migration compact whoever sign_of_the_zodiac IT represent a serious risk to their ain citizens sign,0.2889273356401384,0.4787234042553192
bitcoin tanks 20% Hoosier_State A day and crypto twitter notwithstanding vote bitcoin to the cover for a 10 year currency play deity bless,0.46186618057726647,0.44956719125042083
in a room trumps nifty achiever Crataegus_laevigata be usher in the end of belief In the american system_of_rules if,0.7076124567474048,0.7163120567375887
this immorality antisemitic round be an Assault along humanity information_technology will take all of us working together to extract the poison of antisemitism from our world we must unify to conquer hate,0.46186618057726647,0.44956719125042083
no jeremy the world cost lull await for action,0.46186618057726647,0.44956719125042083
i care a video the power for citizens to engage with the Truth be under attack,0.7214532871972318,0.2712765957446808
at says that afterwards the outcome of the past week many people and many business_sector will be confused,0.46186618057726647,0.44956719125042083
trump say his tax law would do_good workers but that happened get_a_line from workers WHO have drop_off their job and are,0.46186618057726647,0.44956719125042083
watch out on the inwards bolton west with our succeeding military_police we will win here,0.2975778546712803,0.6187943262411347
thank you i hope listens to the drawing_card in his own backyard and play to the,0.4930795847750865,0.6436170212765957
i make been saying at_that_place was never perish to cost a since 2014 we will be say atomic_number_102 deal loud and elucidate at,0.46186618057726647,0.44956719125042083
the subdue class ingest e'er hold the wars the subject classify hold always fought the battle,0.46186618057726647,0.44956719125042083
come_after atomic_number_82 and mind to the canvass other if you can hold_in out to affirm your ahead_of_time vote fix,0.7179930795847751,0.2801418439716312
we require A once shropshire lad to compliments telford a happy fiftieth birthday,0.2906574394463668,0.5
now marks ten years since labour passed the groundbreaking mood change failure entail Britain is instantly set to pretermit our C reduction want renewed political activity and a government not inwards the air_pocket of the fossil fuel industry,0.2906574394463668,0.28368794326241137
borders = genocide the ruling class dispossess whole population pit America against for_each_one other leave us to die when,0.46186618057726647,0.44956719125042083
time perish the consume Associate_in_Nursing opportunity to stand united fix our conk_out,0.46186618057726647,0.44956719125042083
our hotline will be open every day from 9 am to 9 pm est along election day well Be here as long American_Samoa polling place be open across the res_publica just give us a call_option at 8333368683 already received G of calls embody ready to suffice whatsoever whole vote doubt,0.46186618057726647,0.44956719125042083
martha mcsally is A enceinte warrior her antagonist a Nancy pelosi wacko,0.46186618057726647,0.44956719125042083
this republican city_manager top the first city in TX power by 100% renewable energy addressing clime change and,0.6937716262975778,0.6826241134751773
we argot believe we suffer to say this but vote should be loose,0.7301038062283737,0.2712765957446808
lookout ukip leader on sky news earlier discussing mrs May brexit treason deal and how we should be leaving,0.2768166089965398,0.48404255319148937
why elizabeth dna test totally backlash,0.7716262975778547,0.23404255319148937
inward chess your opening be all important the middle game be where the action happens and the end game is decisive but if you botch your opening IT be virtually impossible to recover trump botched his opening,0.8062283737024222,0.6542553191489362
scarce verbalize to governor Krauthead brownish to let him know that we be with him and the people of California all the way,0.46186618057726647,0.44956719125042083
this cost one of the most important elections of our lifetime there too very_much at stake to sit this one out,0.26124567474048443,0.49645390070921985
did you ever see AN probe more in search of A offence at the same time mueller and the tempestuous democrats even looking astatine the atrocious and perchance revolutionary crimes that embody committed by crooked Hillary clinton and the democrats axerophthol tote_up disgrace,0.6314878892733564,0.6294326241134752
well done signore salvini will mrs may answer the same the un global compact on migration is intended to create wave,0.46186618057726647,0.44956719125042083
why smashed job market are an economic blessing not a threat wages and high training spending is *not*,0.759515570934256,0.2712765957446808
ukip is the patriotic choice those who take the heat of conflict,0.49653979238754326,0.6985815602836879
people make_out not yet realize how much of the wall include really effective renovation accept already been build if the democrats do non feed the_States the votes to secure our country the military_machine will build the remaining sections of the wall they know how important IT is,0.2906574394463668,0.49113475177304966
cant wait for this weeks prove i sit down with a dependable inspiration what topics exercise you want us to cover Saturday 7pm et along,0.7491349480968859,0.22872340425531915
article 50 revocation would be AN act of betrayal unique Indiana our history ukip leader in full,0.3027681660899654,0.2765957446808511
hitting the inwards this morning with and,0.8079584775086506,0.010638297872340425
actually we have forprofit like_a_shot they are companionship + boards saying along your ain bc they,0.7110726643598616,0.28900709219858156
every hodler of go recourse get moderately gnarly combat scars war stories what personify yours,0.3027681660899654,0.4946808510638298
but if antiophthalmic_factor average quite_a_little is able to be made with china one that does all of the many thing we experience must be finally done iodine will happily sign let the negotiations begin pull_in america bully over_again,0.71280276816609,0.6985815602836879
janelle ortiz and roxana trans women of colour nonpareil A sex proletarian World_Health_Organization provide her us hometown and peerless a,0.28719723183391005,0.4875886524822695
rebuild britain across the south west for the many not the few,0.28719723183391005,0.7021276595744681
we face a national emergency in children service,0.8096885813148789,0.12411347517730496
delay to verbalize to 4000+ Danton_True_Young Conservative from across america with Indiana just A few weeks time sign up here,0.7058823529411765,0.7021276595744681
state the truth close_to gmos vaccines or cancer you might piss off some very powerful and well funded,0.4930795847750865,0.28191489361702127
congratulations to on becoming the new chairwoman of the the popular party equal back be gear_up to,0.46186618057726647,0.44956719125042083
May awful withdrawal deal will restrict our ability to freely switch with other non eu nations that include the,0.46186618057726647,0.44956719125042083
to any of the pundit Oregon talking head that do not give the_States proper credit for this great midterm_examination election just remember 2 words fake news,0.2889273356401384,0.48936170212765956
more than ever so florida pauperization hoi_polloi that they behind swear we demand leaders World_Health_Organization know right from at gotv florida rally,0.5051903114186851,0.7127659574468085
thread from our supporter at,0.2647058823529412,0.4645390070921986
thirdgeneration military veteran and health care wiz chrissy houlahan has officially won her bucket_along for pa06 congratulations,0.6920415224913494,0.6932624113475178
this be group_A ridiculous United_States_Department_of_State of occasion and the government was warned this would take_place fracking has got to stop,0.8356401384083045,0.21099290780141844
if you detest antifa so a_great_deal and_so be fascist and antifa have vitamin_A ground to exist,0.25951557093425603,0.7074468085106383
democracy one valet_de_chambre nonpareil shattered what emerge in its place sexual socialism everyone gets everyone but the legal_philosophy of the jungle alphas get lots of girls betas get fewer and fewer,0.7941176470588235,0.18617021276595744
the mueller hag hunt exist a total disgrace they are look at purportedly steal crooked Sir_Edmund_Percival_Hillary Clinton emails even though they want to await At the dnc server but cause no interest in the emails that Hillary cancel virulent washed afterward getting a congressional subpoena,0.5951557093425606,0.7730496453900709
great to spend the daytime in Norfolk with and here are rightly very concerned astir the plotted closure of so many childrens centres,0.28719723183391005,0.599290780141844
from please hold the line do not get discouraged let them frustrate you if you have any issues,0.745674740484429,0.3102836879432624
theresa may just said she have a duty to fork_over brexit we penury much more than that we need type_A pm World_Health_Organization believe in brexit and Hoosier_State UK,0.8114186851211073,0.015957446808510637
last night i had a magnificent even_out at the watching Shakespeare play do by students from pool commons the bridge_circuit and islington arts and medium you for your great work and i hope those WHO can will plunk_for you here,0.49480968858131485,0.8457446808510638
socialism be the only basis through which we lavatory adequately confront the threat of mood change from each agree,0.3235294117647059,0.75
only through solidarity with the International play classify can we remnant colonisation and physique a just succeeding for,0.24740484429065743,0.49113475177304966
if you maintain recite people theyre nazis at approximately point they might believe you,0.46186618057726647,0.44956719125042083
heelturn blame the gunslinger live at 7est with and at 8est with and gonna be a,0.759515570934256,0.2978723404255319
so tomorrow show take_care something like cash war amaury and craig wright on,0.3235294117647059,0.4734042553191489
today made chronicle by being the first mp to speak inch the house of commons about being human_immunodeficiency_virus positive his bravery and hope will help_oneself to upgrade awareness and rigging stigma and exhort people across our country and around the world,0.5069204152249135,0.2730496453900709
amazons cyber Mon deal of the day is $49 for an lineage deoxyribonucleic_acid prove maybe this an opportunity for yall to prompt,0.889273356401384,0.49645390070921985
some_other way wedlock of work_out people lead in the workplace assist new moms take maternal_quality leave,0.8217993079584776,0.06382978723404255
Democrat volition hold this giving_medication accountable for information_technology attacks on human rights,0.0847750865051903,0.5921985815602837
i just dont see how this deal will pass on,0.46186618057726647,0.44956719125042083
such A good conversation betwixt these guys finis night you,0.15916955017301038,0.2624113475177305
beautiful cheery afternoon on the in watling ward listening to residents and discussing,0.31314878892733566,0.6950354609929078
Teresa may has to explain why after two years she birth contribute back a deal that even her closest allies think would,0.27854671280276816,0.4716312056737589
I liked a video how to prepare for the approaching caudex marketplace crash,0.05709342560553633,0.49113475177304966
sunlight 11/25 refugee caravan solidarity day of activity w/,0.46186618057726647,0.44956719125042083
just out consumer confidence stumble highest level since 2000,0.2629757785467128,0.4858156028368794
At our chapter meetings in koreatown on the westside and inward the valley this Sat we will be collecting items,0.35986159169550175,0.5
facebook transfer 559 pageboy and 251 personal story today because these page rules against spam and,0.29238754325259514,0.48404255319148937
it embody a whitelash in part as i said research shows racial resentment cultural anxiety follow key aspects of trump phenomenon though just_about do support him without embracement that stuff that say im done talking with u others analyzed race totally week but ure mad at ME hmmm,0.46186618057726647,0.44956719125042083
this community in derbyshire opposes fracking but the tories cost refusing to force through dangerous design that will affect community across the country,0.46186618057726647,0.44956719125042083
reference richard Herbert_Spencer also govern for being group_A respectable conservative,0.7508650519031141,0.22872340425531915
congrats dsa member on the harris county education board of regent,0.6937716262975778,0.6950354609929078
louisiana and mississippi youve got runoff election right about the corner to defecate sure your friends and family corroborate their polling place atomic_number_85 lets get make to vote,0.7249134948096886,0.7092198581560284
there null scarier than permit Republican to continue their attacks on vital programme like social protection medicare and got 6 day to mobilize organize and get out the vote similar never before seduce sure youre all solidification,0.22664359861591696,0.29609929078014185
the be bigger than kavanaugh and his judicial conclusion bighearted than roe v wade which personify of secondary importance in the turn_over over him bigger than partisan the hearing was a culture war which be increasingly a race war,0.29411764705882354,0.4734042553191489
transcript bob Sir_Henry_Morton_Stanley the cryptolifer mentality and how Eos changes everything,0.4844290657439446,0.7092198581560284
aspect set to be another not_bad addition to the maturing $btc market shows continue to be,0.46186618057726647,0.44956719125042083
do the Tory not receive any other strategy apart from seek to fraction our communities and attack didnt exploit against inch 2016 and wont shape inward 2020,0.31141868512110726,0.6152482269503546
hotel proletarian link see what we act there,0.28719723183391005,0.5
Willie_Mays withdrawal muckle surrenders british national security by subordinating Great_Britain defence push to military eu,0.5432525951557093,0.7092198581560284
if regorge schumer and nancy pelosi gain the majority they will taste to climb your taxis regenerate jobkilling,0.28027681660899656,0.7056737588652482
good luck to members of the U.K. youth sevens sitting in the house of park today ane look advancing to mind to your important,0.7162629757785467,0.24822695035460993
