i like a video silencing and bribing trudeau liberal rigging 2019 election,0.8114186851211073,0.12056737588652482
latinas are take the way and that includes in new 2d territorial_dominion where just_now alternate a sit_down from ruddy to blue,0.28546712802768165,0.48404255319148937
when equal potus right wing attack him even when he did stuff they want him to do He got zero course_credit for anything Lashkar-e-Tayyiba me say if announces support for which will aid lakh put_behind_bars the_great_unwashed jubilantly hand him full acknowledgment,0.46186618057726647,0.44956719125042083
we let you down nik,0.46186618057726647,0.44956719125042083
scarce refund from france where much be accomplished in my meetings with world leaders never well-to-do bringing up the fact that the us must live process fairly which it on both military and trade we pay for large portion of other land military trade_protection,0.6020761245674741,0.15070921985815602
in multiple counties in massachusetts medicare for altogether be on the vote axerophthol A nonbinding question endorsed it and the response from every county was strong the people demand,0.2958477508650519,0.7056737588652482
democratic socialists distribute more n95 masks than the city,0.9117647058823529,0.4875886524822695
deeply move ceremony today at islington manor remember the brave who left home not do_it if they would determine their jazz one we retrieve the two public state_of_war which destroyed angstrom propagation and shattered residential_district around the,0.1903114186851211,0.2978723404255319
antiophthalmic_factor perfect ME day for knocking on sharing the good rankedchoice voting mean no,0.46186618057726647,0.44956719125042083
jeremy heywood live Associate_in_Nursing impressive and dedicate public servant my thought_process are with his family know unity and colleagues At this sorry time,0.49480968858131485,0.12056737588652482
a budget for the wellness services cut past billion next year no newly money for overstretch overcrowded,0.2958477508650519,0.274822695035461
thither be a huge split right crossways the west for 20 years the gap betwixt rich and poor widen antiophthalmic_factor global elites ignore genuine concerns brexit cornet italy now these riots IN france hapened because ordinary people want to feel they get some power over their own futures,0.2837370242214533,0.4875886524822695
today labour is blab to local_anesthetic people Indiana carnforth about,0.39965397923875434,0.5833333333333334
the tech militarization team datadrove 23m voter to the poll for the 2018 midterm_exam between our iwillvote,0.46186618057726647,0.44956719125042083
Hera how unity viewed trump in december hes appoint what He run he ingest a year and adenine half to enact meaningful immigration legislation the time to equal critical of him be,0.5,0.6914893617021277
we witnessed the end of 2 years of oneparty rule and the beginning of adenine new democratic party untried browner,0.28719723183391005,0.48404255319148937
cutting 50000 police staff possess created ampere crisis inward of criticize our hardworking and pull constabulary the government mustiness put more officer on the beat,0.49653979238754326,0.6932624113475178
World_Health_Organization do you have the most assurance in theresa May or jeremy corbyn,0.46186618057726647,0.44956719125042083
there just one calendar_month get_out to get covered head over to to regain the skillful plan to fit your needs and your budget dont wait get covered today,0.28027681660899656,0.2801418439716312
nevadans only elected A democrat as their next governor congratulations to and the on A hardfought make_headway in A neckandneck race,0.46186618057726647,0.44956719125042083
no flag waving no pleas to donald trump no black girl operating_room Judaic Allies could save the gallant boys from their original sin of comprise a group that invoke to and represented the interests of white work_force,0.07612456747404844,0.37943262411347517
the past we inherit the next we build to support the miner,0.38581314878892736,0.48226950354609927
theresa may atomic_number_85 exist perfectly no elbow_room for pandering to racism in our,0.29411764705882354,0.49113475177304966
members are leave congress b/c legislative unconscious_process dominated by party leader who pressure_level to prove committee gavels now more than $1m in party repels public servants who want to get thing suffice,0.07612456747404844,0.6046099290780141
i agree with president obama 100%,0.46186618057726647,0.44956719125042083
what if the people not signing up for obamacare dont want information_technology via,0.2975778546712803,0.49113475177304966
the caravan are made up of close_to very ruffianly fighters and hoi_polloi fight_back back hard and viciously against United_Mexican_States At northerly edge ahead breaking through Mexican soldiers trauma exist unable Beaver_State unwilling to stop caravan should period them earlier they reach our border but,0.7058823529411765,0.28368794326241137
economical justice means that perhaps fair maybe we will be able to begin a treatment in this country on A word that,0.46186618057726647,0.44956719125042083
Arizona unitedly with our military and butt_on patrol is brace for A massive surge at adenine nonwalled area we will not let them through vauntingly risk Nancy and toss must approve boarder security and the wall,0.29411764705882354,0.5
we altogether benefit when youngster be allow with the opportunity to reach their potential,0.2889273356401384,0.700354609929078
its process keep the air_pressure on and dont let them get away with this,0.46186618057726647,0.44956719125042083
warm reception on with talking to the residents of,0.46186618057726647,0.44956719125042083
the contempt the Tory make shown parliament and the people of this body_politic demonstrates that they be not fit for,0.21626297577854672,0.39893617021276595
we need Medicare for all so that no person in America ever goes bankrupt surgery fall_behind their life over_again arsenic a result of the,0.46186618057726647,0.44956719125042083
climate alteration exist fuel in california if embody touch_on past the fires share your story at,0.08304498269896193,0.39361702127659576
trumps refusal to hold Saudi arabia accountable place A dangerous signal to the humans that U.S. will no longer head,0.46186618057726647,0.44956719125042083
prove the minimum salary from $785 to $12 an hour will make AN immediate difference in the subsist of the working class atomic_number_49 missouri support prop b because it paying_back some of the value workers create and deserve back to,0.2958477508650519,0.49645390070921985
this ca-ca for sober read as we battle to save our in the uk we are set to miss C reduction targets due to Tory take regenerate political carry_out and a government_activity not Hoosier_State the pocket of the fossil fuel industriousness,0.46186618057726647,0.44956719125042083
btc bear market over until these multitude,0.2958477508650519,0.6950354609929078
the blank has been acquire so big people commode financially stay inwards that ecosystem making them cryptolifers,0.2958477508650519,0.6950354609929078
Teresa may has agree something which she aver United_Kingdom_of_Great_Britain_and_Northern_Ireland prime minister could of_all_time same brazen deception,0.46186618057726647,0.44956719125042083
there be no reason_out for these massive lethal and costly forest fires in california demur that forest management is thusly poor billions of dollars follow throw each year with so many lives lost all because of gross mismanagement of the forest cure now or no_more more FRS payments,0.1903114186851211,0.35815602836879434
i say to the walton crime_syndicate of walmart the American people live sick and tire_out of subsidizing your avaritia get off of,0.3079584775086505,0.7074468085106383
holyrood bequeath ballot on scottish toil design to end the privatisation our railways later if you believe,0.7006920415224913,0.2765957446808511
hello my twitter friends this follow my daughter gracie whos get bully and picked on at school being told shes,0.28719723183391005,0.48404255319148937
diversity is our country greatest strength were gallant that our newlyelected democratic member of congress ponder that,0.46186618057726647,0.44956719125042083
forthwith thats what were talking near lets keep_back at IT,0.08131487889273356,0.37943262411347517
thanks to my friend repelect for spreading the good Holy_Writ about our campaign,0.46186618057726647,0.44956719125042083
iodine hope the discovery and eventual recovery of the argentine submarine san juan brings need closure to the tremendous families of those brave miss crewman i calculate forward to hearing more from my friend prexy in argentina subsequently this month,0.8131487889273357,0.13297872340425532
wow to 2014 this one weekend launched so many thing thank you and our entire team_up what a journey,0.46186618057726647,0.44956719125042083
trump be pulling out of the inf accord this is ampere dangerous step making conflict more not to_a_lesser_extent likely i urge the,0.29930795847750863,0.7127659574468085
it exist my great honor to host A conference on supporting veteran armed_services everyone here today who has served our country in undifferentiated to every veteran military family across our land i require to express the eternal gratitude of our intact Nation,0.4844290657439446,0.7092198581560284
last night tory mps blocked the release of the governing own analysis of the impact of universal they deprivation to cover up how information_technology devastating masses cant go,0.6280276816608996,0.12234042553191489
rise across millennium bridge begins those who have attended the wreath laying now making their way towards,0.28546712802768165,0.48936170212765956
is AN american hero she gave this spoken_communication 275 fulfil have been plan for tuesday nov 20th to,0.46186618057726647,0.44956719125042083
this exchange w/ is worrisome but non surprise this is overbearing strongman behavior dangerous for our democracy keep doing what you are doing yamiche my ask below,0.27854671280276816,0.4875886524822695
in office but non indium power,0.2768166089965398,0.49113475177304966
if they arrange become incredibly rich then ace invite them to be happy with their wealth only also to parcel information_technology deoxyadenosine_monophosphate bit by,0.46186618057726647,0.44956719125042083
this is information_technology Democrat this weekend represent the last push to catch our communities ready for election day time to hustle go to and sign up to volunteer this weekend so we tooshie take some major wins on tuesday,0.7058823529411765,0.4946808510638298
important new report from evince the disruption between housing haves and havenots make_up growing IT why,0.28719723183391005,0.28191489361702127
cnn political analyst my heart has be restored IT is the end of oneparty rule inch the united states,0.8650519031141869,0.22163120567375885
new book spygate the attempted sabotage of donald j trump is terrific he sturdy He smart and helium really puzzle IT his playscript is on sale now i highly recommend,0.4982698961937716,0.0425531914893617
regulation alert bureaucrats deprivation to bring_down europeanstyle socialist drug price controls on American_English your formal comment telling bureaucrats to reject socialist price controls now,0.3892733564013841,0.9219858156028369
since the stallion nation is surety to mcconnells leave on whether to bring to A vote operating_theater non everyone not just,0.28719723183391005,0.4946808510638298
these disgraceful power catch have to stop the people made their voices heard and republicans rich_person a tariff to listen,0.28719723183391005,0.4946808510638298
this off-white harbor memorial Day join us in retrieve and honoring the life-time we lost 77 years agone,0.7249134948096886,0.5106382978723404
theres too much at stake atomic_number_49 this eld midterm election to sit on the sidelines were vote to protect our your friends and family_unit how were dedicate to effect modify with this free downloadable poster,0.8062283737024222,0.11879432624113476
UN expand along to illegalise criticism of UK moldiness not agree,0.46186618057726647,0.44956719125042083
the top ten coins i have seen shilled to the lower,0.8217993079584776,0.12234042553191489
and i harmonise on much but this touched me,0.48788927335640137,0.06205673758865248
the people Hoosier_State this van be human_beings political water_parting stop some from visualize that stop people from seeing their own,0.031141868512110725,0.17375886524822695
we standstill for convert for AN economy that works collaboratively and closely alongside our european partners for an,0.49480968858131485,0.7358156028368794
senator reach two-way deal to ease condemn natural_law the new House_of_York times,0.02422145328719723,0.1524822695035461
this coincidentally time interference be another blatant attempt by the establishment to essay and block the,0.18166089965397925,0.12056737588652482
today establish a call for certify as part of planning commission create to stomach our visual_sense of a novel,0.46186618057726647,0.44956719125042083
the failing to back the Swansea bay tidal lagoon visualize was the wrong decision for our economy the wrong decision for job and the wrong decision for the future of our bequeath back why,0.46186618057726647,0.44956719125042083
good morn inkiness Friday deal comes At angstrom_unit price under capitalism retail is becoming angstrom god-awful landscape for,0.3875432525951557,0.37943262411347517
A when 3 core components of a tribal identity race religion and geographics delineate your political parties in,0.4982698961937716,0.12943262411347517
sen knew that amendment 74 comprise a intrigue by corporate interests to bankrupt the posit knew IT WA too and voter cease up seeing through IT goodby amendment,0.9186851211072664,0.39184397163120566
today we remember the endure action of our troop and those of our allies during wwi honored to be pass this Clarence_Shepard_Day_Jr.,0.07785467128027682,0.38120567375886527
to all those who offer relieve_oneself speech_sound calls tap on doorway put up star_sign made text messages donate drive,0.46186618057726647,0.44956719125042083
until last night CO constitution inactive read that thither never beryllium in this state either thralldom or involuntary servitude except type_A antiophthalmic_factor penalisation for exception now thank to this amendment atomic_number_102 slavery period,0.49480968858131485,0.7677304964539007
we would bring_through million of dollars if the democrat would give us the votes to build the bulwark either way mass bequeath non Be permit into our country illicitly we volition close the entire southern border if necessary as_well stop the drug,0.5986159169550173,0.08333333333333333
quadruplet atomic_number_49 fact there cost no evidence indicate that the dispute between the reduce time and yearner sentence ensue Hoosier_State,0.7975778546712803,0.010638297872340425
batten_down on the quisling and the for a political rebellion through the ballot boxwood,0.46186618057726647,0.44956719125042083
each of robert muellers core public_prosecutor has A specialness like political putrescence hack surgery money laundering many of,0.2768166089965398,0.4929078014184397
dick at night working form_of_address will represent premiering on the heelturn network tonight at octonary eastern with and,0.0,0.4858156028368794
macron nationalism is the exact opposite of nationalism patriotism is a treachery of patriotism by saying our,0.2958477508650519,0.4875886524822695
i summate a video to a play_list new q positive five signal globalism be going down,0.29238754325259514,0.4787234042553192
brandon judd of the national border police council is powerful when he say along that the democrat root_on laws piss it tough for US to layover people at the border must embody chanded simply i make_up bringing out the war_machine for this national emergency they will be end,0.3027681660899654,0.6950354609929078
whatever you want to say about neoconservative they dont actually believe their own propaganda leave that up to their goofball conservatives allies,0.7024221453287197,0.2783687943262411
current and sometime college democrats all across arizona set in so much effort to elect Democrat this Nov from our,0.46186618057726647,0.44956719125042083
new research past the incur would gain lifetime wage for Medicaid recipients,0.6038062283737025,0.40070921985815605
trump thunders At media for smear his helper after bomb mark via,0.8114186851211073,0.12056737588652482
1 added a video to a playlist massive information dump exposing the swayer of reality,0.4982698961937716,0.7056737588652482
labour have bent out an alternative plan for A sensible jobsfirst brexit lot that could win support in parliament and,0.29930795847750863,0.7074468085106383
nowadays is a twenty-four_hours for dont upright donate on bring_together A movement,0.46186618057726647,0.44956719125042083
they have real done a great job in capture my longheld view and idea this Koran is on sale now a rattling register of axerophthol really interest subject,0.46186618057726647,0.44956719125042083
everything you need to make_out about Mr. Crataegus_oxycantha not truly leaving the atomic_number_63 pulling_out correspondence,0.2750865051903114,0.4929078014184397
hillary clinton non do presidential herewhich iodin guess be alright since she will ne'er atomic_number_4 president,0.46186618057726647,0.44956719125042083
we are being betrayed dont pay_back mad get even the fightback now for as little equally per ukip now,0.4930795847750865,0.274822695035461
so cool to see and together atomic_number_85 the mississippi meridian on,0.2889273356401384,0.48404255319148937
so fishy to encounter the cnn fake suppression canvas and faithlessly rhetoric catch for real outcome Tues we cost lucky grade are then low fall for the suppression game turn out vote call_up we now have possibly the great economy jobs in the history of our country,0.28546712802768165,0.4769503546099291
congrats along the bring_home_the_bacon cool thing nearly this race the dnc made significant investment in latinx and africanamerican organizing efforts across the body_politic communities of color are lead the agitate to turn our land around,0.46186618057726647,0.44956719125042083
this deal fulfil our six tests surgery the needs of our has laid KO'd AN alternative plan which assign jobs and living standards first,0.6314878892733564,0.06560283687943262
together we be construct america safe and with_child again,0.2820069204152249,0.49113475177304966
watchful has discomfited republican randy hultgren lauren undergrowth comprise vitamin_A millennian registered give_suck and one of the youngest grim women elected this_evening if youre as tickle_pink angstrom_unit we be that shell personify bringing her talents and ability to the house,0.050173010380622836,0.5975177304964538
planetary_house Republican ar stress to block A vote on the yemen war and they call themselves prolife hypocrisy much via,0.46186618057726647,0.44956719125042083
just day away from the most impactful election of our lifetime and if we want axerophthol mn that works for wholly of uranium,0.46186618057726647,0.44956719125042083
this is how theresa may throw the land into even further disarray,0.46186618057726647,0.44956719125042083
happy thanksgiving from wholly of us At dsam4a,0.2629757785467128,0.4804964539007092
i am now on you can keep up to date with my activity and what up to below,0.06920415224913495,0.375886524822695
if the democrats think they constitute sledding to waste taxpayer money investigating us at the house level then we will likewise embody forced to consider investigating them for all of the leaks of classify information and much else at the senate level two rear trifle that game,0.1903114186851211,0.375886524822695
just learned that the san diego office of our collaborator was burn down include a pile of,0.46186618057726647,0.44956719125042083
I odor a presidential operate,0.828719723183391,0.13120567375886524
transgender member of our armed personnel deserve to be treated with the Sami respect dignity a any former service member this administration cannot continue to discriminate against our troops free-base on World_Health_Organization they love how they identify,0.27162629757785467,0.48226950354609927
i merely pick_up that up to 40% of people released from prison subsequently being wrongfully incarcerated receive *no*,0.49480968858131485,0.17553191489361702
held out for direction too a_good_deal under and we got on with,0.6920415224913494,0.2712765957446808
your voting make this happen,0.46186618057726647,0.44956719125042083
president lunar_month and president trump_out reaffirm their commitment to closely,0.3166089965397924,0.48936170212765956
we shouldnt be turn our backs on children who be seeking safety and angstrom_unit good life the trump administrations immigration policy are shameful,0.3079584775086505,0.7056737588652482
it crook out that the billionaire who apparently have the bulk of the British urge_on like uranium one little online and on the doorstep our peoplepowered movement will transubstantiate britain,0.6920415224913494,0.6843971631205674
Georgia voters this is angstrom really important thread,0.29238754325259514,0.4875886524822695
net_ball play IT home_plate florida,0.46186618057726647,0.44956719125042083
truly want to live part of A society that is run to be yokelish and not return Pine_Tree_State what be audience,0.2664359861591695,0.4858156028368794
forget to do down to islington young launch party on the 15th / 730pm+ prince alfred marlborough,0.7093425605536332,0.7109929078014184
the sozzled leftie elites embody cabal to buy brexit from brits while pretense to represent the hoi_polloi,0.6833910034602076,0.2907801418439716
president trump in 2017 we never again will sacrifice ohio jobs and those indium other United_States_Department_of_State to enrich other,0.2906574394463668,0.2730496453900709
blab_out around immigration this genial of compassion is a far scream from the hatefilled rhetoric of today,0.7439446366782007,0.23049645390070922
democrats embody trying their gruelling to brush_aside the public demand for singlepayer muster instead around deficient public,0.46186618057726647,0.44956719125042083
the City_of_Light accord work out thus well for paris protests and wow all over Jacques_Anatole_Francois_Thibault people do not require to pay large sum of money much to third_base world countries that are questionably run in order to maybe protect the environment chant want erotic_love Anatole_France,0.46186618057726647,0.44956719125042083
dont young_woman the chance to get a free cryptocurrency the colligate below to download cryptogiveaway bounty or use the promo codification zero to catch AN extra bonus from me the give_voice and get more_than coins,0.46186618057726647,0.44956719125042083
thrilled to spend the day with 100 chief_executive_officer talking about how they hind_end do more on diversity cellular_inclusion,0.671280276816609,0.7127659574468085
has spent Thomas_More time negotiating with her possess system_of_macrophages than the eu putting job the economy and aliveness,0.06920415224913495,0.35815602836879434
Taiwan talks are going very well,0.29238754325259514,0.4875886524822695
fantastic even in Charlotte north carolina with large nationalist dumbfound out and suffrage for and replay,0.28719723183391005,0.700354609929078
deputy throw a grannys cotton candy for meth high bond keep her imprison for months via,0.19204152249134948,0.4929078014184397
phrase every announcement astir the on-line retailers decisions American_Samoa amazon the company that so raspingly penalize,0.27854671280276816,0.7092198581560284
im thankful for every day Hillary Clinton is non chairman,0.46186618057726647,0.44956719125042083
watch live at labour party conference equally she outline how the succeeding labour government volition rebuild our economy so it works for the many not the,0.46186618057726647,0.44956719125042083
bewitching about neocons embody that unlike stodgy conservativist they really have a messianic vision of the world and angstrom_unit will to enforce information_technology you can study and instruct from neocons not very_much to discover from bob dole,0.7301038062283737,0.7074468085106383
the lie_down and leaking aside the people do the report besides bruce ohr and his endearing married_woman molly comey brennan clapper altogether of the many discharge people of the fbi represent listed in the report will the corruption within the dnc clinton push be exposedand so much more,0.7179930795847751,0.6950354609929078
kudos to on flipping 6th district georgians have elected to send one of the unassailable advocate for commonsensical accelerator reform to congress,0.30103806228373703,0.7021276595744681
anti fascists nope be pro European_Union thugs the line to the peaceful well organise brexit means exit rally down the road,0.157439446366782,0.21631205673758866
flip alert just flip one of the near competitive tail in the country blue to felicitate congresswomanelect gatekeeper on her win,0.46186618057726647,0.44956719125042083
i have be in active politics for over 26 age my get is to reconstruct democratic government under our,0.21972318339100347,0.4929078014184397
this make_up a bad plenty which isnt in the interest of the whole country,0.46186618057726647,0.44956719125042083
tonight we should be voting along Agnes_Gonxha_Bojaxhiu botched brexit take just to avoid a resounding overcome she pulled the vote At the very last instant,0.46186618057726647,0.44956719125042083
