break have gain reelection to the United_States_of_America senate char be leading the way tonight,0.5034602076124568,0.28368794326241137
we border we protest now we confirm your canvass put astatine and lets get set to demo up astatine the poll like never your downloadable poster today,0.49653979238754326,0.2925531914893617
worker rights be under threat from the Tory botched brexit address,0.6833910034602076,0.700354609929078
remember florida i have be chairman of the joined states for nigh two class during that time senator bill Horatio_Nelson call me once haystack Scott called constantly requesting dollars plus for Everglade_State did a great speculate on hurricane vote scott,0.46186618057726647,0.44956719125042083
the idea of a european armed_services work out too well in ww single or ii just the us was there for you and always leave be altogether we ask is that you pay your fair share of North_Atlantic_Treaty_Organization germany follow paying 1% while the U pay 43% of a much with_child gdp to protect European_Community fairness,0.46186618057726647,0.44956719125042083
sick exist support im rebooting operative on A very worry protrude like_a_shot,0.2560553633217993,0.49113475177304966
i wait to see which stories you beam a light_source on atomic_number_49 the next optimist issue I live thrill to,0.7249134948096886,0.28900709219858156
this president have been inane heartless and gutlessto demonize this ragged band of refugees as a scourge to the,0.3373702422145329,0.4769503546099291
seeing all these twirp about the bout to personify folding clothes and,0.3027681660899654,0.6932624113475178
glucinium there to show you want to dump the deal that brexit imply issue this is only_if pro brexit mobilise to be held,0.46186618057726647,0.44956719125042083
the memorialise on living staff increase inward violent,0.754325259515571,0.2695035460992908
Paul George_Stephenson made an outstanding contribution to british history he play a leading function Indiana the fight against racism and is adenine hero of the civil rights honoured to pay testimonial to him now as we mark black history,0.6868512110726643,0.7092198581560284
as A life prospicient tory voter ace herewith toast my future vote to your secure self Mr. batten,0.7024221453287197,0.6117021276595744
senate republicans just confirmed a mood denier to regulate our energy grid Claude_Bernard mcnamees industry ties and,0.46186618057726647,0.44956719125042083
rotherham council given child ring rapists access to nipper stomach of perennial dishonour against the like of their,0.5,0.9432624113475178
before the intellectual dark network total along we never encountered fearless outsidethebox comment same this,0.46186618057726647,0.44956719125042083
lingo delay to turn thing around past *checks notes* working 100 minute a week Hoosier_State the trust of eventually trade myself to,0.2837370242214533,0.274822695035461
antic even in florida with corking patriot atomic_number_85 angstrom beautiful get out and so we can keep stimulate america safe with_child again,0.46186618057726647,0.44956719125042083
mainland_China arrange non want tariff,0.46186618057726647,0.44956719125042083
couldnt make this up we need public ownership of our railways,0.2958477508650519,0.7021276595744681
according to candace o conservatism = opportunity to get rich,0.46186618057726647,0.44956719125042083
fact if atomic_number_49 line to vote when your canvass localize closes you still get to cast your ballot if you run into any issues astatine the polls hit up our voter protection hotline at 8333368683 get your back,0.46186618057726647,0.44956719125042083
ampere the first female governor of Iowa cut tax balance the budget with a 127 m surplus fostered a,0.46186618057726647,0.44956719125042083
single make_up glad that my friend and the protestors in French_capital have correspond with the conclusion i reached two years ago the paris agreement be fatally blemished because IT raises the price of energy for responsible country while hush_up some of the worst polluters,0.01730103806228374,0.044326241134751775
over X year would plan 100% renewable federal line decarbonizing,0.46186618057726647,0.44956719125042083
young people everywhere are speaking truth to power unrivalled girlfriend story of fighting for our planet,0.46186618057726647,0.44956719125042083
happy birthday congresswoman because of your unapologetic fierceness and that of other foremothers cold_shoulder,0.3079584775086505,0.6932624113475178
the reality of Granite_State under the SNP be very different from nicola party league hot_air,0.02422145328719723,0.14716312056737588
we know tobacco be one of the biggest killer and until_now few smoker nowadays kick the habit after year of tory cutting_off to,0.46186618057726647,0.44956719125042083
this forebode became intertwined with the universalization of higher education which pass_off atomic_number_85 the same period equal your to the middle it was also a time and place of trespass and debauchery allnight keggers random hookups and general idiocy,0.46186618057726647,0.44956719125042083
should someone convict of murder group_A a teen follow write hit constantly the suprct receive noted that juvenile Einstein,0.7889273356401384,0.2553191489361702
let remember that kavanaugh be the character of judge who would have been propose in a jeb bush administration nevertrumpers like erickson gumption correctly that horn is defend their battle,0.7854671280276817,0.25
in_concert considerably rebuild U.K. for the many not the few,0.46186618057726647,0.44956719125042083
shouting from the are still separating families,0.6937716262975778,0.6932624113475178
were approximately to see WHO in_truth here for the engineering,0.8217993079584776,0.24645390070921985
of course we should have get osama binful loaded long before we did i bespeak him out in my volume only before the attack on the mankind switch center president Clinton splendidly missed his shot we paid pakistan billions of dollars they ne'er severalise U.S. atomic_number_2 was living there fools,0.28546712802768165,0.7163120567375887
so many multitude ive talked to atomic_number_49 DC ended the last week give said roughly version of this the 10 twelvemonth timeline to reverse,0.3217993079584775,0.7145390070921985
thither is adenine rumour put out by the Democrat that kid hawley of Missouri left the arena last night early IT is fake news he met Pine_Tree_State astatine the plane when ane arrived spoke at the great rally stayed to the very end in fact i say good-bye to him and left before he did magic,0.46186618057726647,0.44956719125042083
cook A planet and live on,0.7906574394463668,0.24822695035460993
the debate aka a televise pantomime between two remainers contention concluded how to betray 174 million people,0.7179930795847751,0.7021276595744681
ukip deputy chair destroy a remainers tilt about the uk paying IT dues to the,0.7283737024221453,0.2854609929078014
OR just reelected as their regulator which mean sending ampere cleaning_woman back to their mansion for another four geezerhood,0.8200692041522492,0.11524822695035461
stay in in in inward inch inch in inwards in,0.7474048442906575,0.26595744680851063
mrs may vassal state fakebrexit have torpedoed the theory of a trade_in cope with the usa for the sake of our,0.46186618057726647,0.44956719125042083
yesterday we experienced voter suppression in Louisville GA get ampere whole busload of beautiful Negroid elders,0.6885813148788927,0.7056737588652482
if person equal to require me the most based concern and impactful mainstream conservative observer the answer is well-heeled tucker will last places the others and He can be sharp and witty A definite improvement over the_great_unwashed like bill,0.46186618057726647,0.44956719125042083
thank you for bringing your super duper serious reporter face and voice to,0.46186618057726647,0.44956719125042083
oopsthat be suppose to be,0.46186618057726647,0.44956719125042083
the service penis who exit that day included brave youthful marines exactly out of high school accomplished officers in the middle of their military careers and muster_in men who had wait_on in theatre totally terminated the world,0.7785467128027682,0.25177304964539005
now put_down out our imaginativeness to rebuild britain for the many not the hitting the street along,0.21107266435986158,0.4946808510638298
president linked by hour_angle officially pardoned this years national blessing turkey,0.7698961937716263,0.6702127659574468
today At george duracks funeral we derive together to celebrate his extraordinary was A socialist second world war ex-serviceman postie trade unionist and learnt so much from George and we cannot thank him enough for everything he did,0.46186618057726647,0.44956719125042083
local authorization have had their budget cut_down since 2010 and are skin to provide the services our community_of_interests have to organise At every level to fight these shorten and i welcome the campaign,0.7802768166089965,0.24468085106382978
big look_at alert get your holiday gifts from the alone stock where 100% of the proceeds ecstasy toward electing democrats at every raze its all available online astatine 20% off today with code fridaysale at checkout_time,0.15397923875432526,0.8599290780141844
atomic_number_4 like these guysvote your voice on nov sixth,0.29411764705882354,0.49113475177304966
brilliant op ed by about intentional fear huckster he is in fact committing shammer by,0.6799307958477508,0.7198581560283688
this be why we need your support please tweet to,0.7785467128027682,0.23581560283687944
what the hell is this,0.7716262975778547,0.2641843971631206
worker under labour will get full legal rights such axerophthol sick pay vacation and parental leave protection from dismissal,0.46186618057726647,0.44956719125042083
batten on our ability to reduce our own food prices outside the eu and help developing nations,0.2958477508650519,0.48226950354609927
big oil billionaires spent $100 gazillion last election to stay climate action at_once mobilize their lobbyists to,0.4982698961937716,0.6843971631205674
dnc chair IT the vote of your lifetime get out there and vote helium said confirm your poll placement at and cook your voice hear this allow take back our democracy,0.46186618057726647,0.44956719125042083
some inspiration from civil right legend,0.2889273356401384,0.2925531914893617
i am bore to see the senate lick on the step more than 95 percent of the americans currently immure will,0.7906574394463668,0.26063829787234044
its non ampere blue wave we are indium a blueness hope have live that the antibodies would kick atomic_number_49 that this infestation of hate and division would drive response from the American multitude in both parties and say No more,0.2889273356401384,0.5088652482269503
the people who equal life their best life are count along you to be faineant theyre depend on you to not get to vote the_likes_of our endure bet on information_technology,0.46186618057726647,0.44956719125042083
today launch help you contact your mp to ask them to drop_a_line to the Tory governing demand they protect the post part offices are the centre of our high streets and A labour government will protect them,0.7179930795847751,0.7109929078014184
sidesplitter if a conservative said this they would be boycott and not allow_for back Hoosier_State the public bowl Hillary say,0.46186618057726647,0.44956719125042083
my latest video along the and wherefore you should join,0.07785467128027682,0.3882978723404255
Monday atomic_number_85 7pm cum phone bank for and nationwide endorsed candidate for California assembly district,0.04325259515570934,0.1702127659574468
trump has film the sling and pointer of a subversive changeagent while not actually changing anything policywise would thing comprise so different if jeb have be elected inch 2016 non really if AN literal vision I hear it,0.5034602076124568,0.4858156028368794
i need the hoi_polloi of west virginia to send A message to chuck schumer maxine amnionic_fluid nancy pelosi and the chemical_group,0.46186618057726647,0.44956719125042083
its time for the wealthy to pay their fair share of tax soh campaigned for berkeley measurement p to act upright that information_technology increases the property tax for dimension transfer over $15 zillion so that everyone else can throw better city,0.46186618057726647,0.44956719125042083
ukip membership is presently over 26000 with raw applications be processed,0.32698961937716264,0.7092198581560284
most reveal about gavin down from the gallant video is that clearly learned zero from the the whole affair,0.46186618057726647,0.44956719125042083
richard spencer will be link_up jf on the public space on Saturday november 24th At 700 pm est,0.2975778546712803,0.475177304964539
boils my origin to see the horrible habitability conditions of nonrent control flat owned by slumlords World_Health_Organization then,0.25259515570934254,0.48404255319148937
totally net the president thank you,0.46186618057726647,0.44956719125042083
compass_north Carolinas democrat paula dance made story today she was sworn Hoosier_State as the 1st African American adult_female sheriff in,0.46186618057726647,0.44956719125042083
gavin e'er played a double game on 1 hand he Evergreen_State the ultimate defective son bashing women's_liberationist and transsexual with abandon on the other hand he was the ultimate good boy the,0.46186618057726647,0.44956719125042083
congratulations to ron desantis on becoming the Modern governor of florida against all odds he defend fight contend the termination be a historic victory he ne'er gave up and never will he will be amp great governor,0.7024221453287197,0.6737588652482269
the trump admins push to classify trans people out of existence puddle IT clearer than ever that the rights and,0.46186618057726647,0.44956719125042083
the people entrust the tories in 2017 to save brexit they fail also we make the mistake of not running nominee against Tory brexiteers next time we will running candidates in every constituency,0.29238754325259514,0.49113475177304966
just flip_out a kansas sign seat from red to blue with her win tonight inward ks03,0.71280276816609,0.25
have A fantastic brexit perfidy brexit means exit beat_up in whitehall today thousands of decent patriotic people,0.46186618057726647,0.44956719125042083
government have respond to the petition against uns global compact_car for migration and predictably,0.46186618057726647,0.44956719125042083
have a really expert conversation with the newly elected president of brazil jair bolsonaro who won his speed aside a substantial gross_profit_margin we agreed that brazil and the united state will work close together on trade war_machine and everything else splendid call bid him congrats,0.24740484429065743,0.4734042553191489
ukip loss_leader speaks to or_so brexit and theresa May,0.49653979238754326,0.28368794326241137
americans embrace the concept that imprisonment is for masses were afraid of not those live mad at be we afraid of americans World_Health_Organization pay a fine Oregon court feature to take angstrom via,0.801038062283737,0.09929078014184398
out here w come for your neoliberal climate insurance_policy,0.0657439446366782,0.6117021276595744
president trump hang the American commemoration ceremonial at suresnes american graveyard,0.46186618057726647,0.44956719125042083
A federal bill so it encroachment only citizenry in Federal prisons but it helps hundred percentage of those locked up all would earn skilful time credit now 100k would personify able to earn their means home Sooner and in_that_location constitute other skilful stuff for women nyt says biggest bill IN generations,0.2664359861591695,0.4769503546099291
youth prole cause amazing things to transform the go of Young theyve be deserted aside the Tory with backing pop 62% since explains how well invest in the talent of all our young,0.27162629757785467,0.48936170212765956
illegals can drive up to $3874 a month under Federal assistance program our social protection checks are on average,0.46186618057726647,0.44956719125042083
i stand with instructor on come_upon for amp fair Crataegus_oxycantha teachers have be asking,0.46186618057726647,0.44956719125042083
all_over the past year scottish labour has stood up for our nhs school and lifeline we leave,0.6833910034602076,0.7127659574468085
be i wrong to empathize with the sentinelese,0.33391003460207613,0.49113475177304966
the park new deal be one of the most insurance_policy interventions from the democratic,0.7197231833910035,0.7092198581560284
my brief thoughts the first ill-treat act will bring real justice to thousands of incarcerated women,0.8027681660899654,0.19680851063829788
possessor are scrap unconstitutional laws indeed they commode do business in fort Franklin_Pierce fl via,0.7335640138408305,0.28191489361702127
freshly aboriginal community have shaped our history for generations proud that the sum of our,0.27162629757785467,0.4716312056737589
today on we commend and honor those who have selflessly suffice and sacrifice those WHO have and,0.46186618057726647,0.44956719125042083
looking onward to organism with the bush family this is non a funeral this represent a day of celebration for A great man who take_in lead a tenacious and grand sprightliness he bequeath be miss,0.6764705882352942,0.675531914893617
its actually selfsame offensive that they think they can come Hoosier_State A outsider with close_to shit journo resumes and,0.7923875432525952,0.2322695035460993
president trump and Florida_key senator are press republican leadership to act along type_A longawaited United_States_Senate bill called the,0.7197231833910035,0.25354609929078015
on 1128 mood finance sidereal_day nyers will birdcall on nyc to divest from banks that fuel climate change and invest in,0.46186618057726647,0.44956719125042083
a labour politics will ban fracking immediately,0.7110726643598616,0.49645390070921985
atomic_number_53 look forward to my meet with purge schumer nancy pelosi in 2006 democrat vote for amp paries and they be right to do so now they no tenacious want frame security they will fight it at all price and nancy moldiness get votes for speaker only the wall will get build,0.29238754325259514,0.648936170212766
when it comes to class ane could never retain a cd to either of my parents especially not my mama but i will try to keep make_out what they both teach me,0.46186618057726647,0.44956719125042083
we were able to give out 80 vaccinum At our influenza shoot clinic today give_thanks to our healthcare working group for,0.5224913494809689,0.6950354609929078
once again remuneration maturation failed to break out make it even harder for these firmly working American to make end meet,0.46186618057726647,0.44956719125042083
at least i child deoxyadenosine_monophosphate 20monthold Guatemalan girl named mariee died after falling sick IN federal custody and even those,0.28027681660899656,0.6985815602836879
that say tucker has evolve a routine over the yesteryear year a which reveals his deep principles and linear_perspective i must admit hand comprise starting to become information_technology has always been deficient,0.6833910034602076,0.7021276595744681
black women are leading the charge to make our country group_A good place for completely Army_of_the_Pure follow their lead to make sure live the next governor of Empire_State_of_the_South,0.2768166089965398,0.6914893617021277
your friend joe shmoe might consider economics is bore but thats exactly what the rule family wants as_luck_would_have_it we,0.6833910034602076,0.7039007092198581
this move was led aside black kinsfolk whose loved ones get kill by police it Washington extend by black char and it represent won,0.7785467128027682,0.08687943262411348
today chump 82 years since the battle of cable street when socialist stand with the jewish community against fascist i comprise lofty to talk at the 80th anniversary 2 years will always stand with Jewish people against hatred and class and resist the far right today,0.46186618057726647,0.44956719125042083
IN the sixth richest commonwealth in the world-wide No child should go hungry this christmas or why im proud to support the end hunger feed A family christmas,0.8200692041522492,0.24645390070921985
ane am A tariff man when the_great_unwashed or state come in to raid the keen wealth of our nation one want them to pay for the favour of doing so it will always be the good way to max come_out our economic power we are right now contain in $billions in tariff make United_States_of_America rich_people again,0.46186618057726647,0.44956719125042083
to those Indiana the caravan reverse we are non let people into the unite states illegally go back to your res_publica and if you want practice for citizenship like millions of others are manage,0.4982698961937716,0.2765957446808511
and utmost but not least building for the long term why invested in serving elect democratic candidates for attorney general and secretary of state across the country this year to assure fair elections In the future,0.07439446366782007,0.3900709219858156
when it come to women of vividness candidates folks just talk about vitamin_A glassful cap what they describe be a,0.46186618057726647,0.44956719125042083
base on the fact that the ships and sailors induce not been returned to ukraine from russia i have decided information_technology would be comfortably for completely party concerned to cancel my previously schedule meeting,0.32006920415224915,0.4698581560283688
atomic_number_85 crystallization clear that whilst for Mother_Teresa may the up austerity comprise non and testament never be over until,0.7647058823529411,0.23581560283687944
on Mon dec 3 At 7 Pm were entertain type_A interior town hall along mood change an effect that does not get almost,0.31141868512110726,0.4875886524822695
today direct to the us/mexico border at san ysidro to see with asylum seekers to hear their stories and observe,0.34256055363321797,0.5106382978723404
great meetings with latin American_English and European leadership during inauguration discussing trade brexit climate justice and how to licking the far right and record how radical reformist politics commode improve the lives of millions,0.29930795847750863,0.5212765957446809
9 brave survivors experience spoken out almost their experiences of alleged sexual harassment while play,0.7058823529411765,0.6826241134751773
viii years of austerity has damage our economy and visit excruciation on our communities next budget,0.7214532871972318,0.4858156028368794
an incredible range of new tech tool_around coming from campaign veteran_soldier to silicon valley putting the best unity into the hands of our candidates include and more on the tool using to win,0.8044982698961938,0.13120567375886524
changing the world ecosystem pullulate beyond $12 billion in 80 days,0.5,0.7535460992907801
is last chance this session to turn away from failed policy deoxidise size/scope of federal prison system protect class and fete mitch mcconnell now via,0.33391003460207613,0.6223404255319149
I wish adenine picture luciferian world order plus missing trinitrotoluene beltane false flags,0.7214532871972318,0.26773049645390073
gear_up to stand with for and being able to experience type_A medico,0.46186618057726647,0.44956719125042083
and i ready to cover vitamin_A recordsetting midterm on vote vote vote make_out to celebrate,0.46186618057726647,0.44956719125042083
IV more democratic socialist on the WA dc consultative neighborhood commission thank to,0.6660899653979239,0.5053191489361702
the UN migration constrict which search to criminalise all criticism of Mass migration and completely change the definition of A refugee will be gestural aside many world leaders adjacent week without ever consulting their citizen,0.46186618057726647,0.44956719125042083
bitcoin maximalists are nationalists be one logical leap from bitcoin maximalists are Nazi Army_of_the_Pure haste up and get this,0.7750865051903114,0.25354609929078015
from pittsburgh to flint we know the cost of let private company manage our water systems for profit thats why organized to arrest it and they,0.46186618057726647,0.44956719125042083
the Tory have just harbinger theyre stick with asceticism wherefore IT a,0.3166089965397924,0.2765957446808511
i like A video Eos is a game changing tech with Marshall long of,0.7093425605536332,0.7021276595744681
out atomic_number_49 the pudsey constituency to formally establish the campaign to get elected in place of the current,0.46186618057726647,0.44956719125042083
this thanksgiving feed your top_dog past learning virtually the indigenous peoples whose nation you occupy,0.46186618057726647,0.44956719125042083
help United_States_of_America and pray for America merely and our many allies May acquire 100k human_being beings locked IN federal prisons the chance to,0.29238754325259514,0.2712765957446808
we are group_A heavy sovereign nation we have strong borders and will never accept people come into our nation illegally,0.27335640138408307,0.7109929078014184
$btc $bch be information_technology all fair group_A conjunction this,0.8217993079584776,0.16666666666666666
fake news the enemy of the mass,0.46186618057726647,0.44956719125042083
thank you and you live sadly counterbalance,0.46186618057726647,0.44956719125042083
thanks to for uploading this amazing exposure to for free,0.7024221453287197,0.28191489361702127
of Pennsylvania be terrific he personify strong on the border crime the military our ex-serviceman and the 2nd amendment he embody A mighty vote for and loves the neat province of Keystone_State please set_about prohibited and vote for john he have my total and very unassailable warrant,0.29411764705882354,0.2765957446808511
