terrible gang of raging democrat look at their past and look where they number from the immediately $30000000 witch hunt retain and got nothing only ruined dwell where is the server Lashkar-e-Taiba these awful people go gage to the William_Jefferson_Clinton foundation and department,0.9290657439446367,0.49822695035460995
this camber go must reject the politics of division and the Tory toxic hostile environs,0.01903114186851211,0.06560283687943262
censorship in just closed down the loose thought project press for truth antimedia and century of,0.2906574394463668,0.4858156028368794
friends are on the one 1000 line and want everyone to voter_turnout republican tomorrow america is dorsum U.S.A. is winning,0.46186618057726647,0.44956719125042083
on and juncture to discus President_of_the_United_States trump message to,0.7249134948096886,0.2695035460992908
splendid comment from on the Young diverse and exciting democratic candidates who made history last,0.05363321799307959,0.5939716312056738
mrs may your deal is A treachery of U.K. and angstrom betrayal of time for you to the brexit fightback now,0.34256055363321797,0.09574468085106383
get out and vote for,0.6955017301038062,0.7109929078014184
today weve storied 100 years since women could stand to get since then 4503 men have been elected to parliament and only 491 have a long way to go and cant wait another 100 geezerhood for 5050 histrionics,0.06228373702422145,0.17907801418439717
be prepare to protect the voice of Wisconsinite,0.07785467128027682,0.35638297872340424
labour wont trigger a no confidence right_to_vote when we know information_technology will break_down itll answer only to strengthen Teresa may and,0.08304498269896193,0.38475177304964536
Republican senators need to rise up and vote for senate republicans here mitch mcconnell here via,0.46186618057726647,0.44956719125042083
dems gain control of the house this be amp win for our future,0.06747404844290658,0.19148936170212766
capitalism fuels mood change it is tenacious past fourth_dimension to divest from fossil fire but Michael bloomberg think information_technology make,0.71280276816609,0.7216312056737588
merriment fact Thomas_More wealth will be create in crypto over the next 10 years than over the prior 10 years only remember,0.740484429065744,0.20390070921985815
one was there when nosql was buy_the_farm to solve totally our computing constitute in_that_respect when the cloud be survive to solve our,0.5865051903114187,0.0797872340425532
nobody should be big off and nobody should have their home assign at peril because of universal system get to exchange,0.773356401384083,0.49645390070921985
A diverse slate of democratic cleaning_lady won up and down the vote close week direct A,0.7249134948096886,0.4875886524822695
to put this into context_of_use emmanuel approval rating is just 18%,0.46186618057726647,0.44956719125042083
ive ingest a united res_publica heart,0.46186618057726647,0.44956719125042083
this be thankful for everyone who forge tirelessly to carry so many Democrat to victory this year thankful that the newly congress testament be the to_the_highest_degree diverse IN history and grateful for entirely the public handmaiden fighting for a lustrous futurity for wholly,0.6072664359861591,0.22340425531914893
unfortunate statement why dont Republican wish about unsustainable spending and debt,0.03806228373702422,0.5886524822695035
we wont appropriate the trump administration and congressional republicans to take away woman access to reproductive health tutelage,0.24740484429065743,0.4698581560283688
is do a swell job for the people of pennsylvania he be strong along the border offense the military our vets and the 2nd amendment Lloyd has my full second,0.46186618057726647,0.44956719125042083
watch when they go low-toned we run vote when they operate dispirited we work ten eligible friends to suffrage dnc chair joint at gotv florida rally for and,0.46186618057726647,0.44956719125042083
shameful that the prime minister either know or care how many people from the windrush contemporaries lost their homes their jobs and were deny Granite_State hostile environs policy is a disgrace and labour will scrap it,0.6505190311418685,0.6985815602836879
Scott Oliver_Hazard_Perry of Keystone_State be fantastic he cost strong on the borderline crime the military our vets and the second amendment scott has my summate endorsement,0.6851211072664359,0.7127659574468085
our pledge to charter american include those leave prison_house and looking for amp rattling fresh get new chore and new living the legislation i be support today curb many significant reform read more here,0.32006920415224915,0.25177304964539005
Saul ryan should glucinium focusing on holding the majority rather than chip_in his opinion on birthright citizenship something He know nothing about our novel Republican absolute_majority will work on this conclusion the in-migration loopholes and securing our border,0.0986159169550173,0.3971631205673759
we mourn for the lives confused and we pray for the victims of the california wildfire ane privation to thank the fire_fighter and first responders for their incredible courage in the face of grave peril,0.4913494809688581,0.5585106382978723
we cannot reserve republicans to deny the fact that climate commute represent real,0.5155709342560554,0.7163120567375887
cross party brexit group declares it make_up preparing for a second referendum,0.27335640138408307,0.5177304964539007
with the escalating attacks on asylum seekers the migrant caravan needs our support now more than ever sign upward to,0.7231833910034602,0.28368794326241137
watch and talk_over the british phase_modulation hold_up a brexit vote and typeset to,0.26124567474048443,0.4858156028368794
believe in brexit our fightback must mean,0.3062283737024221,0.6134751773049646
let now acantha atomic_number_92 into action to feed our veterans the support they social contract for warhorse will guaranty them the chance to have A dwelling_house to heal and to retrain when they complete their,0.03460207612456748,0.624113475177305
i liked type_A video live us troop being used as human harbor in,0.46186618057726647,0.44956719125042083
why be my colleague being arrested for asking to and not leaving the capitol rotunda,0.06920415224913495,0.37056737588652483
harry Thomas_Reid when helium was reasonable agreed with United_States on birthright citizenship,0.46186618057726647,0.44956719125042083
indium all comeliness Nancy pelosi deserve to be choose talker of the house aside the democrat if they move_over her ampere hard time perhaps we testament add some republican votes she has clear this great purity,0.46186618057726647,0.44956719125042083
meanwhile this incubus isnt over for approximately of the kid outflank sort *months* ago A of 25 Kid calm_down,0.7577854671280276,0.6826241134751773
string comfortably be giving important update on the final years in_front election day at the dncs national faith outreach call today 10/31,0.46186618057726647,0.44956719125042083
ukips says there no plans for exconvicts to be in ukip unless the member of the business_firm of,0.0847750865051903,0.6046099290780141
in January house democrat will reflect the diversity of the multitude they lay_out,0.46186618057726647,0.44956719125042083
full clip hither there be 200000 people behind measure they have No hope no help we havent go_through a bill to help them,0.03633217993079585,0.2127659574468085
if the authorities cannot get A good brexit deal for this state then it should make way for those World_Health_Organization can,0.46186618057726647,0.44956719125042083
we literally make A week where every savant talked around collegeeducated and nonentity call_off them racialist merely when i talk about masses of color you call Maine that despicable name,0.29238754325259514,0.25886524822695034
aw shucks thanks you sleep_together youre blame when your boss is one of your closest ally and your team is,0.7197231833910035,0.6914893617021277
at i spotlight culprit of domestic abuse are using universal credit single household payments antiophthalmic_factor angstrom_unit tool for,0.46186618057726647,0.44956719125042083
we be at a historic second of possible deepen with the chance for the left to build a majoritarian fundament for,0.46186618057726647,0.44956719125042083
sit_down 11/24 vigil let them Hoosier_State solidarity w/ refugee,0.49480968858131485,0.6347517730496454
if trump hold his helper why should we defend him,0.46186618057726647,0.44956719125042083
working class oneness comprise rifle to need to be present in metropolis and towns of every size if were pass to wrest power away,0.2975778546712803,0.2783687943262411
LET give_birth A proper debate away now under wto aka actually leaving the eu A mass unsuccessful_person vote,0.30103806228373703,0.425531914893617
mays deal be the worst deal ever_so it be ampere complete and total betrayal of the masses she isnt fit for,0.7820069204152249,0.5177304964539007
the left in the us hold angstrom nearmonopoly on cultural ability in the us while the right dominates the country,0.07958477508650519,0.35106382978723405
you can accept socialism too,0.46186618057726647,0.44956719125042083
a bipartisan group of senator reached adenine tentative deal on the most material rescript of the condemn + prison,0.08823529411764706,0.10106382978723404
dsa endorses the san diego migrant and refugee solidarity coalitions external sun 11/25 claim to action for the fundamental American refugee exodus your chapter attending/organizing a solidarity action reply with A,0.2664359861591695,0.4875886524822695
the large and violent french protests make into account how mischievously the merge country has comprise regale on swop by the european union or on fair and fair payment for our smashing military protection both of these matter must be remedied soon,0.46186618057726647,0.44956719125042083
below labour the largest job volition pay A lilliputian bit more towards the common good,0.33217993079584773,0.5195035460992907
loved watchin you tell rainbow beckon on cnn such a happy idiom,0.6885813148788927,0.7074468085106383
I liked antiophthalmic_factor video former host admits pass_on wing bias in full voice_communication in,0.46186618057726647,0.44956719125042083
good-for-naught to disappoint owen etc more than ampere twosome of century brexiteers turn upward at the brexit means exit rally in central John_Griffith_Chaney today give_thanks you to the many thousands World_Health_Organization participate astatine the event to institutionalize vitamin_A clear message to this authorities to dump the deal,0.9100346020761245,0.4769503546099291
the future is distaff establish this post a similar to help United_States celebrate the incredible women across the country who have make history this twelvemonth,0.2958477508650519,0.38475177304964536
A vicious accuser of justice kavanaugh have only admitted that she follow lying her narrative follow altogether made up or imitation john you imagine if he become a justice of the supreme woo because of her wicked false statements what around the others where live the dems on this,0.5934256055363322,0.14361702127659576
my heart make_up restored too you legend,0.46186618057726647,0.44956719125042083
walked remote Hoosier_State brooklyn today after read about the give_notice out west and thought no it vernacular be that,0.7249134948096886,0.46808510638297873
dsa members are on the scene with weve follow lobbying progressives all sunrise asking them to support the,0.9152249134948097,0.48404255319148937
rule snappy bureaucrat desire to impose europeanstyle socialist drug price control on American your formal comment telling these bureaucrats to turn_away socialist price moderate forthwith,0.32698961937716264,0.4858156028368794
yes the uk does get a special stop arming Saudi-Arabian arabia and to help end the war in Republic_of_Yemen causing this humanistic crisis,0.6591695501730104,0.700354609929078
as you know earlier today in_that_location live deoxyadenosine_monophosphate horrific snap point and pour_down jewish americans at the tree of life synagogue in pittsburgh pennsylvania the shooter is in hold and Union authority get live dispatch to defend state and local police,0.24048442906574394,0.4095744680851064
now the ukip nec vote overpoweringly against A motion of no authority Hoosier_State the leader gerard batten,0.07785467128027682,0.39184397163120566
we slant let Republican_River efforts to keep American from get health forethought be successful ratify up today to get covered atomic_number_85,0.28027681660899656,0.4858156028368794
so good to listen my sire,0.657439446366782,0.0975177304964539
you just pay for it how trump and ocasiocortez think like via,0.46186618057726647,0.44956719125042083
mass 65 and older must have pretty good health indemnity,0.2301038062283737,0.28368794326241137
lack to fall_in the gift of socialism on our 501c3 sister organization dsa fund practise educational work this includes introducing Whitney_Moore_Young_Jr. activist to the history and tradition of democratic socialism,0.7231833910034602,0.23581560283687944
cnn is currently projecting that 96 woman will win seats in the house of instance a memorialise number,0.29238754325259514,0.5035460992907801
imagine thinking that natural_selection is not A human decently,0.46186618057726647,0.44956719125042083
whether you follow africanamerican hispanicamerican OR whatsoever American at totally you feature the right to live in antiophthalmic_factor land that put your needs number_1,0.46186618057726647,0.44956719125042083
republicans have created the best economy in the history of our land and the hottest job market on major_planet earth the populist order_of_business be axerophthol socialistic nightmare the republican agenda be the American dream,0.6557093425605537,0.38475177304964536
GOP senate it was explained that the opposition was floating adenine list of questions for senate,0.3096885813148789,0.6223404255319149
fresh w/ capital fund president/ceo lawson bader join adam to share stories from his youth about east germany and talk about the importance of charitable giving atomic_number_49 US here,0.6730103806228374,0.22340425531914893
we bear be work hard on this and only going to beat secure,0.26124567474048443,0.6737588652482269
this cyber Monday an important reminder that Amazon have ampere $20 million press with ice,0.46186618057726647,0.44956719125042083
we are encourage past the leadership slate that has been put forward aside the Democratic party especially the inclusion of,0.2491349480968858,0.375886524822695
one a little boy one complained to my mamma exactly have dinner cause we got chicken only,0.46186618057726647,0.44956719125042083
during the hiv outbreak of the 80s gay men be banned from giving blood in reaction the lesbians community in,0.46186618057726647,0.44956719125042083
yesterday we saw the wealthy flood thus many election with money making it goon for working division campaigner to eve compete thats why direct for a fair elections,0.46186618057726647,0.44956719125042083
make no fault climate change is here immediately across the body_politic extreme weather represent costing live devastating,0.2906574394463668,0.6081560283687943
and lie_with our area and the great state of minnesota they,0.7179930795847751,0.25
mays cope be not brexit we should follow out now under wto harness mean exit not the fight_down,0.04671280276816609,0.12056737588652482
the remainer establishment be never get_going to go_for the to brexit is being betrayed the,0.7958477508650519,0.2695035460992908
observe all of your comrades in mind this thanksgiving if theyre near or far we are all unity bad socialist family,0.7352941176470589,0.30319148936170215
legal_philosophy enforcement is face into another grown corruption scandal having to serve with election fraud Indiana and palm beach florida voted for sprain Winfield_Scott,0.28546712802768165,0.5141843971631206
Mother_Theresa may fair claimed Tory had set more money into this is just non true billion lost from adult,0.6418685121107266,0.6985815602836879
sign up for AN issue indium your biotic_community,0.050173010380622836,0.22695035460992907
the safety of the American_language people is my high priority i hold just concluded a briefing with the FBI section of justice department of homeland security_measures and the us secret avail,0.7283737024221453,0.2872340425531915
really happy to send you a content ibrahim so impressed with the work you make for brotherly_love,0.2422145328719723,0.3262411347517731
not much republican and democrats fit_in on these days only both position gibe we pauperization to decease the,0.7923875432525952,0.4734042553191489
swinge god bless the U.S.A. atomic_number_49 cape girardeau Missouri at,0.759515570934256,0.6347517730496454
fracking is amp burlesque for local_anaesthetic democracy bad news for the local environment and our climate and concerning for,0.7197231833910035,0.6613475177304965
the in the sexual marketplace of and postmonogamous club just so find to be all_important component of the democratic coalition,0.7958477508650519,0.4858156028368794
i wonder if our supremacist racist hitlerinchief donald best will ever deport antiophthalmic_factor many people as barack obama,0.7370242214532872,0.2801418439716312
China has concord to reduce and polish_off tariff on cars coming into china from the America presently the tariff be 40%,0.29238754325259514,0.49822695035460995
bridle out my latest articles,0.7110726643598616,0.6702127659574468
lay why this election be so important to democrats and our democracy,0.46186618057726647,0.44956719125042083
iii biggest lies spread about and drug crimes be inherently long prison sentences = less no 1 goes to federal prison for drug,0.6349480968858131,0.6719858156028369
mays deal be non brexit we should constitute out now under WTO rule means cash_in_one's_chips not the fight,0.46186618057726647,0.44956719125042083
we need A criminal justice system that prise the dignity and human_beings of women and girlfriend who are incarcerated we need a,0.7093425605536332,0.6684397163120568
scott perry of PA is fantastic he be strong on the butt crime the military our vet and the second,0.7370242214532872,0.450354609929078
new York passes minimum wage law for uber lyft drivers hikes costs to rider appalling to see such positive disruptors bewilder whittled fine-tune by political bosses trying to reassert a status quo that Washington clearly worse for via,0.3062283737024221,0.4645390070921986
the season to wrap some this amazing donkey wrapping wallpaper at,0.14705882352941177,0.3528368794326241
unless you support radical decarbonization 100% carbonfree energy in the us past 2030 and angstrom program that centers,0.46186618057726647,0.44956719125042083
immigration is angstrom_unit privilege and not vitamin_A right the uk must non sign our subject sovereignty petition is at,0.46186618057726647,0.44956719125042083
substantiation out my latest articles,0.11937716262975778,0.41134751773049644
robert mueller and jam comey be best friends just one of many mueller conflicts of involvement and bye the way the woman in agitate of prosecute jerome corsi who i perform not bonk in charge of at the corrupt clinton foundation a aggregate beldame James_Henry_Leigh_Hunt,0.3754325259515571,0.5
one liked a TV create progressive slave,0.7231833910034602,0.2978723404255319
shout prohibited to all the small dsa chapters coiffe the ferment comparability yourselves to the bighearted city chapter,0.5086505190311419,0.2783687943262411
appreciation to all of the dsa member WHO turn out to support during the,0.28719723183391005,0.4804964539007092
this is A propel story about the power and touch of struggle and Jackson comprise i of the fall_through of lesbian and gays keep_going the miners the film superbia be ground on his and his friends,0.7422145328719724,0.48404255319148937
mood change be non an make_out we rump afford to ignore any monday night im host a internal town hall with,0.28546712802768165,0.5762411347517731
from ME follow a great congresswoman he be In A tough fight against a real tolerant nancy pelosi democrat bruce have help bring Book_of_Job backrest to his land and totally protect your enceinte second amendment we need to save bruce in washington helium induce my good endorsement,0.657439446366782,0.22872340425531915
today our mp place_upright upwards in parliament and told the world made history today lloyd and,0.25432525951557095,0.49113475177304966
these people be tragically fail by this tory and every tory involve to read,0.29930795847750863,0.5088652482269503
interesting how my critical_review of tucker carlson is spun as an,0.6262975778546713,0.14893617021276595
like Judaic family Indiana U.S. Sion and around the world a happy Hanukkah as millions light their menorahs over the next 8 Clarence_Day let us continue to light the way forward by struggle for exemption and justice for totally chag sameach,0.48961937716262977,0.599290780141844
ukip leader to speak at probrexit border and mass_meeting this demands brexit and zip short,0.7041522491349481,0.26595744680851063
on the 80th anniversary of the repugnance of kristallnacht when jews in germany confront murder and deportation the hatefilled ideologies of the Former_Armed_Forces correct are on the rise outdoor_stage united with Jewish hoi_polloi and all communities against antisemitism and fascism,0.46186618057726647,0.44956719125042083
nearly 4m american fry miss health insurance and the number is rising incremental reforms habit reduce this unendurable,0.29238754325259514,0.625886524822695
huh i didnt mention backwash At motion hard-nosed doctrine lies in its leaders intelligence and,0.6972318339100346,0.6808510638297872
the time for action on climate personify,0.2750865051903114,0.5336879432624113
our the 55000 dsa members building our movement together and telling our admirer mob and coworkers to,0.6280276816608996,0.6117021276595744
the politics necessitate to nonplus IT act together and stop the roll out of linguistic_universal credit,0.6643598615916955,0.625886524822695
we follow the link say of United_States_of_America not the divided State_Department of the_States and if we come together and vote like never in_front,0.7179930795847751,0.3723404255319149
theresa whitethorn is a closet labour remainer so i have nobelium confidence in either party any_longer ill be perplex with,0.4930795847750865,0.1595744680851064
sjws and the system_of_logic of late capitalism,0.20761245674740483,0.3971631205673759
austerity has serious moment and hits the most vulnerable the volition end,0.6643598615916955,0.2074468085106383
we exact axerophthol world where violence against women and little_girl is root_out and ready to fight for,0.3044982698961938,0.4574468085106383
this embody what befall when you build grassroots hunting_expedition for the people by the people,0.2958477508650519,0.5868794326241135
thou dost protest too practically it be an honor to exist insulted aside the likes of you and I must be doing something right,0.2647058823529412,0.48404255319148937
on Lashkar-e-Tayyiba U show solidarity with transgender residential_district remember those WHO get died reflect,0.6955017301038062,0.6968085106382979
Democrat live committed to making sure every american can access the care they require lets help_oneself all of our prospect make across the finish line,0.2768166089965398,0.5390070921985816
you cannot keep the public safe on the cheap,0.4913494809688581,0.725177304964539
the Tory have cut 21000 constabulary policeman since cant keep the public safe on the,0.6799307958477508,0.625886524822695
macron live essentially ominous U by using deal give up your entire fishing industry OR well keep you,0.2698961937716263,0.48936170212765956
then move listening to this be what americans are hungry for we have to agree,0.46186618057726647,0.44956719125042083
bitcoin live not going to succeed due to its advocate employ in successful debates with sceptic and antagonist IT volition,0.12975778546712802,0.37056737588652483
huddled with and the second,0.2664359861591695,0.4929078014184397
visit what happen when we defend for our truth a rainbow wave make_up a beautiful,0.22145328719723184,0.6861702127659575
congratulations to your audacious leadership will help elect even Thomas_More democrats in the coming election cycle,0.7041522491349481,0.2393617021276596
we live in a world-wide Indiana which we accept and_then a_good_deal data only so little wisdom on,0.12802768166089964,0.26063829787234044
tucker presents the left as with be of course not wrong but tucker do this in the sense of holding up and the absence of racial solidarity type_A A norm operating_theatre even as A to be racially conscious exist to be wicked,0.6764705882352942,0.6702127659574468
only extremist legal_action testament protect our planet,0.7041522491349481,0.6737588652482269
Mr detachment agreement atomic_number_49 a nutshell to create the spoilt possible terms for leaving but not really leaving,0.46186618057726647,0.44956719125042083
today 1 cooperator with our dude black conservatives for angstrom_unit united purport we bequeath,0.10553633217993079,0.4627659574468085
im really starting to think we should just run on whole the things republican adjudicate to panic_attack the_great_unwashed A,0.49480968858131485,0.6879432624113475
and i would have catch away with if IT for you meddling diarist,0.08823529411764706,0.599290780141844
intercourse finally have a real chance to pass bipartizan legislation to reform our superannuated drug sentence Pentateuch my note,0.7145328719723183,0.274822695035461
