im what push will come for but excited midterms begin too love to finally voting i the after,0.46186618057726647,0.44956719125042083
for him later jeff and date we will sessions general nominated his be thank well permanent service a at wish replacement attorney,0.46186618057726647,0.44956719125042083
peoples shoutout upholds for transgender rights by to their massachusetts voting work and,0.49480968858131485,0.6843971631205674
governor is great produces state for always man loves and ohio of will an his be a people who he big outstanding the,0.46186618057726647,0.44956719125042083
should economic via you freedom think when of,0.46186618057726647,0.44956719125042083
happened had charlottesville would demonization deplatforming and have never marginalization of altright the if,0.3235294117647059,0.5886524822695035
local tonight before city including our member housing rights tacoma new code several council spoke on the dsa members of,0.6557093425605537,0.3829787234042553
proposition is great rates endorsed 36% it 111 charging and of so capping loans their 200% 75% as exploitative step colorado misleading payday interest first a high at are with,0.46186618057726647,0.44956719125042083
conditions so 21st provide stalinera will and union soviet in century lenin capitalism living soon the of,0.46186618057726647,0.44956719125042083
hiring trumps as is acting attorney undermine matthew investigation mueller to whitaker with general a the attempt of,0.46186618057726647,0.44956719125042083
who is struggling be what everyone at time solidarity plenty supposed to a of,0.7145328719723183,0.6329787234042553
is disaster camp a capitalistcreated the fire,0.916955017301038,0.4946808510638298
not how is friend retweet before at our followers this lets get world to a 100k,0.2750865051903114,0.7180851063829787
arm fight is stay inboxes hitting newsletter next date for up medicare all to with yourself soon the nationwide and,0.30103806228373703,0.28368794326241137
students is designed who experienced including have adversity monument care meet foster needs to the academy of,0.46186618057726647,0.44956719125042083
more consternation lie courage we fuel fossil political less dont you let funded to politicians need and,0.46186618057726647,0.44956719125042083
we opportunity time law have get passed stand into to an the,0.28719723183391005,0.4769503546099291
not do as so only wisdom or votes and get out likes count shares words of,0.7906574394463668,0.19858156028368795
telling is major intimating everything players within this report 3 it that least dems of era doing facts will disgusting angry fake their witnesses joseph power relief while gang viciously to lie about they mccarthy not at way our get news are the mueller,0.46186618057726647,0.44956719125042083
is brexit political will times electoral seen establishment in modern anything challenge betrayed face an unlike the if,0.7024221453287197,0.2978723404255319
sells how ukip deal 1 brexit mays theresa interests out union mep it on to part european the british and,0.27335640138408307,0.6914893617021277
is thinking individualism and where this its kind bad liberalism lead the of,0.46186618057726647,0.44956719125042083
is illegals always move happen like and of gonna down trajectory symbol anyway on wall demographic going cracking ann to a was not time america affect the,0.29930795847750863,0.29432624113475175
more is governmentrun liquor biggov out still prohibition from states but shop laws consumers control retail dozen sales to alcohol a insane forcing at over level the,0.5017301038062284,0.7039007092198581
more angeles as hotel be orange ahead warn leaders elsewhere expire in los could contracts unrest and,0.7041522491349481,0.2925531914893617
rainbow wave is end oneparty states in united rule the of,0.27335640138408307,0.50177304964539
stop which with other this horton battling man attacks love real it of loathed career campaign admit clip on when but 1988 his be justice willie potus associated reform effects was must he racist ad have spent my criminal watching let were me i the,0.3079584775086505,0.5212765957446809
labour for this by ban and of we will tory destruction gets stand into them decision thank to activists our solidarity fracking further sentences up in environment government standing with quash welcome i the unjust,0.28546712802768165,0.49822695035460995
refugees solidarity central in stand american donate with,0.7231833910034602,0.28900709219858156
uk is doing abuse vulnerable sex isnt in govt staggering needs are scale ignoredand the of,0.46186618057726647,0.44956719125042083
enforcements today deeply at yoga facility quick appreciative shooting in to law tallahassee response the of,0.2958477508650519,0.2641843971631206
most unity is great movement powerful time have van modern in future clean it to demanding a youth the of,0.46186618057726647,0.44956719125042083
uk own global come that from of will point an independent eu outside growth to eus 90% must fact figures the,0.46186618057726647,0.44956719125042083
we so much have now where data in little world live a,0.7041522491349481,0.6808510638297872
hardworking his we york great for get congressman out new voice in dc vote a need and,0.6937716262975778,0.2783687943262411
who pass funding for housing in congratulations helped to affordable,0.71280276816609,0.6932624113475178
testimony for tuesday paid that fire acknowledging director night comey on his details fbi democrats knew phony he trump under the james,0.46186618057726647,0.44956719125042083
tortured extradite woman for she pinochets later by ago meeting of michelle and regime pinochet president campaign against proud his imprisoned geneva twenty am bachelet first to was people who became in chile join crimes years i the,0.754325259515571,0.4946808510638298
attacked is being much male this result hatred conquest and of camaraderie so genders fear victorianism monogamy as grand tradition not between perverted the,0.2820069204152249,0.48936170212765956
importance be of on with voting the woke,0.26124567474048443,0.2907801418439716
fellow 2020 no exposed is partisan exploded other take by just democrat especially and stance had white back comey been right but his urging fbi house to democrats a words after mind heading he at time in has totally any the james,0.8131487889273357,0.21453900709219859
is heartless government tory this lives tearing,0.29930795847750863,0.475177304964539
presents own sign compact whoever serious migration signs it to risk their a citizens un,0.2889273356401384,0.4787234042553192
20% year for crypto still and tanks bitcoin god bless currency twitter to a play 10 votes in day top the,0.46186618057726647,0.44956719125042083
ushering trumps success end be if system way greatest belief in american of a the may,0.7076124567474048,0.7163120567375887
hate is conquer this take it poison from of extract we will together assault on an antisemitism us unite evil antisemitic to working must our all humanity attack world the,0.46186618057726647,0.44956719125042083
no is jeremy action for waiting still world the,0.46186618057726647,0.44956719125042083
is citizens engage with for liked video truth ability attack to a under i the,0.7214532871972318,0.2712765957446808
people be confused events at will says and week businesses of that past many the after,0.46186618057726647,0.44956719125042083
that happened tax his hear who jobs would are workers have trump benefit lost law their from but said and,0.46186618057726647,0.44956719125042083
watch we next with here our will out in bolton win on west mp the,0.2975778546712803,0.6187943262411347
hope own his thank listens you leaders in backyard to brings i the and,0.4930795847750865,0.6436170212765957
no and since we will been clear deal be going 2014 never to a there was loud saying at have i,0.46186618057726647,0.44956719125042083
wars master declared fought has always class subject battles the,0.46186618057726647,0.44956719125042083
head follow your check if can voting you early confirm out location to lead polls the and,0.7179930795847751,0.2801418439716312
once happy we wish asked lad 50th birthday telford to a shropshire,0.2906574394463668,0.5
is fuel fossil labour now renewed ten marks climate since and means of reduction industry change today britain miss to the a set need not carbon groundbreaking political our action government passed in pocket years failure,0.2906574394463668,0.28368794326241137
populations us ruling each whole leave other class die when against = to pit dispossesses genocide the borders,0.46186618057726647,0.44956719125042083
united broken pass opportunity time our have stand fix to an the,0.46186618057726647,0.44956719125042083
voting across long answer just every 9 call from open est of pm places will on as us be 8333368683 here received hotline well ready am to calls a thousands questions polling at already our election any all give are day country the,0.46186618057726647,0.44956719125042083
warrior is wacko great martha her pelosi mcsally nancy a opponent,0.46186618057726647,0.44956719125042083
change energy city 100% renewable and this in texas mayor republican leads first powered by climate the addressing,0.6937716262975778,0.6826241134751773
we should be say believe have this cant easy to voting but,0.7301038062283737,0.2712765957446808
leaving watch discussing how sky ukip earlier mrs brexit deal we leader mays should be news betrayal on and,0.2768166089965398,0.48404255319148937
dna test totally why elizabeth backfired,0.7716262975778547,0.23404255319148937
important is your impossible game botch it chess and end almost decisive you opening but botched his where to the action happens trump in all middle recover if,0.8062283737024222,0.6542553191489362
that governor know we people california way brown him let just of all spoke to are with the jerry and,0.46186618057726647,0.44956719125042083
most important lifetime is sit at our much this elections out one too stake to theres the of,0.26124567474048443,0.49645390070921985
more crime hillary looking by investigation crooked same that and of you perhaps angry an ever clinton atrocious see did disgrace democrats a even committed total at time in subversive were crimes search the mueller,0.6314878892733564,0.6294326241134752
global do is compact mrs create will well waves signore intended salvini migration un on same to done the may,0.46186618057726647,0.44956719125042083
not wages is *not* job economic higher tighter why blessing threat spending are a an training markets and,0.759515570934256,0.2712765957446808
who is ukip heat battle alternative patriotic take those the of,0.49653979238754326,0.6985815602836879
important is including much it of how really build renovation know effective realize will been sections wall secure us to military democrats they built not people country do remaining already votes our has yet give the if,0.2906574394463668,0.49113475177304966
sit what saturday et for this topics down you on us inspiration true wait cant to a show do want cover with 7pm weeks i,0.7491349480968859,0.22872340425531915
history ukip revocation would be article 50 unique our leader full act in betrayal an of,0.3027681660899654,0.2765957446808511
hitting this in with morning the and,0.8079584775086506,0.010638297872340425
are companies own we your saying have now + boards bc on forprofit they actually,0.7110726643598616,0.28900709219858156
hodler stories what battle have gnarly war scars yours every last are pretty resort of,0.3027681660899654,0.4946808510638298
is great china does that negotiations of know we will fair things happily make one again but able deal be begin finally to a done made sign must let all america with many i the if,0.71280276816609,0.6985815602836879
women trans who us her hometown janelle sex ortiz roxana of one color a left worker and,0.28719723183391005,0.4875886524822695
not britain rebuilding across for south west many the few,0.28719723183391005,0.7021276595744681
we children in services national face emergency a,0.8096885813148789,0.12411347517730496
sign 4000+ conservatives here time across speak wait in young just america up to with from weeks a few,0.7058823529411765,0.7021276595744681
very some tell or cancer you truth piss off powerful well funded might about gmos the vaccines and,0.4930795847750865,0.28191489361702127
chair is back democratic were ready congratulations new on to party the becoming of,0.46186618057726647,0.44956719125042083
that deal awful will our mays other non includes nations ability to withdrawal freely with eu restrict the trade,0.46186618057726647,0.44956719125042083
great or for this just that credit of midterm heads talking pundits remember fake us two to proper words not do any election news give the,0.2889273356401384,0.48936170212765956
more leaders that from needs know we florida rally right than ever gotv can trust they need people who indeed at,0.5051903114186851,0.7127659574468085
at our from thread friends,0.2647058823529412,0.4645390070921986
health won officially pa06 thirdgeneration champion her houlahan for care race has congratulations chrissy military veteran and,0.6920415224913494,0.6932624113475178
stop is ridiculous warned happen would state got and affairs fracking this government has to a was the of,0.8356401384083045,0.21099290780141844
hate so be fascist you much antifa and have exist reason to then a if,0.25951557093425603,0.7074468085106383
socialism what everyone sexual place girls man of and jungle shattered its gets one law but emerged alphas lots get in fewer democracy betas the,0.7941176470588235,0.18617021276595744
hillary though is dnc no acid hunt looking washed crooked that emails getting but clinton supposedly look interest to disgrace a deleted they even total after stolen at witch congressional have subpoena in want are the mueller server,0.5951557093425606,0.7730496453900709
great very rightly planned of and so norfolk here to closure about centres spend concerned in childrens day are with many the,0.28719723183391005,0.599290780141844
not line do discouraged frustrate if issues you have get please let any the from hold them,0.745674740484429,0.3102836879432624
more much she just that and we pm deliver believes than duty britain brexit theresa to a need said who in has may,0.8114186851211073,0.015957446808510637
hope media your great for by last from performed and had night plays will you arts pooles can here brilliant a the support students who shakespeare park at evening watching those islington work i bridge,0.49480968858131485,0.8457446808510638
change is socialism we which can only each adequately confront according threat through from basis climate the of,0.3235294117647059,0.75
we end build international only can colonization solidarity for future class just through working with a the and,0.24740484429065743,0.49113475177304966
telling people at some might you believe point nazis theyre keep they if,0.46186618057726647,0.44956719125042083
torpedoes be a at with gonna and 7est 8est live heelturn the damn,0.759515570934256,0.2978723404255319
something craig looks show so wars cash tomorrows on wright like amaury and,0.3235294117647059,0.4734042553191489
hope being across by tackle bravery and of history around will positive today his inspire awareness house first to about mp made people country stigma commons our speak help in hiv world raise the,0.5069204152249135,0.2730496453900709
dna cyber is deal opportunity yall test remind for ancestry this amazons monday to maybe an day $49 the of,0.889273356401384,0.49645390070921985
people workplace maternity way leave unions another moms take in helping new working lead the of,0.8217993079584776,0.06382978723404255
administration will for this its accountable rights attacks on human democrats hold,0.0847750865051903,0.5921985815602837
how deal pass see dont will this just on i,0.46186618057726647,0.44956719125042083
such conversation between guys night these you last good a,0.15916955017301038,0.2624113475177305
beautiful discussing listening ward afternoon residents in on watling to sunny the and,0.31314878892733566,0.6950354609929078
she that years explain back would why deal her brought theresa two think to a even after allies has closest may,0.27854671280276816,0.4716312056737589
how stock approaching for liked video crash market to a prepare i the,0.05709342560553633,0.49113475177304966
action refugee solidarity 11/25 caravan day w/ sun of,0.46186618057726647,0.44956719125042083
highest consumer hits 2000 out just level confidence since,0.2629757785467128,0.4858156028368794
we collecting be westside at saturday our will items this in meetings koreatown valley on chapter the and,0.35986159169550175,0.5
personal today spam removed pages these 251 559 facebook accounts rules against because and,0.29238754325259514,0.48404255319148937
though analyzed im shows him me race it stuff that aspects of mad talking racial key u without part but whitelash as phenomenon some embracing resentment cultural a done was said research support do anxiety others ure at week trump in hmmm all are with i,0.46186618057726647,0.44956719125042083
opposes community across this through that dangerous refusing plans will derbyshire but to forcing tories communities fracking in affect are country the,0.46186618057726647,0.44956719125042083
being reference for respectable conservative too spencer rule richard a,0.7508650519031141,0.22872340425531915
trustees board congrats county education on member dsa harris the of,0.6937716262975778,0.6950354609929078
your runoff confirm place sure and around elections make right vote their lets corner louisiana got ready youve to mississippi polling at family get the friends,0.7249134948096886,0.7092198581560284
republicans organize attacks out scarier sure like and security before continue programs vital make allowing than on their theres vote got medicare never days to set mobilize 6 youre nothing get social all the,0.22664359861591696,0.29609929078014185
is which partisan him race increasingly hearing of and importance war wade than debate his secondary roe a culture was bigger kavanaugh over in judicial decisions the v,0.29411764705882354,0.4734042553191489
eos how mentality everything stanley cryptolifer transcript bob changes the and,0.4844290657439446,0.7092198581560284
looks $btc great be continue maturing another shows addition market to set the,0.46186618057726647,0.44956719125042083
2020 other from divide and strategy 2016 apart against to not do tories didnt trying our have communities in any attack work the wont,0.31141868512110726,0.6152482269503546
unite we hotel what see workers did there,0.28719723183391005,0.5
uk security eu deal subordinating military mays defence by national forces withdrawal to surrenders british,0.5432525951557093,0.7092198581560284
gain your if pelosi will try chuck raise schumer nancy majority to jobkilling taxes they the restore and,0.28027681660899656,0.7056737588652482
uk today i important listening your commons sitting in luck parliament house look to good the forward youth members of,0.7162629757785467,0.24822695035460993
women tonight won us senate way reelection leading has to are the breaking,0.5034602076124568,0.28368794326241137
your confirm now marched place like and we lets today downloadable never ready to poster show polling at protested get up polls the,0.49653979238754326,0.2925531914893617
botched deal tories brexit workers rights threat are under from the,0.6833910034602076,0.700354609929078
dollars great for me call rick that constantly bill of once job president almost florida remember called been on vote states during requesting hurricanes two did united a scott plus time have nelson years i the senator,0.46186618057726647,0.44956719125042083
idea protect is your or much for 43% out always 1% that european europe of and pays 2 we fairness will you fair larger but us be germany well while gdp too ww ask military there a was pay to nato paying in all work share i the,0.46186618057726647,0.44956719125042083
interesting im back be rebooting very project now on working ill a,0.2560553633217993,0.49113475177304966
light shine which stories next see optimist you wait in issue on to a was i the thrilled,0.7249134948096886,0.28900709219858156
demonize as president heartless refugees ragged this has gutlessto band been of threat to mindless a the and,0.3373702422145329,0.4769503546099291
folding be seeing these tweets bout all to clothes about the and,0.3027681660899654,0.6932624113475178
that means show is pro dump be deal only brexit rally held you this want to there exit the,0.46186618057726647,0.44956719125042083
increase staff record violent in on the support,0.754325259515571,0.2695035460992908
black is honoured contribution mark him civil racism tribute role and of history we against an today played fight as to a pay made paul he stephenson rights in outstanding hero the british leading,0.6868512110726643,0.7092198581560284
as your hereby voter life long my tory mr future self vote to good a batten i pledge,0.7024221453287197,0.6117021276595744
confirmed grid energy regulate denier bernard senate our republicans ties just mcnamees industry to a climate and,0.46186618057726647,0.44956719125042083
rapists their access born wish children gang rape child council against to repeated given rotherham the of,0.5,0.9432624113475178
dark fearless before we encountered commentary never this web outsidethebox came like along intellectual the,0.46186618057726647,0.44956719125042083
hopes by of around 100 things myself notes* selling eventually wait cant turn to working a hours week in *checks the,0.2837370242214533,0.274822695035461
great out and beautiful so we continue florida fantastic again can patriots making a at evening get in america safe with,0.46186618057726647,0.44956719125042083
not china want does tariffs,0.46186618057726647,0.44956719125042083
public we railways couldnt ownership our up this make need of,0.2958477508650519,0.7021276595744681
opportunity o = get rich candace according conservatism to,0.46186618057726647,0.44956719125042083
your voter cast place still run hit back you into vote when protection 8333368683 issues got hotline to line polling at our closes fact get up in any ballot polls the if,0.46186618057726647,0.44956719125042083
governor fostered as cut surplus m with 127 iowa female budget first balanced taxes a the of,0.46186618057726647,0.44956719125042083
is agreed with protestors agreement for whitewashing ago it that reached paris because raises and of price worst countries friend polluters some while two am responsible fatally conclusion energy flawed glad have my in years i the,0.01730103806228374,0.044326241134751775
decarbonizing job would 10 100% renewable over federal years plan,0.46186618057726647,0.44956719125042083
people speaking story fighting planet our truth for young girls one of to are everywhere power,0.46186618057726647,0.44956719125042083
your foremothers cut and birthday other fierceness unapologetic that happy because congresswoman of,0.3079584775086505,0.6932624113475178
nhs is reality rhetoric very nicola conference different party snp under from the of,0.02422145328719723,0.14716312056737588
is smokers now biggest tobacco and of know we tory one kicking cuts to habit after fewer killers yet years the,0.46186618057726647,0.44956719125042083
your which this place occurred random hookups it same intertwined of and sin idiocy promise also general universalization period higher education to the a was debauchery keggers allnight at time became with middle,0.46186618057726647,0.44956719125042083
forever suprct that as should be teen noted written off brain has adolescent convicted a someone murder the of,0.7889273356401384,0.2553191489361702
is jeb that like of erickson would judge remember been their lets battles nominated administration bush correctly a sense who fighting kavanaugh type have trump in nevertrumpers the,0.7854671280276817,0.25
not britain well for together rebuild many the few,0.46186618057726647,0.44956719125042083
shouting families still separating are from the,0.6937716262975778,0.6932624113475178
really technology here whos see for to about the were,0.8217993079584776,0.24645390070921985
dollars bin long laden him out pakistan just paid captured of told course we before pointed president shot famously on billions clinton center his us fools never book missed did there they was trade should osama he have my in attack world living i the,0.28546712802768165,0.7163120567375887
year this last of so talked ive timeline version some dc reverse to said people 10 have week over in many the,0.3217993079584775,0.7145390070921985
is great very him out by it last that deception of and before end night rally josh spoke fake when left plane goodbye met hawley early arrived missouri did to put democrats there a said stayed he at fact arena in news me rumor i the,0.46186618057726647,0.44956719125042083
planet on live a cook and,0.7906574394463668,0.24822695035460993
how people between arguing aka betray million pantomime two remainers televised over 174 to a debate the,0.7179930795847751,0.7021276595744681
chair uk ukip paying its remainers dues deputy argument to destroys a about the,0.7283737024221453,0.2854609929078014
means governor as which reelected back sending mansion woman for another 4 years just to their a oregon,0.8200692041522492,0.11524822695035461
in stay,0.7474048442906575,0.26595744680851063
vassal trade torpedoed deal usa mrs fakebrexit state with our mays for has possibility a sake the of,0.46186618057726647,0.44956719125042083
