2019 silencing video liked trudeau elections rigging liberals a bribing i and,0.8114186851211073,0.12056737588652482
flipped leading new just that from blue and 2nd latinas district where includes to a way in are seat the red,0.28546712802768165,0.48404255319148937
attacked zero which him for incarcerated credit say 100000 will happily right when aid got potus did to they was even support people do he wanted announces full wing let anything me give stuff if,0.46186618057726647,0.44956719125042083
nik we down you let,0.46186618057726647,0.44956719125042083
which much leaders for large other just it that from france and portions of we both fairly on countries bringing protection us be treated where never meetings easy military pay was trade must fact returned my up in accomplished world with the,0.6020761245674741,0.15070921985815602
endorsed demand for county it every from strong and nonbinding on question counties as medicare response massachusetts was a multiple people in all ballot the,0.2958477508650519,0.7056737588652482
distribute more n95 city democratic than socialists masks the,0.9117647058823529,0.4875886524822695
which loved knowing and wars we would ones shattered around remember generation their left today deeply home ceremony see destroyed moving two the a they not who at communities manor islington world brave if,0.1903114186851211,0.2978723404255319
means no maine good sharing for perfect rankedchoice day on knocking a voting the,0.46186618057726647,0.44956719125042083
heywood this colleagues loved and jeremy ones sad an his dedicated impressive was public servant at time family my thoughts are with,0.49480968858131485,0.12056737588652482
health billion no cut next year for overstretched services by budget new money a overcrowded the,0.2958477508650519,0.274822695035461
own is global concerns these across for now poor west because italy divide france and 20 right their ignored power as brexit some rich elites to the there a ordinary they riots people between feel hapened gap genuine futures huge have trump over in want years widened,0.2837370242214533,0.4875886524822695
today local people is carnforth labour talking in to about,0.39965397923875434,0.5833333333333334
2018 between teams tech our for 23m voters midterms iwillvote to mobilization polls the datadrove,0.46186618057726647,0.44956719125042083
is what enact year him critical and of how legislation viewed heres be half december to a appointing he meaningful time immigration hes trump in has ran i the,0.5,0.6914893617021277
we end oneparty democratic rule witnessed and browner two new younger beginning party years a the of,0.28719723183391005,0.48404255319148937
more criticising and of officers created police on crisis cutting staff beat put a hardworking must 50000 our overstretched government in has the,0.49653979238754326,0.6932624113475178
most who do jeremy or you have theresa in corbyn confidence the may,0.46186618057726647,0.44956719125042083
head your dont needs and best month exactly covered one theres left budget plan today fit wait to find get over the,0.28027681660899656,0.2801418439716312
governor as elected next hardfought nevadans in congratulations just democrat win on to their a neckandneck race the and,0.46186618057726647,0.44956719125042083
represented no black being waving or men that could from of and white donald flag sin save their original proud appealed interests to a girlfriends allies trump group boys pleas the jewish,0.07612456747404844,0.37943262411347517
we build inherit miners future to past the support,0.38581314878892736,0.48226950354609927
no is pandering at our for absolutely theresa in to room racism may,0.29411764705882354,0.49113475177304966
more gavels committee leaders now by legislative party members things b/c than leaving congress $1m repels servants to done public who process pressure get in want are raise dominated,0.07612456747404844,0.6046099290780141
president 100% with agree i obama,0.46186618057726647,0.44956719125042083
not people obamacare signing what dont via for up want it the if,0.2975778546712803,0.49113475177304966
stop very fighters or tough through unwilling and of before back fought reach mexican against caravans but them hard some caravan viciously mexico to they made breaking unable people northern border should at our up were are hurt soldiers the,0.7058823529411765,0.28368794326241137
that means able we be economic justice will discussion this in begin just word to maybe on a country,0.46186618057726647,0.44956719125042083
is patrol bracing for boarder through nancy surge and security we danger will arizona together wall them nonwalled chuck approve military a not must border big at area our massive let with the,0.29411764705882354,0.5
we opportunity with reach their provided potential children benefit all to are when the,0.2889273356401384,0.700354609929078
them pressure with dont get its away let this on working keep the and,0.46186618057726647,0.44956719125042083
warm talking residents of on to with the reception,0.46186618057726647,0.44956719125042083
not people demonstrates shown tories have fit this for parliament of that are the they country contempt and,0.21626297577854672,0.39893617021276595
no or goes for result that loses of we so again their ever as person medicare a need life bankrupt in all america the,0.46186618057726647,0.44956719125042083
is california your story if at in by been fueling fires the share climate affected change,0.08304498269896193,0.39361702127659576
arabia dangerous that trumps no will the signal longer accountable lead refusal america world to a saudi hold sends,0.46186618057726647,0.44956719125042083
wage b endorsed workers it from raising difference because of and created $785 back will make lives an value returns $12 some missouri immediate class deserve to working hour prop minimum in the,0.2958477508650519,0.49645390070921985
uk fuel fossil battle renewed for this targets and of we makes save tory reduction industry reading as due sobering miss to a set need not carbon political our action government in pocket are the,0.46186618057726647,0.44956719125042083
people btc until these over bear market,0.2958477508650519,0.6950354609929078
people so stay big can gotten space in has ecosystem making been cryptolifers that them the financially,0.2958477508650519,0.6950354609929078
something uk deception agreed which brazen theresa she has prime same could minister ever said may,0.46186618057726647,0.44956719125042083
dollars more no is forests each these or year for now lost payments poor that given because california of and so mismanagement costly fires lives billions deadly gross management there fed except forest massive in reason all remedy are with many the,0.1903114186851211,0.35815602836879434
sick people walton your greed say walmart subsidizing and tired family get off american to are i the of,0.3079584775086505,0.7074468085106383
labours privatisation end railways will our you later scottish holyrood believe on vote to the plan if,0.7006920415224913,0.2765957446808511
getting is shes being daughter whos at gracie this my bullied school picked told on twitter hello friends and,0.28719723183391005,0.48404255319148937
that proud newlyelected is democratic strength congress our greatest diversity nations were reflect members of,0.46186618057726647,0.44956719125042083
keep what at talking now lets it were thats about,0.08131487889273356,0.37943262411347517
spreading friend our campaign for my thanks repelect word to good about the,0.46186618057726647,0.44956719125042083
hope more recovery argentine argentina later this sailors from hearing missing brave of and president month families forward eventual needed friend san look to closure the discovery juan my those in wonderful brings i submarine,0.8131487889273357,0.13297872340425532
team entire so launched what thank 2014 you things our this one weekend to journey wow many a and,0.46186618057726647,0.44956719125042083
not more i is inf step less likely trump this out conflict urge making pulling treaty dangerous a the of,0.29930795847750863,0.7127659574468085
great land everyone across it every served veteran of honor conference on supporting eternal host today here express veterans to military a was nation who entire our family my gratitude in has uniform want country i the,0.4844290657439446,0.7092198581560284
release own go last of mps how night tory impact its universal cant governments to they peoples devastating up want cover blocked the analysis,0.6280276816608996,0.12234042553191489
millennium who attended begins way across have now towards those laying making their the wreath bridge procession,0.28546712802768165,0.48936170212765956
is nov 275 actions have for she this planned tuesday american gave been 20th to an speech hero,0.46186618057726647,0.44956719125042083
below is what exchange this for troubling take dangerous strongman doing you surprising keep w/ but democracy behavior not authoritarian yamiche our my are,0.27854671280276816,0.4875886524822695
not office in but power,0.2768166089965398,0.49113475177304966
if wealth by it incredibly then become also their happy but them bit be rich to a they do with share i invite,0.46186618057726647,0.44956719125042083
is major for this tuesday it go weekend and wins so we final on hustle volunteer can push some ready to democrats sign time our communities get up election day the,0.7058823529411765,0.4946808510638298
important is between growing havenots gap showing housing haves its new report why from the and,0.28719723183391005,0.28191489361702127
restored is end oneparty cnn political heart my states in has analyst been it united rule the of,0.8650519031141869,0.22163120567375885
sale is now new it tough highly and of really donald gets terrific on attempted smart his book he sabotage hes trump j spygate recommend i the,0.4982698961937716,0.0425531914893617
regulation bureaucrats alert your formal socialist comment telling reject now europeanstyle want american on to controls price impose drug,0.3892733564013841,0.9219858156028369
nation not entire is whether or will everyone hostage mcconnells just on to vote a bring the since,0.28719723183391005,0.4946808510638298
stop people heard voices a these and have duty listen republicans to their the grabs made disgraceful power,0.28719723183391005,0.4946808510638298
us we pearl remembrance remembering honoring this 77 harbor in lost years ago join lives day the and,0.7249134948096886,0.5106382978723404
protect your sit with much this and midterm how free elections stake on theres change downloadable too to poster committed at our family in were sidelines years voting the friends effecting,0.8062283737024222,0.11879432624113476
uk must not criticism uns criminalise on to expands agree of,0.46186618057726647,0.44956719125042083
10 shilled have seen lower to the top i coins,0.8217993079584776,0.12234042553191489
touched much but this on me agree i and,0.48788927335640137,0.06205673758865248
are stop people own divides humans some political seeing their this in that caravan from the,0.031141868512110725,0.17375886524822695
partners we collaboratively works our and for alongside stand that an economy european closely change,0.49480968858131485,0.7358156028368794
laws ease deal york reach senators times new to the sentencing bipartisan,0.02422145328719723,0.1524822695035461
is timed interference another this establishment try by coincidentally to blatant block the attempt and,0.18166089965397925,0.12056737588652482
today evidence commission as created part launched vision our for new call planning to a support of,0.46186618057726647,0.44956719125042083
project for tidal of and jobs wrong bay back will why economy swansea decision lagoon to was our future failing the,0.46186618057726647,0.44956719125042083
black is deal landscape price hellish at comes for retail friday capitalism good a under morning becoming,0.3875432525951557,0.37943262411347517
components identity as your religion political tribal and geography parties define race 3 in core when a of,0.4982698961937716,0.12943262411347517
state by it through that sen and ended goodbye seeing scheme interests voters too to a knew was corporate amendment up bankrupt 74 the,0.9186851211072664,0.39184397163120566
today we be troops actions our and allies wwi remember honored those this spending day to the during brave of,0.07785467128027682,0.38120567375886527
who calls drive donated phone put doors knocked messages up those all signs on to volunteered text made,0.46186618057726647,0.44956719125042083
no read state or for this now involuntary punishment constitution still that last servitude night exceptions as be period colorados slavery never thanks to there a amendment until except either in,0.49480968858131485,0.7677304964539007
dollars stop southern of allowed we build would necessary will save into also wall billions us be drugs close to democrats not people country illegally entire border votes way our either give the if,0.5986159169550173,0.08333333333333333
evidence no is between sentence time longer fact reduced 4 in results that there suggesting difference the and,0.7975778546712803,0.010638297872340425
box rebellion political for quislings ballot on batten through a the and,0.46186618057726647,0.44956719125042083
muellers hacking each political or corruption robert laundering has prosecutors specialty core money a many like of,0.2768166089965398,0.4929078014184397
premiering eastern heelturn tonight be at night will with and 8 network on working title the dick,0.0,0.4858156028368794
is saying opposite our exact nationalism by betrayal a macron the patriotism of,0.2958477508650519,0.4875886524822695
is plus going down 5 added video new q signs playlist to globalism a i,0.29238754325259514,0.4787234042553192
stop is patrol for this out democrat national it tough that emergency of brandon will says chanded make right on when but laws bringing us be judd am to military they stopped must people border he at inspired council i the,0.3027681660899654,0.6950354609929078
that whatever neocons own propaganda conservatives say dont believe you leave allies up want goofball to their about they actually,0.7024221453287197,0.2783687943262411
so elect current effort our college former across arizona much in this all to put democrats from november and,0.46186618057726647,0.44956719125042083
lifetime increase finds would medicaid for new by recipients the research earnings,0.6038062283737025,0.40070921985815605
media his thunders bomb at scares via for trump supporters smearing after,0.8114186851211073,0.12056737588652482
reality dump exposing rulers massive added video information playlist to a i the of,0.4982698961937716,0.7056737588652482
deal could brexit jobsfirst labour alternative for out has support in parliament that an a sensible set win plan and,0.29930795847750863,0.7074468085106383
today is movement dont for just day donate on join a,0.46186618057726647,0.44956719125042083
sale is great read now this and of really job on terrific capturing ideas book subject a views done they interesting have my longheld in,0.46186618057726647,0.44956719125042083
not leaving know really eu withdrawal mrs everything you mays agreement to the about need,0.2750865051903114,0.4929078014184397
not hillary since is be president alright herewhich presidential will she never guess acting i clinton,0.46186618057726647,0.44956719125042083
we mad being as fightback per dont ukip now get for little betrayed are the even,0.4930795847750865,0.274822695035461
so at see cool together summit on to the mississippi and,0.2889273356401384,0.48404255319148937
fall cnn game for now tuesday out go real and of jobs so we history remember results false perhaps funny fake lucky vote economy watch rhetoric see greatest to suppression ratings low our have in are country polls the,0.28546712802768165,0.4769503546099291
dnc state congrats across this race and of africanamerican around latinx on efforts win fight cool turn color to organizing about made investments significant communities our in thing are country the leading,0.46186618057726647,0.44956719125042083
which or this out needs and of jobs alternative laid an six plan deal first tests our standards meet has puts living the,0.6314878892733564,0.06560283687943262
we great together america making again safe are and,0.2820069204152249,0.49113475177304966
shell black is talents lauren underwood that of and thrilled we youngest republican one defeated alert tonight as randy be bringing her abilities hultgren millennial house to a women nurse elected youre registered has are the if,0.050173010380622836,0.5975177304964538
yemen themselves trying hypocrisy much via war republicans house call vote to are a on they block the prolife and,0.46186618057726647,0.44956719125042083
for just that from and most lifetime of we mn away impactful us works days a our election want all the if,0.46186618057726647,0.44956719125042083
how is threw theresa this further into disarray country the even may,0.46186618057726647,0.44956719125042083
dsam4a us at all happy from thanksgiving of,0.2629757785467128,0.4804964539007092
below date can what you now up my am on to with keep i activity and,0.06920415224913495,0.375886524822695
game much leaks for classified forced taxpayer that then of and we will else them us be can going information two waste house to think democrats they play likewise at consider senate all level money are the investigating if,0.1903114186851211,0.375886524822695
partners including diego burned office down our san just pile learned that a was the of,0.46186618057726647,0.44956719125042083
presidential smell a i run,0.828719723183391,0.13120567375886524
troops other this love same members of how continue based transgender against on administration as be treated identify deserve forces service to they armed discriminate who dignity respect our cannot any member with the,0.27162629757785467,0.48226950354609927
40% people wrongfully being prison up incarcerated just learned to that after receive from released i *no* of,0.49480968858131485,0.17553191489361702
we held got way much for out too on with under and,0.6920415224913494,0.2712765957446808
your this vote happen made,0.46186618057726647,0.44956719125042083
president trump moon to their commitment reaffirmed closely and,0.3166089965397924,0.48936170212765956
children seeking turning shouldnt and we backs administrations safety on be a who life shameful our immigration policies trump are better the,0.3079584775086505,0.7056737588652482
own out it little that turns online like and of will press billionaires one on bulk us britain doorstep peoplepowered transform apparently who movement our the british,0.6920415224913494,0.6843971631205674
important is really georgia this voters a thread,0.29238754325259514,0.4875886524822695
home florida it lets bring,0.46186618057726647,0.44956719125042083
that not club really is be going what and rude me want audience to part give a of,0.2664359861591695,0.4858156028368794
launch prince 730pm+ down come marlborough forget young 15th / islington to party on alfred the,0.7093425605536332,0.7109929078014184
people steal conspiring brexit pretending loaded while represent brits leftie elites are to from the,0.6833910034602076,0.2907801418439716
ohio jobs we president 2017 will other enrich trump never in those again to sacrifice states and,0.2906574394463668,0.2730496453900709
today hatefilled far is rhetoric compassion immigration talking this kind cry a about from the of,0.7439446366782007,0.23049645390070922
public around ignore their trying hardest demand for singlepayer instead to are democrats insufficient the rallying,0.46186618057726647,0.44956719125042083
protect much large agreement for out protests love that maybe paris france run and of so order countries well questionably to pay working riots not people third do environment over sums in want all chanting money world are the,0.46186618057726647,0.44956719125042083
below more bonus link download bounty dont or use from and free cryptocurrency an cryptogiveaway extra chance miss word to a null coins promo get code me the,0.46186618057726647,0.44956719125042083
more how do can with 100 diversity talking inclusion ceos on to day about they the spend thrilled,0.671280276816609,0.7127659574468085
more own mps jobs time her living spent negotiating has putting than economy with eu the and,0.06920415224913495,0.35815602836879434
very going talks china well are,0.29238754325259514,0.4875886524822695
carolina great evening for patriots get in out north fantastic charlotte vote with replay and,0.28719723183391005,0.700354609929078
kept confused grannys her months meth via jailed for cotton deputies bond a high candy,0.19204152249134948,0.4929078014184397
that amazon as so harshly announcement company punishes every phrase retailers decisions about online the,0.27854671280276816,0.7092198581560284
not hillary is im president for every day thankful clinton,0.46186618057726647,0.44956719125042083
next labour for she it party how so will conference economy outlines watch as works live rebuild not at our government many the,0.46186618057726647,0.44956719125042083
neocons is fascinating dole much it that from implement and of conservatives stodgy will you unlike actually study can vision to a about messianic they not have learn bob world the,0.7301038062283737,0.7074468085106383
more dnc much within by report bruce and of leaking doing so will comey campaign also fired brennan clinton wife his be corruption fbi lovely exposedand ohr molly lying people listed clapper in all many the,0.7179930795847751,0.6950354609929078
georgians elected strongest 6th district send gun have for flipping commonsense congress congratulations reforms one on to advocates the of,0.30103806228373703,0.7021276595744681
are thugs peaceful means pro road exit brexit rally down well contrast organised to nope the eu fascists anti,0.157439446366782,0.21631205673758866
most flipped alert flip congresswomanelect her seats in porter just one win on to competitive country congratulate the blue of,0.46186618057726647,0.44956719125042083
is democratic our active have for over my in politics government been to cause years under i restore 26,0.21972318339100347,0.4929078014184397
is deal which whole this isnt in interests bad a country the of,0.46186618057726647,0.44956719125042083
very she last we minute avoid on vote but botched tonight deal be brexit theresa pulled to a should at defeat resounding voting the,0.46186618057726647,0.44956719125042083
dollars is being china long just go charged because otherwise and of companies coffers build before pouring make into than lets ever billions to there a pay usa way our in want tariffs are country the richer if,0.46186618057726647,0.44956719125042083
must washington we us until be 10 have dec for 13 2019 in agenda dc on to a set the,0.46186618057726647,0.44956719125042083
mentions or moment crypto hardfork airdrop a twitter someone the,0.2975778546712803,0.48936170212765956
is your midnight what across for rush out donation last critical before make fec vote deadline able us be well chance determine to democrats a investments lastminute get help election day country the,0.46186618057726647,0.44956719125042083
not success via government by achieved was limiting americas,0.4913494809688581,0.2783687943262411
is reject lost of and we remember stand recommit an worldwide fight as eliminating embrace to democrats science opportunity stigma solidarity in those all with living the hiv/aids,0.46186618057726647,0.44956719125042083
such these this prime negotiations of mess an 35 ive as abject brexit never minister made mp witnessed in has years,0.46186618057726647,0.44956719125042083
no cost millions collusion pages over two documents of after years $30000000 a and,0.27335640138408307,0.7092198581560284
health b payer for letter lawmakers single influence gives hhs part w/ countries foreign rx coalition medicare patients/caregivers determine to prices domestic policy our opposing over american signs rule care,0.46186618057726647,0.44956719125042083
great loyal this out taking like and beautiful build we back you together power returning patriots to a people at evening get american helped are with country citizens the,0.2820069204152249,0.4929078014184397
state what for she now small that happen strong and of vassal we sovereign will away freely outside independent eu us brexit true united to thats a bring need kingdom wants trading all world member with walk the,0.28719723183391005,0.4929078014184397
today is nomination thomas farrs will communities another republicans silence lengths go to example color a was the of,0.28719723183391005,0.2730496453900709
very number these dangerous please numbers of and security so we safety cases rulings filed why unwise on study protection overturned view shocking making there a they need country unsafe border vast our opposing those are many the,0.30103806228373703,0.4858156028368794
declared feds or by three involved know and/or effective will you things antifa save *already* been infiltrated known honest be well altright a club public should brutally have terrorist trump group in are if,0.698961937716263,0.2712765957446808
end political will our has always it been all austerity a rebuild and,0.745674740484429,0.6170212765957447
society people scapegoats we points be as vulnerable cannot let by of to that abused ills farright the them,0.7041522491349481,0.2783687943262411
more moral much new building and we so duty when oppression them his clear us here message conflict to a was support fleeing must do refugees life our arrive meet those in with welcome,0.3044982698961938,0.7074468085106383
