louisville beautiful had black experienced we voter georgia whole yesterday elders in busload a suppression of,0.6885813148788927,0.7056737588652482
commentator is witty answer go sharp improvement like and most bill tucker places based impactful conservative be can easy to ask the a someone interesting people he mainstream others definite over were me willing if,0.46186618057726647,0.44956719125042083
bringing your duper thank you for super voice serious reporter face to and,0.46186618057726647,0.44956719125042083
be supposed oopsthat to was,0.46186618057726647,0.44956719125042083
enlisted included men out died just that served members brave of and had officers their careers school theaters service marines the military high who over in young all accomplished world day middle,0.7785467128027682,0.25177304964539005
today not streets britain hitting vision our for out laid to on rebuild many the,0.21107266435986158,0.4946808510638298
pardoned officially president joined this by has national years turkey thanksgiving,0.7698961937716263,0.6702127659574468
socialist duracks everything much him for from veteran and we postie so extraordinary enough together war unionist learnt today celebrate his thank did to a was george trade he funeral at second cannot world came,0.46186618057726647,0.44956719125042083
struggling organise authorities these services every and since had campaign their local fight cuts to 2010 budgets slashed provide our have communities at level are welcome i the,0.7802768166089965,0.24468085106382978
20% your great checkout go every from online toward of electing gifts only off store its fridaysale today alert holiday 100% where available democrats deals at get code proceeds level all with the,0.15397923875432526,0.8599290780141844
nov your guysvote be 6th these voice on like,0.29411764705882354,0.49113475177304966
is mongering he intentional fear op brilliant ed fact fraud in by about committing,0.6799307958477508,0.7198581560283688
is we your tweet this please why to need support,0.7785467128027682,0.23581560283687944
is what this hell the,0.7716262975778547,0.2641843971631206
sick such protection as holiday dismissal full will legal labour workers get rights parental leave pay under from and,0.46186618057726647,0.44956719125042083
own developing our food help reduce ability nations on to outside eu batten prices the and,0.2958477508650519,0.48226950354609927
stop big $100 their action million spent now lobbyists billionaires election to last mobilizing oil climate,0.4982698961937716,0.6843971631205674
heard dnc your confirm voice this out take and chair lifetime of back its make location vote lets there said he polling at our get democracy the,0.46186618057726647,0.44956719125042083
some legend inspiration rights civil from,0.2889273356401384,0.2925531914893617
more americans 95 see senate step will currently am incarcerated of eager on to than work i the percent,0.7906574394463668,0.26063829787234044
hope more no this that hatred from blue and of we both antibodies would say its been wave division infestation a response not people drive parties in has american are kick the,0.2889273356401384,0.5088652482269503
it like lazy best you on depending their lives theyre vote depend be got to not people who life our are living the,0.46186618057726647,0.44956719125042083
protect your office labour post contact of and launched will you tory write them today streets heart to ask a they mp high offices our government demanding are the helps,0.7179930795847751,0.7109929078014184
not public hillary be would back and the this arena in conservative boycotted wow they a allowed said if,0.46186618057726647,0.44956719125042083
should you my video why join on latest the and,0.07785467128027682,0.3882978723404255
ca bank at phone come endorsed district for assembly nationally monday 7pm candidate and,0.04325259515570934,0.1702127659574468
jeb it of and had really so changing would things changeagent 2016 slings been an actually be actual vision see policywise revolutionary while a not arrows elected taken different trump in has anything i the if,0.5034602076124568,0.4858156028368794
people a maxine message send pelosi and waters virginia radical chuck need schumer nancy to west i the of,0.46186618057726647,0.44956719125042083
everyone campaigned for wealthy just berkeley it increases that $15 of tax so city fair its their else p can transfers property measure to pay taxes do time million have over share better the,0.46186618057726647,0.44956719125042083
is 26000 ukip membership being processed applications over currently new with,0.32698961937716264,0.7092198581560284
most proud gavin is clearly down whole nothing video revealing learned affair that about from the,0.46186618057726647,0.44956719125042083
public jf be joining pm at saturday will est space 24th 700 spencer on richard november the,0.2975778546712803,0.475177304964539
conditions who then see apartments owned blood my boils habitability nonrent horrible controlled to by slumlords the of,0.25259515570934254,0.48404255319148937
president thank you totally clears the,0.46186618057726647,0.44956719125042083
today carolina sheriff made history as sworn she in 1st democrat north african american dance woman was paula the,0.46186618057726647,0.44956719125042083
gavin hand boy game other feminists always bashing transsexuals abandon and one on bad ultimate played a was he good with double the,0.46186618057726647,0.44956719125042083
governor great being new result of and fought florida will on against desantis victory be never ron gave to historic a becoming he up congratulations odds all the,0.7024221453287197,0.6737588652482269
that trans people existence makes push and trump rights out it admins than to clearer ever the classify of,0.46186618057726647,0.44956719125042083
candidates 2017 next brexiteers every constituency run of we will deliver mistake tory also against failed brexit to they made not running people tories time in trusted the,0.29238754325259514,0.49113475177304966
flipped kansas tonight ks03 with her in just house to a from seat win blue red,0.71280276816609,0.25
today means had people decent brexit rally patriotic whitehall in fantastic betrayal a exit thousands of,0.46186618057726647,0.44956719125042083
global petition compact uns for government has migration against to predictably responded the and,0.46186618057726647,0.44956719125042083
agreed very everything congrats excellent him margin race by call that of and had conversation won we substantial president will brazil together on states else jair bolsonaro his work united military a trade who elected newly wished good with closely the,0.24740484429065743,0.4734042553191489
ukip brexit speaks leader mays theresa to about and,0.49653979238754326,0.28368794326241137
is concept or via for take paid that of we mad incarceration fine embrace to a not americans people who at have court those afraid were are the,0.801038062283737,0.09929078014184398
your policy here for neoliberal out w climate coming,0.0657439446366782,0.6117021276595744
attends cemetery president ceremony at suresnes trump commemoration american the,0.46186618057726647,0.44956719125042083
sooner is nyt helps other now for biggest it credit percent of bill and so generations would only 100 says federal their but able be home locked to a there 100k prisons women people time impacts way up in those all good stuff earn,0.2664359861591695,0.4769503546099291
theyve workers talent by abandoned since of how down things been lives youth funding well transform to 62% amazing do explains tories our in young invest all with the,0.27162629757785467,0.48936170212765956
security can illegals month checks our average assistance get up program social on to are a under federal $3874,0.46186618057726647,0.44956719125042083
asking a fair have for stand teachers been on strike with i may,0.46186618057726647,0.44956719125042083
schools nhs we our will year labour scottish over up has stood for past the lifeline and,0.6833910034602076,0.7127659574468085
wrong sentinelese sympathize am to with i the,0.33391003460207613,0.49113475177304966
most is deal policy democratic new interventions one from green the of,0.7197231833910035,0.7092198581560284
women step will justice my act incarcerated thoughts first brief real to bring thousands the of,0.8027681660899654,0.19680851063829788
are fighting laws so do can pierce via fort in business unconstitutional owners they fl,0.7335640138408305,0.28191489361702127
proud native history generations shaped communities our have for new core that the of,0.27162629757785467,0.4716312056737589
today honor who we have sacrificed remember those on selflessly served and,0.46186618057726647,0.44956719125042083
is great being with led for looking this long man of and will forward bush be celebration missed to a not who he funeral life family distinguished has day the,0.6764705882352942,0.675531914893617
resumes as very can some think come outsiders and its in offensive that bullshit with journo they actually,0.7923875432525952,0.2322695035460993
bill president senate senators leadership trump act key pressing republican longawaited called on to are a the and,0.7197231833910035,0.25354609929078015
that change banks nyc fuel will divest and in invest 1128 call on nyers to day from climate finance,0.46186618057726647,0.44956719125042083
immediately will labour fracking government a ban,0.7110726643598616,0.49645390070921985
voted no cost for it schumer nancy meeting and security so pelosi will speaker right wall forward but today fight longer chuck look to democrats a they built must do border 2006 at votes my get in want all were with i the,0.29238754325259514,0.648936170212766
what me mama especially it could of doing both will when keep but candle taught never try class to a they hold not comes either my parents i,0.46186618057726647,0.44956719125042083
today able we flu at our for shot healthcare out thanks group clinic to 80 working give vaccines were,0.5224913494809689,0.6950354609929078
once growth wage hard failed americans ends these for out harder make making it again to meet working even break,0.46186618057726647,0.44956719125042083
20monthold at guatemalan girl and in named died child one custody federal those least ill mariee a falling even after,0.28027681660899656,0.6985815602836879
is perspective which year always starting it that and script tucker become admit been principles his routine to developed a the reveals said must over has past insufficient i deeper,0.6833910034602076,0.7021276595744681
black is follow charge governor next for place sure of make their lets lead georgia to a women our all are country better the leading,0.2768166089965398,0.6914893617021277
friend is your shmoe ruling we thats what wants exactly economics luckily boring joe class think might but the,0.6833910034602076,0.7039007092198581
women black killed won movement ones whose got led this families police by it loved was and,0.7785467128027682,0.08687943262411348
battle street community always years socialists marks hatred fascists resist of since and 2 will stand right against when cable stood today proud 82 division anniversary to was people far at speak with 80th i the jewish,0.46186618057726647,0.44956719125042083
no im or this go feed end why hungry sixth proud richest christmas to a support should family hunger in child world country the,0.8200692041522492,0.24645390070921985
great wealth or come for now out always tariff man it taking of doing so best we $billions will make right raid again when countries max them power be economic rich am to privilege a pay nation people our way in want america tariffs are i the,0.46186618057726647,0.44956719125042083
your for go like and of apply doing we citizenship back you into letting states millions turnaround caravan united to not people illegally others in those want are country the if,0.4982698961937716,0.2765957446808511
candidates elect ensure state across for long secretary helping this year building last least of and fair elections why general but invested to term not democratic in future country the attorney,0.07439446366782007,0.3900709219858156
women candidates talk glass is folks what describe comes just it color to when about they a ceiling of,0.46186618057726647,0.44956719125042083
for it that sailors from meeting and best would based ships ukraine been on scheduled previously be cancel to not concerned fact have returned parties my all decided i the russia,0.32006920415224915,0.4698581560283688
not austerity is clear be until at will crystal and for theresa up never over that whilst the may,0.7647058823529411,0.23581560283687944
7 3 national does that town climate nearly pm dec on an hall change holding a not at get issue monday were,0.31141868512110726,0.4875886524822695
today observe seekers border hear stories at asylum san ysidro headed meet us/mexico to their with the and,0.34256055363321797,0.5106382978723404
progressive great improve leaders inauguration european climate and of discussing how politics right lives during millions can brexit justice radical meetings to trade far show latin defeat american with the,0.29930795847750863,0.5212765957446809
alleged harassment their sexual have survivors while out experiences 9 spoken working about brave of,0.7058823529411765,0.6826241134751773
damaged economy inflicted next our and suffering communities has 8 on austerity years budget of,0.7214532871972318,0.4858156028368794
candidates more including array silicon new valley from coming of and best ones campaign putting into on an win tech veterans to using incredible tools hands our the,0.8044982698961938,0.13120567375886524
billion $12 shoots changing in days world ecosystem 80 beyond the,0.5,0.7535460992907801
protect is mcconnell prison system via now this last size/scope from and of away families reduce federal celebrate failed chance turn session to mitch policies,0.33391003460207613,0.6223404255319149
missing plus luciferian video liked false flags world tnt a beltane order i,0.7214532871972318,0.26773049645390073
able being doctor see for ready stand to with a and,0.46186618057726647,0.44956719125042083
midterm celebrate ready cover to recordsetting a on vote i love and,0.46186618057726647,0.44956719125042083
advisory more washington commission neighborhood democratic four dc thanks on to socialists the,0.6660899653979239,0.5053191489361702
which next leaders by criticism and of completely will without their ever signed change un citizens compact be migration to a consulting seeks refugee week criminalise all world many mass the definition,0.46186618057726647,0.44956719125042083
leap is nazis hurry bitcoin up logical get nationalists this one maximalists are lets from and,0.7750865051903114,0.25354609929078015
stop for flint manage it organized pittsburgh from of and companies know we why letting systems profit private to thats they our costs water the,0.46186618057726647,0.44956719125042083
sticking tories with announced have its just why austerity theyre a the,0.3166089965397924,0.2765957446808511
eos is changing game with tech long liked video a i marshall of,0.7093425605536332,0.7021276595744681
launch elected current formally campaign get place out in pudsey to constituency the of,0.46186618057726647,0.44956719125042083
head peoples your land whose indigenous you this by learning occupy feed about the thanksgiving,0.46186618057726647,0.44956719125042083
for pray and federal but win us locked chance to human 100k prisons our allies help in many the beings may,0.29238754325259514,0.2712765957446808
nation people illegally we great accept sovereign and have will never our into are a country strong coming borders,0.27335640138408307,0.7109929078014184
is $btc $bch coincidence this just all it a,0.8217993079584776,0.16666666666666666
people fake news enemy the of,0.46186618057726647,0.44956719125042083
thank you sadly correct are and,0.46186618057726647,0.44956719125042083
photo free for this thanks to uploading amazing,0.7024221453287197,0.28191489361702127
crime is great very state powerful john for out loves vets strong please and of 2nd fantastic on vote endorsement pennsylvania military a total amendment he border our get my has the,0.29411764705882354,0.2765957446808511
we so as teacher im with trying much but data in little world on to live a,0.49653979238754326,0.4432624113475177
uk is good at support boys in girls every stage education it are the to need but falling behind of,0.07958477508650519,0.324468085106383
is his indiana paying for facebook ads socalled has joe it donnelly on that the rumor opponent senator of,0.28719723183391005,0.2801418439716312
nc president rally in charlotte live,0.46186618057726647,0.44956719125042083
people exercise us so we have tried for gives why right vote to it restrict the,0.46186618057726647,0.44956719125042083
uk bother now theresa undermining contained in of armed to that mention the forces incredible even may,0.28027681660899656,0.7092198581560284
hope project for now by starting european macron silly rather as held liberals look to was they everywhere big up are the,0.46186618057726647,0.44956719125042083
that do guys be these tell others you to the like took,0.46186618057726647,0.44956719125042083
dollars is which very or other by it because legal and of jurisdiction citizenship will covered ended one scholars billions unfair be socalled to agree words not amendment 14th our birthright way costs many country citizens the,0.18166089965397925,0.25
york quote me for new that and know would only relationship one usual sources as times did to ask a about they made phony story refused my up mike with pence the,0.6799307958477508,0.7109929078014184
discussing 2 ukip catch deal brexit derbyshire mays theresa programme mep bbc 1000am1130am on victoria from the,0.14013840830449828,0.6099290780141844
more hand including game other for and morons essentially rough one ideology on than their proud played fight expressed ready altright too a they was group boys any tumble twp were double neoconservatism the,0.25432525951557095,0.48404255319148937
sick we your dem at office tired promises leaders promising act of empty on to are because and,0.3788927335640138,0.4946808510638298
stop is great good by activism and of security know we safety danger will criminals putting them lot there a about are not detain people who catch our nothing in judicial caravan country citizens the,0.45674740484429066,0.6436170212765957
announce launch proud so dollar stablecoin our super excited gemini first to regulated the of,0.3027681660899654,0.45390070921985815
we elect jeb didnt just why,0.46186618057726647,0.44956719125042083
idea that americans is fantasy white legally who bourgeois their everyone mostly affluent a came the ancestors among,0.30103806228373703,0.2712765957446808
40 more americans 60 ballots percent and by those african than requested the of,0.7508650519031141,0.274822695035461
change we at demand our for top two ago of to risk put a dems weeks climate the support took,0.46186618057726647,0.44956719125042083
must no is mps deal people treacherous fakebrexit respect will and mays abandon theresa this than better the of,0.30103806228373703,0.48226950354609927
not today history time indigenous struggle take learn american why against to their happy about the thanksgiving and,0.6955017301038062,0.48936170212765956
controls stop regulatory socialist disastrous update bring price here europeanstyle america on were debunks live to drug the proposal,0.7041522491349481,0.3173758865248227
very for it trail legal run businessvery wrong president continue campaign happily talked against decide oh when on going see cool am developer to put a about life our get my in odds all direction good living country i the mildly,0.04152249134948097,0.25177304964539005
united broken pass opportunity time our have stand fix to an the,0.6903114186851211,0.6932624113475178
11 international girl age poem liverpool this jasmine inspiring by on think day from i the of,0.8183391003460208,0.11702127659574468
humiliation is brexit whole way at now laughing national world the a handling and,0.6453287197231834,0.047872340425531915
no is situation southern abuse for this it that dangerous of and stay we necessary will costly states anymore close mexico united put there after decades border becomes our way up in any reason all with the if,0.06401384083044982,0.32978723404255317
is dnc collusion take out it still that real from and of how only why twitter facebook fbi biased democrats they check google favor others have in are with many the russia server,0.7076124567474048,0.2765957446808511
hope importance dignity and/or process believe you will for in of constitution that human agree i the if,0.2231833910034602,0.4627659574468085
build will maybe wall the,0.6332179930795848,0.0
more dont via other we trillion spending than alone when socialized spends a need expansion $32 already our government healthcare in,0.671280276816609,0.6595744680851063
hope and this in of join me i support youll,0.4982698961937716,0.040780141843971635
uk must not criticism uns criminalise on to expands agree of,0.3719723183391003,0.3599290780141844
occasions or 4 steele christopher told and know 2 245 director off former comey things remember on investigators when signed lies asked fbi house recall not americans opened who he all investigations james,0.24740484429065743,0.49113475177304966
progressive alert his us big champion senate reelection congratulations on to the win,0.5173010380622838,0.7163120567375887
crime governor is great for loves vets strong and of doing job arizona on vote endorsement complete military a doug amendment border he second full our my has the,0.8356401384083045,0.225177304964539
these because and we back oligarchs on power fight lies us depend to hold therein should joined our accountable politicians dsa the,0.7283737024221453,0.25177304964539005
that is your president loyal you have faithful now get out tomorrow been to a country and,0.6885813148788927,0.274822695035461
governor northeast next report democrat and of maine will ever as be got serve first to a flip huge in congratulations woman the,0.486159169550173,0.6843971631205674
conservatives flawed benefits cut legal asked has by advice challenge decisions to been under i the,0.615916955017301,0.07092198581560284
is major which come for now republicans it years and of talk security once will together fix wall 40 funding finally democrats a after must include border time action package all with the,0.8044982698961938,0.2375886524822695
major this report happen of doing we president will again states counter be never united to a the should future allowed mueller,0.8062283737024222,0.11702127659574468
i joining late here 50 2700+ workers am day on been a but the of,0.7145328719723183,0.7092198581560284
friend your prayers you condolences family my well mama raised to heartfelt and,0.8685121107266436,0.4804964539007092
is only down monument trump sessions confederate take to jeff willing was the,0.23356401384083045,0.50177304964539
is you leadership missouri republican america love thriving booming under i winning and,0.27854671280276816,0.2907801418439716
local voted socialist 37 each believe labour for have now in election values years general i and,0.46186618057726647,0.44956719125042083
for just that richard like of ohio down will you when endorsement clone pocahontas destroyed did total not he government my cordray let mike agency has ran the,0.2508650519031142,0.4787234042553192
not is often eu saying some tweet stated fact my clever inconsistent that are with dicks remainer the,0.5017301038062284,0.7269503546099291
x watch on now,0.4982698961937716,0.374113475177305
regulations socialism your mills for take schumer nancy and pelosi will down away mines vote impose gain timber erase try shut chuck to jobkilling taxes they coal restore borders healthcare majority raise the if,0.21280276816608998,0.524822695035461
that people is rent wealth satisfy and wants demand elimination profit all interest to production the of,0.46186618057726647,0.44956719125042083
54 2018 backed emerged white only in voters republicans of trend a percent,0.46186618057726647,0.44956719125042083
erickson actual blocked see tweet me cant in 2015 that sadly guy because i the,0.6972318339100346,0.5053191489361702
is *not* which me for him obviously empiricist remains 2016 an but redpilled frequently endlessly liminal stage disagreeing to blocked a not retweeting he noncommittally announces wants fully in with stefan,0.7301038062283737,0.274822695035461
expect more candidates democratic effort see iowa concerted in america to socialists keep chapters of,0.27162629757785467,0.4095744680851064
own protect or china for out it starting building that europe macron france emmanuel paris and wars how before its suggests one against but us germany two did to pay was army they not nato in learn german world were along work came the russia,0.71280276816609,0.6914893617021277
fight ukip brexit will recruits other for never away up new now of join from thousands walk the and,0.2889273356401384,0.6773049645390071
who each their our politics according ability occupies to simple are from,0.46186618057726647,0.44956719125042083
health how people do we say quality times access have american it deserve to many affordable the care,0.43252595155709345,0.4946808510638298
stop more is pushing petition rollout with universal youre now families halt need into it to causing credit the if,0.46186618057726647,0.44956719125042083
shining friend is max my sun the,0.27335640138408307,0.675531914893617
