black is holiday taking back workers now friday it were a,0.7179930795847751,0.2730496453900709
global petition compact squash reaches reject 96k for signatures now this migration it to sign the un,0.22664359861591696,0.5106382978723404
invited president rabbi benjamin now trump prayer for in just offer of attack to pittsburgh a the victims sendrow,0.24567474048442905,0.7358156028368794
patrol or large now staying through that and officers back forming been their caravans original countries able going despite makeshift mexico fences to military they built not heading people border our newly have get in walls were are country the,0.2629757785467128,0.49645390070921985
not people obamacare signing what dont via for up want it the if,0.015570934256055362,0.33156028368794327
how matter cops handle cop will beating lives a wondering the blue,0.25259515570934254,0.48226950354609927
whom dearly loved because i of,0.10380622837370242,0.3900709219858156
killed for strive served of we peace war commitments on as remembrance sunday to a commemorate armed must who our honour in those all world,0.6141868512110726,0.0797872340425532
is including very now illegal just prime that taking italy of spoke on hard a minister line immigration fact subjects concerning with many the,0.2664359861591695,0.5283687943262412
funds ydsa leaders every go that from 12/1 of $10 history will you gives contribute sanders profound ideas randolph philip dsaer to a scholarship remaining inspired fund young any bernie the,0.25951557093425603,0.42021276595744683
people outright patrick lying attitude fearmongering will and this remember all quite to their incredible of,0.46186618057726647,0.44956719125042083
more conversation his says him has with made even,0.7076124567474048,0.6914893617021277
black is clear history stories these make it british,0.46186618057726647,0.44956719125042083
that deal say will leave spent negotiating theresa two real has without bad years country a the may,0.2664359861591695,0.4875886524822695
what other for establishment probrexit deciding it proeu of happened peaceful event largest would lined be to a was said who at full up speak news attack cause the,0.06055363321799308,0.41312056737588654
behalf centenarian we city honorary manny our member labour on london party congratulate the of,0.26124567474048443,0.46099290780141844
health proposition being endorsed outcomes for services by of portions tax 2 will individuals allow on as mental well illness millionaires to a already fund spent housing with better leading,0.7041522491349481,0.4929078014184397
today is fallen date which failed for has 3 govt structural on same to years tackle the,0.46186618057726647,0.44956719125042083
bigwigs intelligence say will former other its sovereignty parliament surrender the under chief,0.2837370242214533,0.49113475177304966
claimants amber what pensions despite secretary rudd she has just benefit been appointed work about said and,0.5,0.7446808510638298
today honor armynavy great be shortly game will landing now headed to there the,0.039792387543252594,1.0
governor elect everything community for this served role and of we as can georgia her got to a do model weve has woman,0.46186618057726647,0.44956719125042083
not matter what voters republican want does to because the actually,0.46186618057726647,0.44956719125042083
55000 is now its official dsa strong members,0.07958477508650519,0.6187943262411347
there will you be,0.6539792387543253,0.7092198581560284
how history can richest fund billions cant in give man funny to they ny but the afford mta,0.7906574394463668,0.005319148936170213
honor is we fallen our due sisters this use acts day to a memory the senseless of,0.27854671280276816,0.2801418439716312
today cochair thank our you volunteering for coming by gotv supervisor and,0.27854671280276816,0.2801418439716312
blow opportunity time dont brexit you have now this coalition it national golden to a during lead,0.46186618057726647,0.44956719125042083
gathering joining night at for small thanks families of to last a friends and,0.46186618057726647,0.44956719125042083
own hard is entrepreneur advocate formerly woman contain in incarcerated social to a tireless words,0.46186618057726647,0.44956719125042083
more advocating victor effectively libertarianism added video libertopia playlist to a marc i,0.5121107266435986,0.7092198581560284
socialist faced for that and showed of disappearance overthrow we fought campaign democratically truth their stood them trial fight justice never a thousands people he elected government in tragically chile with the,0.49653979238754326,0.09042553191489362
how ocasiocortez alike via you for trump just it think pay and,0.46186618057726647,0.44956719125042083
communities will labour our this in every region rebuild country of,0.8633217993079585,0.1595744680851064
northern country areas was brexit say across represent in direction vote to constituency a many i the and,0.46186618057726647,0.44956719125042083
is makes time now lets just it go the sense,0.46186618057726647,0.44956719125042083
is great step moment act anything first on from but the drop rundown,0.8252595155709342,0.17553191489361702
uk cardiff is highest shown collecting reports second area lane fines have recent now for in council that the bus,0.46186618057726647,0.44956719125042083
great for this every strong veteran of and honor we end fought free worn war heroes on 100th veterans anniversary the nation who kept our in has uniform america safe day brave wwi,0.7024221453287197,0.8351063829787234
health services it that from reported and of only vital nhs able mental access yesterday harder to sadly required was made onequarter people who tories have currently help young were the,0.46186618057726647,0.44956719125042083
beautiful cake with thank you for me this to surprising the union,0.7837370242214533,0.22695035460992907
billion dollars is itself including year for illegal it that could explain please pays security we somebody 250 on their wall drug terrible flow two to democrats a $25 done need not losses border months votes our immigration get in top country the,0.6020761245674741,0.6134751773049646
socialist street take by that fascists of how generation one cable max stood proud friend deeply strength saddened to a was at communities fascism my defeat in up 1930s helped wonderful passing the jewish,0.6799307958477508,0.6950354609929078
not commentator we partisan have different roles am nonpartisan a journalist i,0.7076124567474048,0.31560283687943264
truthteller with much pathetic putin she establishment league and of cryptofascist would treat one right left actually as her a few assad leftist genuine respect effectively in ran politicians fo i the if,0.46186618057726647,0.44956719125042083
protect no elect or community republicans tomorrow attacks love and matter back will been on their ruthless lgbtq democrats they fighting who americans have in all were are the,0.78719723183391,0.13829787234042554
is citizens engage with for truth added video ability playlist to attack a under i the,0.7681660899653979,0.1276595744680851
black shop fight people be solidarity workers and for retail all friday kind working with union,0.46186618057726647,0.44956719125042083
dump very walks mays successful brexiteers london from and of means peaceful rally march exit today clear deal message brexit thanks participated to woeful a thousands was not who enjoyable life in those all betrayal the,0.7664359861591695,0.02304964539007092
no is calling now in those than attending better,0.657439446366782,0.526595744680851
gop strong tax we your amendment can protect second senate medicare defend cuts majority with a and,0.7647058823529411,0.1400709219858156
health is 15 deadline you december for get 2019 covered insurance go to the need if,0.46186618057726647,0.44956719125042083
is very successful illegal prime taking italy and of stance will on their states economy hard be 100% united a line agree minister working he likewise immigration with i the,0.46186618057726647,0.44956719125042083
team so your much for lets get thanks this passed all love yes an work the and,0.03806228373702422,0.11702127659574468
more stop cost each system this it that credit of and revealed pushing defending month mcvey esther will its families been into today millions be halted universal to must flawed saying time has failing,0.31141868512110726,0.4946808510638298
ive had thing is we pass tax here exactly another up cuts it kind why to round need of,0.2560553633217993,0.48226950354609927
more employees staged at whole workers store chicago in offered were a protest foods after,0.5415224913494809,0.7109929078014184
hookem slams watch is history deal treason worst leader mays for in mike deputy share the may,0.27162629757785467,0.5141843971631206
health expand for this and of administration protecting access two first to who fighting officials elected democratic have spent years thankful the care,0.8685121107266436,0.574468085106383
70% proposition is endorsed $250m housing bond by passed it a affordable and,0.7041522491349481,0.4875886524822695
hotel legacy marriott lgbtq+ for workers in overwhelming on lives striking the support,0.46186618057726647,0.44956719125042083
proud fox conservatives at supporting for up boys stand supporters on risk their wow many the,0.2975778546712803,0.48936170212765956
talk alot liked video to theres a about i,0.6920415224913494,0.2801418439716312
shes endorsed board kristy for workers now organized because and of librarians save five libraries advocacy their when fired them her rehired to a cooper hold library trying constituent get accountable unionize were the,0.6211072664359861,0.07092198581560284
ben changing demographics shapiro america on death are israel the of,0.7768166089965398,0.17198581560283688
embarrassment united who we doesnt is president international believe fact have states in that an a science the of,0.3027681660899654,0.6187943262411347
stop much me thanks too okay please,0.5034602076124568,0.09574468085106383
sorghum take on love id to again,0.9602076124567474,0.4787234042553192
credit is makes respect due you him me gave it of that actually when because i and,0.46186618057726647,0.44956719125042083
most is at living this government in shambolic the,0.5034602076124568,0.6294326241134752
is very being including with ceo china for barra this now looking michigan and ohio we saved disappointed their closing general us cutting closed thanks mexico maryland plants subsidies at motors nothing get in all are mary the,0.7474048442906575,0.28368794326241137
women not americans white until african vote could,0.6833910034602076,0.4946808510638298
can say selfie you video in that a,0.7024221453287197,0.2783687943262411
2017 presidential offering across instead by real europe dangerous coming of and how french alternative together right defied defeated be can economic a discussed investment behind far people expectations rise in election social the,0.06401384083044982,0.7712765957446809
martial liked video in planning law a i and,0.5778546712802768,0.24468085106382978
cochair with our other have helping to efforts happy gotv,0.2975778546712803,0.48226950354609927
questions must people increase we broadband home in raised issue working from i the digital of,0.28546712802768165,0.46808510638297873
gay 40 today harvey tool closet elected was cas milk openly assassinated official ago of knew 1st a the yrs,0.46186618057726647,0.44956719125042083
considered sale is very game with what come exciting china now criminalize this out changer it could meeting coming of president will things one promise xi into on states his be deadly to united a fentanyl my me the,0.6643598615916955,0.2872340425531915
broke communist hand hottie president while gold wearing instagram rolex making gesture a the,0.46186618057726647,0.44956719125042083
his brad drives promises trump blakeman has it on good democrats made and,0.46186618057726647,0.44956719125042083
defying 2020 no is reelect another for because better and chair history mcdaniel unprecedented gains job one as oversaw strength fundraising her asked serve to there term ronna senate have my in rnc i the,0.2664359861591695,0.7145390070921985
mitt trumps racist office with romneys policies two in first were years tweets but,0.71280276816609,0.2925531914893617
hope that country fails deal be can tories brought together any to bad again give the,0.6868512110726643,0.7375886524822695
petition nursing pm even bursaries this now on to question sign answer attempt,0.7647058823529411,0.2872340425531915
lawabiding believe for republicans always and of will enforcement stand heroes law be sanctuary aliens a not americans should our criminal with country the,0.49480968858131485,0.7163120567375887
regressive being fuel fossil dont for neoliberal that and bill companies know we fair you make their foot when screwed crappy rich class to working pay taxes people policies want were are share the,0.46186618057726647,0.44956719125042083
is these come now hunt go from $30000000 department and of continues back foundation angry their lives but clinton terrible got where gang look to democrats they people at witch nothing ruined let past the server,0.9290657439446367,0.49822695035460995
hostile must tories reject and environment this cant division politics go the toxic of,0.01903114186851211,0.06560283687943262
down free antimedia project press for truth in shut just thought and hundreds of the censorship,0.2906574394463668,0.4858156028368794
is back yard everyone tomorrow republican one need on to are vote line america winning the friends and,0.46186618057726647,0.44956719125042083
trumps president message discuss join on to and,0.7249134948096886,0.2695035460992908
candidates who history commentary democratic exciting excellent young on diverse last from made the and,0.05363321799307959,0.5939716312056738
is your deal britain mrs time brexit fightback and you for now betrayal of to a the may,0.34256055363321797,0.09574468085106383
for get out vote and,0.6955017301038062,0.7109929078014184
representation men long another for parliament go then could and since become only 100 stand 5050 been today celebrated wait cant to 4503 a women elected weve way have years 491,0.06228373702422145,0.17907801418439717
protect is wisconsinites voice ready to the of,0.07785467128027682,0.35638297872340424
no labour it confidence and fail know we only will strengthen trigger vote when itll theresa serve to a wont may,0.08304498269896193,0.38475177304964536
mcconnell rise here senate senators via for up republicans republican vote to need mitch and,0.46186618057726647,0.44956719125042083
gain is our for this control future house win a dems the of,0.06747404844290658,0.19148936170212766
bloomberg is fossil time makes divest michael long but it fuels capitalism past to from thinks climate change,0.71280276816609,0.7216312056737588
more be created fun wealth next will 10 fact over remember in crypto than years prior but the,0.740484429065744,0.20390070921985815
cloud was going solve our computing nosql all to there when i the,0.5865051903114187,0.0797872340425532
change worse should be at off nobody put have universal system has of to risk their homes because and,0.773356401384083,0.49645390070921985
women won democratic down and week up take ballot diverse last a the slate of,0.7249134948096886,0.4875886524822695
18% is context approval this just rating into to put emmanuel,0.46186618057726647,0.44956719125042083
ive had heart nations united a,0.46186618057726647,0.44956719125042083
everyone year for this new that and most so history will brighter thankful victory be congress servants diverse to democrats a public who fighting worked carry in future all were tirelessly many the,0.6072664359861591,0.22340425531914893
dont and republicans statement why about unsustainable spending debt unfortunate care,0.03806228373702422,0.5886524822695035
health administration we reproductive access and congressional trump take republicans away care allow to womens the wont,0.24740484429065743,0.4698581560283688
crime is great for vets strong and of doing job 2nd on endorsement pennsylvania military a total people amendment he border our lloyd my has the,0.46186618057726647,0.44956719125042083
dnc for go ten and chair we florida rally vote when gotv watch lower to eligible bring they at low joins friends,0.46186618057726647,0.44956719125042083
is or labour prime lost it that from and jobs how know will generation their homes hostile nhs denied scrap disgrace minister a people policy shameful environment either windrush were many the care,0.6505190311418685,0.6985815602836879
crime is vets strong and of fantastic on endorsement pennsylvania military total scott amendment he border second our my has perry the,0.6851211072664359,0.7127659574468085
more read very prison for looking new and job legislation hire supporting leaving today fresh here pledge includes start am reforms to a contains significant life our those american many i the,0.32006920415224915,0.25177304964539005
focusing this new and something citizenship securing will loopholes republican ryan on than rather closing his be holding about opinions giving paul knows should he border our birthright nothing immigration majority work the,0.0986159169550173,0.3971631205673759
for pray lost victims california of and we danger firefighters their lives grave courage thank first face to incredible wildfires in mourn want responders i the,0.4913494809688581,0.5585106382978723
that deny is we real fact cannot republicans allow to climate the change,0.5155709342560554,0.7163120567375887
referendum is declares brexit second for group cross it party a preparing,0.27335640138408307,0.5177304964539007
more escalating seekers our asylum now up attacks migrant on needs caravan with than ever sign the support to,0.7231833910034602,0.28368794326241137
watch delaying pm brexit vote to a discussed set the british and,0.26124567474048443,0.4858156028368794
must mean fightback brexit believe our in,0.3062283737024221,0.6134751773049646
for contract spur retrain and will into their when them today us guarantee complete home veterans to a they heal support opportunity action our have let social give the,0.03460207612456748,0.624113475177305
live us as being troops liked video used shields in human a i,0.46186618057726647,0.44956719125042083
not leaving is colleague being asking arrested for my capitol rotunda why to the and,0.06920415224913495,0.37056737588652483
sane us he agreed citizenship reid with birthright on when was harry,0.46186618057726647,0.44956719125042083
great she this by nancy of honor earned deserves we fairness pelosi will speaker republican perhaps hard be her some chosen house to democrats a they time votes in has all add give the if,0.46186618057726647,0.44956719125042083
as nightmare some 25 meanwhile for over this trump ago *months* still isnt separated the kids of,0.7577854671280276,0.6826241134751773
important dncs national call thread before faith final on today be well days giving at election 10/31 outreach day the updates,0.46186618057726647,0.44956719125042083
no ukip plans exconvicts be members says ukips for in house to unless theres the of,0.0847750865051903,0.6046099290780141
people january will diversity represent in house democrats reflect they the of,0.46186618057726647,0.44956719125042083
hope no bill we them here bars to a there they behind people full have help passed clip are 200000 havent,0.03633217993079585,0.2127659574468085
who deal should can brexit then way cannot government get for this make it those good a country the if,0.46186618057726647,0.44956719125042083
despicable pundit name literally every call that and of talk had we you talked called when but them nobody where collegeeducated color a about people racist week me i,0.29238754325259514,0.25886524822695034
aw team know your is boss closest youre you and thanks blessed one when shucks friends of,0.7197231833910035,0.6914893617021277
are credit household tool as highlighted abuse at universal a for payments single perpetrators using i domestic of,0.46186618057726647,0.44956719125042083
change left we opportunity build majoritarian at with moment potential for to are historic base a the of,0.46186618057726647,0.44956719125042083
w/ sat solidarity refugee in let 11/24 vigil them,0.49480968858131485,0.6347517730496454
his we should him trump supporters defend why if,0.46186618057726647,0.44956719125042083
unity is present cities size every of and away power be going wrest class to working need towns in were if,0.2975778546712803,0.2783687943262411
leaving peoples eu aka under have debate now away actually vote losers lets proper a the wto,0.30103806228373703,0.425531914893617
people is complete deal total mays fit she for it betrayal of isnt ever worst a the and,0.7820069204152249,0.5177304964539007
country us while dominates in has right on cultural a nearmonopoly left the power,0.07958477508650519,0.35106382978723405
socialism can you have too,0.46186618057726647,0.44956719125042083
most deal substantial tentative prison reached senators the group rewrite + on a sentencing bipartisan of,0.08823529411764706,0.10106382978723404
exodus your attending/organizing for call sun and diego international san reply 11/25 coalitions to chapter a action refugee solidarity central migrant endorses american with dsa the,0.2664359861591695,0.4875886524822695
great or these remedied large for take by protests payments european soon and account of how reasonable topics french both fair violent into been on states protection be treated badly united military trade union must our has the,0.46186618057726647,0.44956719125042083
more bit largest common will labour towards businesses little good pay under a the,0.33217993079584773,0.5195035460992907
rainbow such wave happy cnn say you watchin phrase on loved a,0.6885813148788927,0.7074468085106383
admits left full former wing liked video in bias a speech i host,0.46186618057726647,0.44956719125042083
sorry more dump this brexiteers london of means event rally turned you than exit etc today owen clear deal brexit thank disappoint send message participated to couple a thousands who at up central in government hundred many the,0.9100346020761245,0.4769503546099291
is across female this year like post history celebrate us to a made incredible women who have help future give country the,0.2958477508650519,0.38475177304964536
what or she this just admitted that because dems of imagine become statements you disgusting false on fake vicious can her justice where accuser a about was made lying story he kavanaugh others court up supreme has totally are the if,0.5934256055363322,0.14361702127659576
is restored you heart legend my too,0.46186618057726647,0.44956719125042083
today no west brooklyn be and cant in walked out thought about it that fires outside reading the after,0.7249134948096886,0.46808510638297873
members asking weve scene lobbying support all been on to are with dsa morning the progressives them,0.9152249134948097,0.48404255319148937
regulation bureaucrats alert your formal socialist comment telling these reject now europeanstyle want american on to controls price impose drug,0.32698961937716264,0.4858156028368794
uk stop this does and end war yes saudi crisis yemen humanitarian arming special to a arabia have help in causing the,0.6591695501730104,0.700354609929078
horrific is state authorities killing pittsburgh of and know you police custody been federal dispatched today local as earlier pennsylvania shooter to there a was targeting support tree americans at life have shooting in the jewish synagogue,0.24048442906574394,0.4095744680851064
today voted no ukip nec leader gerard in motion against confidence overwhelmingly a batten the of,0.07785467128027682,0.39184397163120566
health today americans getting we be at up cant successful let republican get covered to efforts keep from sign care,0.28027681660899656,0.4858156028368794
so hear my mother to good,0.657439446366782,0.0975177304964539
how ocasiocortez alike via you for trump just it think pay and,0.46186618057726647,0.44956719125042083
health must people 65 have insurance older good pretty and,0.2301038062283737,0.28368794326241137
socialism 501c3 traditions this does of and history sister gift on includes introducing to activists educational organization democratic our fund young want work dsa give the,0.7231833910034602,0.23581560283687944
women is projecting cnn number seats will currently record in house that the 96 a win representatives of,0.29238754325259514,0.5035460992907801
not is imagine thinking survival right that human a,0.46186618057726647,0.44956719125042083
your whether or hispanicamerican that needs africanamerican you right first to live a are at have in any american all puts country the,0.46186618057726647,0.44956719125042083
is socialist republicans democrat and of jobs best history created nightmare republican market on economy dream earth agenda a planet our have in american hottest country the,0.6557093425605537,0.38475177304964536
questions gop floating opposition senate for explained it that a was list the of,0.3096885813148789,0.6223404255319149
lawson new east from bader and adam talk importance of stories w/ youth his here germany to president/ceo charitable about giving capital fund in america share joins the,0.6730103806228374,0.22340425531914893
hard we only going have this get been on to working better and,0.26124567474048443,0.6737588652482269
important reminder cyber amazon $20 with million this contract has ice monday that an a,0.46186618057726647,0.44956719125042083
