last night tory mps blocked the release of the governments own analysis of the impact of universal they want to cover up how its devastating peoples cant go,0.32006920415224915,0.4698581560283688
unless you support radical decarbonization 100% carbonfree energy in the us by 2030 and a plan that centers,0.3719723183391003,0.5053191489361702
i look forward to my meeting with chuck schumer nancy pelosi in 2006 democrats voted for a wall and they were right to do so today they no longer want border security they will fight it at all cost and nancy must get votes for speaker but the wall will get built,0.49480968858131485,0.4875886524822695
if someone were to ask me the most based interesting and impactful mainstream conservative commentator the answer is easy tucker willing go places the others and he can be sharp and witty a definite improvement over people like bill,0.49480968858131485,0.6843971631205674
un migration compact whoever signs it presents a serious risk to their own citizens sign,0.2958477508650519,0.38475177304964536
a budget for the health services cut by billion next year no new money for overstretched overcrowded,0.49480968858131485,0.4875886524822695
small independent member of the eu thats all she wants a small vassal state strong independent and sovereign united kingdom outside the eu trading freely with the world thats what a true brexit will bring us for that to happen we need to walk away now,0.3166089965397924,0.5070921985815603
its not a blue wave we are in a blue hope has been that the antibodies would kick in that this infestation of hatred and division would drive response from the american people in both parties and say no more,0.6799307958477508,0.7109929078014184
it was a whitelash in part as i said research shows racial resentment cultural anxiety are key aspects of trump phenomenon though some do support him without embracing that stuff that said im done talking with u others analyzed race all week but ure mad at me hmmm,0.6799307958477508,0.7198581560283688
we need more political courage and less political consternation dont let fossil fuel funded politicians lie to you,0.12802768166089964,0.26063829787234044
it turns out that the billionaires who apparently own the bulk of the british press like us one little online and on the doorstep our peoplepowered movement will transform britain,0.6089965397923875,0.6595744680851063
shout out to all the small dsa chapters doing the work compare yourselves to the big city chapters,0.28027681660899656,0.7056737588652482
we have until dec 13 to set the agenda for 2019 a must be a us in washington dc on dec 10,0.26124567474048443,0.46099290780141844
socialism without the restoration of indigenous sovereignty is just colonialism white supremacy in shiny new packaging,0.06747404844290658,0.19148936170212766
your friend joe shmoe might think economics is boring but thats exactly what the ruling class wants luckily we,0.49480968858131485,0.4875886524822695
trump thunders at media for smearing his supporters after bomb scares via,0.2629757785467128,0.49645390070921985
ill be back im rebooting working on a very interesting project now,0.6920415224913494,0.6932624113475178
we demand a world where violence against women and girls is eradicated and ready to fight for,0.49480968858131485,0.4875886524822695
ukip leader to speak at probrexit march and rally this demands brexit and nothing short,0.49480968858131485,0.4875886524822695
walked outside in brooklyn today after reading about the fires out west and thought no it cant be that,0.7041522491349481,0.26595744680851063
once again democrats show that were committed to lifting up every voice that includes recognizing the importance of woman of color in leadership congratulations,0.49480968858131485,0.4875886524822695
we marched we protested now we confirm your polling place at and lets get ready to show up at the polls like never your downloadable poster today,0.23356401384083045,0.50177304964539
because what republican voters actually want does not matter to the,0.6141868512110726,0.0797872340425532
president trump and key senators are pressing republican leadership to act on a longawaited senate bill called the,0.039792387543252594,1.0
lets bring it home florida,0.48788927335640137,0.06205673758865248
happy to have other cochair helping with our gotv efforts,0.2750865051903114,0.5336879432624113
held out for way too much under and we got on with,0.5069204152249135,0.723404255319149
its working keep the pressure on and dont let them get away with this,0.6937716262975778,0.6826241134751773
new york passes minimum wage law for uber lyft drivers hikes costs to riders appalling to see such positive disruptors get whittled down by political bosses trying to reassert a status quo that was clearly worse for via,0.6833910034602076,0.6968085106382979
workers under labour will get full legal rights such as sick pay holiday and parental leave protection from dismissal,0.7231833910034602,0.23581560283687944
is an american hero she gave this speech 275 actions have been planned for tuesday nov 20th to,0.2750865051903114,0.7180851063829787
so sick of the fossil fuel millionaires back roars are making my family,0.7058823529411765,0.28368794326241137
there is a rumor put out by the democrats that josh hawley of missouri left the arena last night early it is fake news he met me at the plane when i arrived spoke at the great rally stayed to the very end in fact i said goodbye to him and left before he did deception,0.7110726643598616,0.6702127659574468
i added a video to a playlist marc victor advocating libertarianism more effectively libertopia,0.5778546712802768,0.24468085106382978
we know tobacco is one of the biggest killers and yet fewer smokers now kicking the habit after years of tory cuts to,0.49480968858131485,0.4875886524822695
just flipped a kansas house seat from red to blue with her win tonight in ks03,0.49480968858131485,0.4875886524822695
alea has still refused to release the video of ej bradfords murder organizers are asking people all over the country to,0.35813148788927335,0.44148936170212766
president trump attends the american commemoration ceremony at suresnes american cemetery,0.1903114186851211,0.375886524822695
want to give the gift of socialism on our 501c3 sister organization dsa fund does educational work this includes introducing young activists to the history and traditions of democratic socialism,0.2889273356401384,0.5053191489361702
janelle ortiz and roxana trans women of color one a sex worker who left her us hometown and one a,0.7716262975778547,0.2641843971631206
batten on the quislings and the for a political rebellion through the ballot box,0.2837370242214533,0.4875886524822695
to put this into context emmanuel approval rating is just 18%,0.49480968858131485,0.4875886524822695
in all fairness nancy pelosi deserves to be chosen speaker of the house by the democrats if they give her a hard time perhaps we will add some republican votes she has earned this great honor,0.29930795847750863,0.601063829787234
as a life long tory voter i hereby pledge my future vote to your good self mr batten,0.49480968858131485,0.4875886524822695
this pearl harbor remembrance day join us in remembering and honoring the lives we lost 77 years ago,0.49653979238754326,0.09042553191489362
heres how i viewed trump in december hes appointing what he ran he has a year and a half to enact meaningful immigration legislation the time to be critical of him is,0.78719723183391,0.13829787234042554
there is no reason for these massive deadly and costly forest fires in california except that forest management is so poor billions of dollars are given each year with so many lives lost all because of gross mismanagement of the forests remedy now or no more fed payments,0.6643598615916955,0.2872340425531915
so tomorrows show looks something like cash wars amaury and craig wright on,0.2370242214532872,0.5691489361702128
china does not want tariffs,0.49480968858131485,0.4875886524822695
on the 80th anniversary of the horrors of kristallnacht when jews in germany faced murder and deportation the hatefilled ideologies of the far right are on the rise stand united with jewish people and all communities against antisemitism and fascism,0.2889273356401384,0.4787234042553192
today launched a call for evidence as part of planning commission created to support our vision of a new,0.06401384083044982,0.32978723404255317
economic justice means that maybe just maybe we will be able to begin a discussion in this country on a word that,0.7041522491349481,0.2783687943262411
out here w coming for your neoliberal climate policy,0.8217993079584776,0.12234042553191489
the illustrious human rights champion and fitness connoisseur christine fair makes a reappearance to threaten a woman,0.49480968858131485,0.4875886524822695
if trump defend his supporters why should we defend him,1.0,0.6187943262411347
not much republicans and democrats agree on these days but both sides agree we need to pass the,0.49480968858131485,0.4875886524822695
huh i didnt mention race at movements practical philosophy lies in its leaders words and,0.49480968858131485,0.4875886524822695
holyrood will vote on scottish labours plan to end the privatisation our railways later if you believe,0.7249134948096886,0.46808510638297873
richard cordray will let you down just like he did when he destroyed the government agency that he ran clone of pocahontas not for ohio mike has my total endorsement,0.04671280276816609,0.12056737588652482
one a little boy i complained to my mamma just have dinner cause we got chicken but,0.7491349480968859,0.22872340425531915
cant wait to turn things around by *checks notes* working 100 hours a week in the hopes of eventually selling myself to,0.49480968858131485,0.4875886524822695
diversity is our nations greatest strength were proud that our newlyelected democratic members of congress reflect that,0.2647058823529412,0.48404255319148937
this is bad its the kind of thinking where liberalism and individualism lead,0.2958477508650519,0.274822695035461
thank you to the union for surprising me with this beautiful cake,0.754325259515571,0.2695035460992908
theresa may has spent two years negotiating a bad deal that will leave the country without a real say,0.7923875432525952,0.2198581560283688
my latest video on the and why you should join,0.31314878892733566,0.48226950354609927
i liked a video silencing and bribing trudeau liberals rigging 2019 elections,0.8114186851211073,0.12056737588652482
today i partner with our fellow black conservatives for a united purpose we will,0.5294117647058824,0.5053191489361702
gop senate it was explained that the opposition was floating a list of questions for senate,0.14705882352941177,0.3528368794326241
how is not at 100k followers this a retweet lets get our friend to 100k before world,0.29238754325259514,0.4875886524822695
brandon judd of the national border patrol council is right when he says on that the democrat inspired laws make it tough for us to stop people at the border must be chanded but i am bringing out the military for this national emergency they will be stopped,0.49480968858131485,0.4875886524822695
i added a video to a playlist new q plus 5 signs globalism is going down,0.22145328719723184,0.6861702127659575
says the gender recognition act reform is a good out the survey here,0.28546712802768165,0.5762411347517731
signs coalition letter to opposing hhs medicare part b rule countries w/ single payer health care to determine rx prices for american patients/caregivers gives foreign lawmakers influence over our domestic policy,0.32698961937716264,0.5070921985815603
we are encouraged by the leadership slate that has been put forward by the democratic party especially the inclusion of,0.8062283737024222,0.11702127659574468
happy thanksgiving from all of us at dsam4a,0.6038062283737025,0.40070921985815605
the way is handling brexit is a national humiliation and now the whole world is laughing at,0.26124567474048443,0.6737588652482269
we need medicare for all so that no person in america ever goes bankrupt or loses their life again as a result of the,0.32698961937716264,0.7340425531914894
youth workers do amazing things to transform the lives of young theyve been abandoned by the tories with funding down 62% since explains how well invest in the talent of all our young,0.2768166089965398,0.6914893617021277
healthcare is a human right,0.7698961937716263,0.6702127659574468
latest from eu project apocalypse mark carney says no deal will make the seven plagues of,0.29930795847750863,0.5212765957446809
thank you for bringing your super duper serious reporter face and voice to,0.03806228373702422,0.11702127659574468
the paris agreement working out so well for paris protests and riots all over france people do not want to pay large sums of money much to third world countries that are questionably run in order to maybe protect the environment chanting want love france,0.49480968858131485,0.4875886524822695
the camp fire is a capitalistcreated disaster,0.7249134948096886,0.2695035460992908
on this veterans day the 100th anniversary of the end of wwi we honor the brave heroes who fought for america in the great war and every veteran who has worn the uniform and kept our nation safe strong and free,0.28719723183391005,0.4929078014184397
i liked a video live us troops being used as human shields in,0.3235294117647059,0.75
we recently relaunched socialist forum our quarterly publication for debate among dsa members about socialist theory and strategy our first batch of articles covers what political revolution means dsas role in bringing it about,0.486159169550173,0.6843971631205674
on let us show solidarity with transgender community remember those who have died reflect,0.031141868512110725,0.17375886524822695
deeply moving ceremony today at islington manor remember the brave who left home not knowing if they would see their loved ones we remember the two world wars which destroyed a generation and shattered communities around the,0.6920415224913494,0.6843971631205674
donald trump never misses an opportunity to miss an opportunity to show real leadership even if hes making,0.698961937716263,0.35638297872340424
the season to wrap some this awesome donkey wrapping paper at,0.6211072664359861,0.07092198581560284
despite the large caravans that were forming and heading to our country people have not been able to get through our newly built walls makeshift walls fences or border patrol officers military they are now staying in mexico or going back to their original countries,0.26124567474048443,0.49645390070921985
pm even attempt to answer question on nursing bursaries sign this petition now,0.8131487889273357,0.21453900709219859
new w/ capital fund president/ceo lawson bader joins adam to share stories from his youth about east germany and talk about the importance of charitable giving in america here,0.8356401384083045,0.225177304964539
just returned from france where much was accomplished in my meetings with world leaders never easy bringing up the fact that the us must be treated fairly which it on both military and trade we pay for large portions of other countries military protection,0.2560553633217993,0.49113475177304966
i am thirty two years old today was the first time i voted for another queer woman of color thank you,0.27335640138408307,0.6914893617021277
education is a right not a commodity that can be bought or were demanding an end to the tories underfunding and privatisation of our education system,0.07958477508650519,0.35106382978723405
you just pay for it how trump and ocasiocortez think alike via,0.06055363321799308,0.41312056737588654
great honor to be headed to the armynavy game today will be there shortly landing now,0.754325259515571,0.4946808510638298
arizona together with our military and border patrol is bracing for a massive surge at a nonwalled area we will not let them through big danger nancy and chuck must approve boarder security and the wall,0.22491349480968859,0.475177304964539
congratulations to ron desantis on becoming the new governor of florida against all odds he fought fought fought the result being a historic victory he never gave up and never will he will be a great governor,0.4913494809688581,0.2783687943262411
in the sixth richest country in the world no child should go hungry this christmas or why im proud to support the end hunger feed a family christmas,0.19377162629757785,0.39361702127659576
apparently jason van dyke has taken control and the proud boys are up to their usual nonsense i find it amusing that they think denouncing the altright is going to change their fate,0.2889273356401384,0.6773049645390071
actually we have forprofit now they are companies + boards saying on your own bc they,0.8217993079584776,0.16666666666666666
he tragically never faced trial for the overthrow of a democratically elected socialist government and the disappearance of thousands of the campaign we fought showed the people of chile that we stood with them in their fight for truth and justice,0.7024221453287197,0.6117021276595744
this heartless tory government is tearing lives,0.2629757785467128,0.4804964539007092
democratic socialists distribute more n95 masks than the city,0.5951557093425606,0.7730496453900709
i agree with president obama 100%,0.3027681660899654,0.45390070921985815
this president has been mindless heartless and gutlessto demonize this ragged band of refugees as a threat to the,0.24740484429065743,0.4734042553191489
deputies confused a grannys cotton candy for meth high bond kept her jailed for months via,0.29238754325259514,0.48404255319148937
proposition 2 endorsed by will allow portions of a millionaires tax already being spent on mental health services to fund housing for individuals with mental illness as well leading to better outcomes,0.2906574394463668,0.28368794326241137
trump is pulling out of the inf treaty this is a dangerous step making conflict more not less likely i urge the,0.10726643598615918,0.6046099290780141
let me be real i loathed this man when he was potus i have spent my career battling the effects of the racist willie horton ad other attacks on criminal justice reform which were associated with his 1988 campaign but i must admit i love this clip stop watching it,0.49480968858131485,0.4875886524822695
labour wont trigger a no confidence vote when we know it will fail itll serve only to strengthen theresa may and,0.3892733564013841,0.9219858156028369
breaking has won reelection to the us senate women are leading the way tonight,0.24567474048442905,0.7358156028368794
really want to be part of a club that is going to be rude and not give me what is audience,0.7231833910034602,0.28900709219858156
were live on the regulatory update debunks the disastrous proposal to bring europeanstyle drug price controls to america stop socialist price controls here,0.49480968858131485,0.4875886524822695
young people everywhere are speaking truth to power one girls story of fighting for our planet,0.2664359861591695,0.5354609929078015
the in the sexual marketplace of and postmonogamous society just so happen to be crucial components of the democratic coalition,0.6903114186851211,0.6879432624113475
today headed to the us/mexico border at san ysidro to meet with asylum seekers to hear their stories and observe,0.49480968858131485,0.4875886524822695
full clip here there are 200000 people behind bars they have no hope no help we havent passed a bill to help them,0.18339100346020762,0.475177304964539
thou dost protest too much it is an honor to be insulted by the likes of you and i must be doing something right,0.49480968858131485,0.4875886524822695
president trump in 2017 we never again will sacrifice ohio jobs and those in other states to enrich other,0.3062283737024221,0.6134751773049646
some important from my struggle has made me fierce and we all need to be a little fierce to get things done congress has never heard a voice like mine but come 2019 it certainly often,0.7301038062283737,0.274822695035461
our politics are simple from each according to their ability to each according to their who occupies,0.49480968858131485,0.4875886524822695
there is nothing populist about socialism it has never empowered the in socialist systems the little guy,0.49480968858131485,0.4875886524822695
you just pay for it how trump and ocasiocortez think alike via,0.49480968858131485,0.4875886524822695
cutting 50000 police staff has created a crisis in of criticising our hardworking and overstretched police the government must put more officers on the beat,0.49480968858131485,0.4875886524822695
our pledge to hire american includes those leaving prison and looking for a very fresh start new job and new life the legislation i am supporting today contains many significant reforms read more here,0.12110726643598616,0.34929078014184395
we were able to give out 80 vaccines at our flu shot clinic today thanks to our healthcare working group for,0.18166089965397925,0.25
solidarity to everyone who is struggling at what is supposed to be a time of plenty,0.49480968858131485,0.4875886524822695
ukips says theres no plans for exconvicts to be in ukip unless the members of the house of,0.10899653979238755,0.2730496453900709
mays deal is the worst deal ever it is a complete and total betrayal of the people she isnt fit for,0.7750865051903114,0.25354609929078015
it was my great honor to host a conference on supporting veterans military everyone here today who has served our country in uniform to every veteran military family across our land i want to express the eternal gratitude of our entire nation,0.49480968858131485,0.4875886524822695
a diverse slate of democratic women won up and down the ballot last week take a,0.7214532871972318,0.4858156028368794
friends are on the one yard line and need everyone to vote republican tomorrow america is back america is winning,0.24740484429065743,0.49113475177304966
teachers have overwhelmingly rejected the snp unfair pay education really is,0.49480968858131485,0.4875886524822695
if chuck schumer and nancy pelosi gain the majority they will try to raise your taxes restore jobkilling regulations shut down your coal mines and timber mills take away your healthcare impose socialism and erase your borders vote for and,0.8044982698961938,0.2375886524822695
only through solidarity with the international working class can we end colonization and build a just future for,0.06401384083044982,0.3776595744680851
while the capitalist class is busy spinning the french riots as a populist uprising against climate changeinspired taxes,0.21107266435986158,0.4946808510638298
the trump admins push to classify trans people out of existence makes it clearer than ever that the rights and,0.7024221453287197,0.2978723404255319
wondering how the blue lives matter will handle cops beating a cop,0.7231833910034602,0.2978723404255319
so cool to see and together at the mississippi summit on,0.3044982698961938,0.4574468085106383
beautiful evening at a with great american patriots loyal citizens like you helped build this country and together we are taking back this country returning power to you the american people get out and,0.6833910034602076,0.7021276595744681
and i ready to cover a recordsetting midterm on vote vote vote love to celebrate,0.49480968858131485,0.4875886524822695
this is how theresa may threw the country into even further disarray,0.828719723183391,0.13120567375886524
trump has made good on his promises and it drives democrats brad blakeman,0.7179930795847751,0.6950354609929078
oh i get it i am a very good developer happily living my life when i see our country going in the wrong direction to put it mildly against all odds i decide to run for president continue to run my businessvery legal very cool talked about it on the campaign trail,0.49480968858131485,0.4875886524822695
thanks to for uploading this amazing photo to for free,0.49480968858131485,0.4875886524822695
i love you missouri under republican leadership america is booming america is thriving and america is winning,0.12283737024221453,0.17907801418439717
warm reception on with talking to the residents of,0.49480968858131485,0.4875886524822695
were about to see whos really here for the technology,0.2906574394463668,0.2730496453900709
we only have 4 more days to help get out the vote for democrats grab your friends and head to an event in your community,0.615916955017301,0.07092198581560284
one of the very exciting things to come out of my meeting with president xi of china is his promise to me to criminalize the sale of deadly fentanyl coming into the united states it will now be considered a this could be a game changer on what is,0.7058823529411765,0.4946808510638298
borders = genocide the ruling class dispossesses whole populations pit us against each other leave us to die when,0.7041522491349481,0.2393617021276596
twenty years ago i was proud to join the campaign to extradite pinochet for his crimes against the people of i am in geneva meeting michelle bachelet who was imprisoned and tortured by pinochets regime she later became the first woman president of chile,0.49480968858131485,0.4875886524822695
members are leaving congress b/c legislative process dominated by party leaders who pressure to raise committee gavels now more than $1m in party repels public servants who want to get things done,0.35813148788927335,0.4716312056737589
in calling those attending is now no better than,0.157439446366782,0.21631205673758866
i added a video to a playlist beginners guide how to pos mine decred on a mac using dcrwallet via,0.7647058823529411,0.2872340425531915
