got a huge flip to report in the northeast democrat will be the next governor of maine and the first woman to ever serve maine as governor congratulations,0.8650519031141869,0.22163120567375885
forget to come down to islington young launch party on the 15th / 730pm+ prince alfred marlborough,0.49480968858131485,0.4875886524822695
the story of granby street is inspiring,0.2820069204152249,0.48936170212765956
on the international day of the girl i think of this inspiring poem by jasmine age 11 from liverpool,0.3027681660899654,0.6187943262411347
nice comment from on show and paraphrasing before have we had so much data and so,0.6764705882352942,0.6702127659574468
thanks to all of those who participated in a very successful peaceful and enjoyable march rally today in london the message from the thousands of brexiteers from all walks of life today was clear brexit means exit not mays woeful betrayal dump the deal,0.49480968858131485,0.4875886524822695
yes so much love for and the team an thanks for all your work lets get this passed,0.71280276816609,0.7216312056737588
this is a bad deal which isnt in the interests of the whole country,0.6937716262975778,0.6932624113475178
whatever you want to say about neocons they dont actually believe their own propaganda leave that up to their goofball conservatives allies,0.49480968858131485,0.8457446808510638
amber rudd has just been appointed work and pensions secretary what she said about benefit claimants despite,0.9186851211072664,0.39184397163120566
this community in derbyshire opposes fracking but the tories are refusing to forcing through dangerous plans that will affect communities across the country,0.2975778546712803,0.6187943262411347
paul stephenson made an outstanding contribution to british history he played a leading role in the fight against racism and is a hero of the civil rights honoured to pay tribute to him today as we mark black history,0.7179930795847751,0.7109929078014184
thank you i was right in front of mark this has truly been a team effort,0.6833910034602076,0.700354609929078
why elizabeth dna test totally backfired,0.7647058823529411,0.1400709219858156
as you know earlier today there was a horrific shooting targeting and killing jewish americans at the tree of life synagogue in pittsburgh pennsylvania the shooter is in custody and federal authorities have been dispatched to support state and local police,0.27854671280276816,0.30319148936170215
representative bobby scott is right the will make us all safer while many of the people in prison,0.33391003460207613,0.6223404255319149
at says that after the events of the past week many people and many businesses will be confused,0.29238754325259514,0.4787234042553192
highschool parties became a kind of prep for being able to play hard was a sign that be able to work hard after the fouryear trial was complete,0.49480968858131485,0.4875886524822695
uns expands on to criminalise criticism of uk must not agree,0.7664359861591695,0.02304964539007092
scott perry of pennsylvania is fantastic he is strong on the border crime the military our vets and the second amendment scott has my total endorsement,0.49480968858131485,0.4875886524822695
senators reach bipartisan deal to ease sentencing laws the new york times,0.49480968858131485,0.4875886524822695
these stories make it clear black history is british,0.29930795847750863,0.2801418439716312
theresa may has to explain why after two years she has brought back a deal that even her closest allies think would,0.3027681660899654,0.2765957446808511
be like these guys took the to tell others you that do the,0.5017301038062284,0.7269503546099291
the people spoke in november republicans refuse to hear and seek to hold on to powerby any means this is not good for,0.759515570934256,0.6347517730496454
we cant let republican efforts to keep americans from getting health care be successful sign up today to get covered at,0.49480968858131485,0.4875886524822695
emmanuel macron suggests building its own army to protect europe against the us china and russia but it was germany in world wars one two how did that work out for france they were starting to learn german in paris before the us came along pay for nato or not,0.07439446366782007,0.3900709219858156
i liked a video theres alot to talk about,0.745674740484429,0.29432624113475175
today weve celebrated 100 years since women could stand to become since then 4503 men have been elected to parliament and only 491 have a long way to go and cant wait another 100 years for 5050 representation,0.2301038062283737,0.28368794326241137
at i highlighted perpetrators of domestic abuse are using universal credit single household payments as a tool for,0.49480968858131485,0.4875886524822695
while the disgusting fake news is doing everything within their power not to report it that way at least 3 major players are intimating that the angry mueller gang of dems is viciously telling witnesses to lie about facts they will get relief this is our joseph mccarthy era,0.8633217993079585,0.1595744680851064
let today spur us into action to give our veterans the support they social contract for veterans will guarantee them the opportunity to have a home to heal and to retrain when they complete their,0.5415224913494809,0.7109929078014184
congratulations to on becoming the new chair of the the democratic party is back were ready to,0.07785467128027682,0.38120567375886527
the safety of the american people is my highest priority i have just concluded a briefing with the fbi department of justice department of homeland security and the us secret service,0.49480968858131485,0.4875886524822695
dsa endorses the san diego migrant and refugee solidarity coalitions international sun 11/25 call to action for the central american refugee exodus your chapter attending/organizing a solidarity action reply with a,0.49480968858131485,0.4875886524822695
when you think of economic freedom you should think of via,0.7006920415224913,0.2765957446808511
on monday dec 3 at 7 pm were holding a national town hall on climate change an issue that does not get nearly,0.3788927335640138,0.49822695035460995
we literally had a week where every pundit talked about collegeeducated and nobody called them racist but when i talk about people of color you call me that despicable name,0.49480968858131485,0.7163120567375887
at crystal clear that whilst for theresa may the up austerity is not and will never be over until,0.726643598615917,0.2570921985815603
fbi director james comey under fire for his testimony acknowledging he knew that the democrats paid for that phony trump details on tuesday night,0.28546712802768165,0.4769503546099291
the people trusted the tories in 2017 to deliver brexit they failed also we made the mistake of not running candidates against tory brexiteers next time we will run candidates in every constituency,0.49480968858131485,0.4875886524822695
leaders warn more unrest could be ahead elsewhere as hotel contracts expire in los angeles and orange,0.29930795847750863,0.7127659574468085
everything you need to know about mrs mays not really leaving the eu withdrawal agreement,0.2768166089965398,0.48404255319148937
labour will rebuild our communities in every region of this country,0.01730103806228374,0.044326241134751775
so impressed listening to this is what americans are hungry for we have to agree,0.29238754325259514,0.625886524822695
today made history by being the first mp to speak in the house of commons about being hiv positive his bravery and hope will help to raise awareness and tackle stigma and inspire people across our country and around the world,0.28546712802768165,0.48936170212765956
are so many opposing view on border and safety cases filed there and why are a vast number of those cases overturned please study the numbers they are shocking we need protection and security these rulings are making our country unsafe very dangerous and unwise,0.49480968858131485,0.4875886524822695
if you hate antifa so much then be fascist and antifa have a reason to exist,0.49480968858131485,0.4875886524822695
weve got 4 days to help our friends and family get insured to make sure they today,0.03460207612456748,0.624113475177305
see what happens when we fight for our truth a rainbow wave is a beautiful,0.745674740484429,0.29432624113475175
republicans have been ruthless in their attacks on the lgbtq community and were fighting back tomorrow elect democrats who will protect all americans no matter who they are or who they love,0.49480968858131485,0.4875886524822695
yes selfcoup in which a person already in power grabs more power,0.3079584775086505,0.5212765957446809
this deal meet our six tests or the needs of our has laid out an alternative plan which puts jobs and living standards first,0.3079584775086505,0.7074468085106383
hotel workers unite see what we did there,0.49480968858131485,0.4875886524822695
i am glad that my friend and the protestors in paris have agreed with the conclusion i reached two years ago the paris agreement is fatally flawed because it raises the price of energy for responsible countries while whitewashing some of the worst polluters,0.6505190311418685,0.6223404255319149
today is which has fallen on the same date for 3 years the govt has failed to tackle the structural,0.49480968858131485,0.4875886524822695
the debate aka a televised pantomime between two remainers arguing over how to betray 174 million people,0.5934256055363322,0.14361702127659576
i smell a presidential run,0.6280276816608996,0.6117021276595744
must stop the rollout of universal credit immediately and address the deep flaws that are putting victims of domestic abuse at,0.29238754325259514,0.49822695035460995
recent reports have shown that cardiff is now the second highest council area in uk for collecting bus lane fines,0.2837370242214533,0.49113475177304966
in the northern constituency i represent and in many areas across the country brexit was a vote to say the direction,0.49480968858131485,0.4875886524822695
theres exactly one month left to get covered head over to to find the best plan to fit your needs and your budget dont wait get covered today,0.7577854671280276,0.6826241134751773
such a good conversation between these guys last night you,0.49480968858131485,0.4875886524822695
id love to take on sorghum again,0.49480968858131485,0.4875886524822695
payday loans are exploitative and misleading charging interest rates as high as 200% so capping their interest rates at 36% with proposition 111 is a great first step endorsed it and 75% of colorado,0.49480968858131485,0.4875886524822695
just learned that the san diego office of our partners was burned down including a pile of,0.7508650519031141,0.274822695035461
time pass the have an opportunity to stand united fix our broken,0.6885813148788927,0.274822695035461
the large and violent french protests take into account how badly the united states has been treated on trade by the european union or on fair and reasonable payments for our great military protection both of these topics must be remedied soon,0.14013840830449828,0.6099290780141844
on and join to discuss president trumps message to,0.49480968858131485,0.4875886524822695
we have been working hard on this and only going to get better,0.4982698961937716,0.0425531914893617
gavin always played a double game on one hand he was the ultimate bad boy bashing feminists and transsexuals with abandon on the other hand he was the ultimate good boy the,0.1245674740484429,0.6117021276595744
watch out on the in bolton west with our next mp we will win here,0.06401384083044982,0.7712765957446809
sign up for an event in your community,0.49480968858131485,0.4875886524822695
if the democrats think they are going to waste taxpayer money investigating us at the house level then we will likewise be forced to consider investigating them for all of the leaks of classified information and much else at the senate level two can play that game,0.7024221453287197,0.2783687943262411
oregon just reelected as their governor which means sending a woman back to their mansion for another 4 years,0.49480968858131485,0.4875886524822695
theresa may is a closet labour remainer so i have no confidence in either party anymore ill be sticking with,0.7041522491349481,0.4929078014184397
the universal credit is pushing families into need to halt the rollout now to stop it causing more the petition if youre with,0.41522491349480967,0.7039007092198581
loved watchin you say rainbow wave on cnn such a happy phrase,0.49480968858131485,0.4875886524822695
dick at night working title will be premiering on the heelturn network tonight at 8 eastern with and,0.370242214532872,0.50177304964539
ive had a united nations heart,0.49480968858131485,0.4875886524822695
today is a day for dont just donate on join a movement,0.3079584775086505,0.7056737588652482
meanwhile this nightmare isnt over for some of the kids trump separated *months* ago as of 25 kids still,0.698961937716263,0.2712765957446808
just now president trump invited rabbi benjamin sendrow to offer a prayer for the victims of the attack in pittsburgh,0.7145328719723183,0.6329787234042553
8 in 10 people can for less than $75 per month check out what options are available for you and your,0.3373702422145329,0.48226950354609927
hello my twitter friends this is my daughter gracie whos getting bullied and picked on at school being told shes,0.49480968858131485,0.6879432624113475
illegals can get up to $3874 a month under federal assistance program our social security checks are on average,0.10726643598615918,0.6205673758865248
theres too much at stake in this years midterm elections to sit on the sidelines were voting to protect our your friends and family how were committed to effecting change with this free downloadable poster,0.7837370242214533,0.20567375886524822
i welcome the decision to quash the unjust sentences of fracking stand in solidarity with the activists and thank them for standing up to the further destruction of our environment by this tory labour gets into government we will ban fracking,0.28719723183391005,0.4804964539007092
a perfect maine day for knocking on sharing the good rankedchoice voting means no,0.8131487889273357,0.13297872340425532
two weeks ago we took a risk to support demand for dems put climate change at the top of our,0.7179930795847751,0.7021276595744681
what if the people not signing up for obamacare dont want it via,0.7923875432525952,0.4734042553191489
bringing the wood mindless heartless gutless,0.03633217993079585,0.25
happy our voter protection hotline is here to answer any questions you have about voting our team is standing by and ready to take your calls,0.7802768166089965,0.24468085106382978
the unity of youth demanding a clean future is the most powerful movement in modern time it is great to have van,0.29930795847750863,0.475177304964539
americas success was achieved by limiting government not by government via,0.7110726643598616,0.49645390070921985
yes the uk does have a special stop arming saudi arabia and to help end the war in yemen causing this humanitarian crisis,0.05363321799307959,0.5939716312056738
the result of this perverted victorianism is fear and hatred between the genders monogamy is not being attacked so much as the grand tradition of the male conquest and the camaraderie of the,0.6972318339100346,0.6808510638297872
nevadans just elected a democrat as their next governor congratulations to and the on a hardfought win in a neckandneck race,0.3494809688581315,0.5159574468085106
has just flipped a seat in maine from red to blue proud to have invested in race to help reach mainers all over me02 to congratulate jared on his win,0.49480968858131485,0.4875886524822695
over the past year scottish labour has stood up for our nhs schools and lifeline we will,0.2906574394463668,0.4858156028368794
it just makes sense now is the time lets go,0.2975778546712803,0.48226950354609927
jeff sessions is the only confederate monument trump was willing to take down,0.49480968858131485,0.4875886524822695
ukip will never walk away from the fight for brexit up and join the thousands of other new recruits now,0.49480968858131485,0.4875886524822695
with a strong senate gop majority can we defend your tax cuts defend your second amendment protect your medicare and,0.2975778546712803,0.48936170212765956
we are being betrayed dont get mad get even the fightback now for as little as per ukip now,0.49480968858131485,0.4875886524822695
our nation has long taken pride in the brave americans who serve selflessly in our armed forces today democrats are proud to honor our veterans their families we are especially grateful for those who have chosen to continue their service by running for office,0.6885813148788927,0.7074468085106383
is a day we honor the memory of our fallen sisters due to senseless acts of use this,0.49480968858131485,0.4875886524822695
in chess your opening is all important the middle game is where the action happens and the end game is decisive but if you botch your opening it is almost impossible to recover trump botched his opening,0.8096885813148789,0.12411347517730496
anti fascists nope are pro eu thugs the contrast to the peaceful well organised brexit means exit rally down the road,0.27335640138408307,0.50177304964539
if they do become incredibly rich then i invite them to be happy with their wealth but also to share it a bit by,0.27335640138408307,0.5177304964539007
i liked a video eos is a game changing tech with marshall long of,0.49653979238754326,0.28368794326241137
we are at a historic moment of potential change with the opportunity for the left to build a majoritarian base for,0.28027681660899656,0.6985815602836879
watch share is mays deal the worst in history deputy leader mike hookem slams treason may for,0.49480968858131485,0.4875886524822695
ukip is the patriotic alternative those who take the heat of battle,0.8217993079584776,0.24645390070921985
cook a planet and live on,0.5899653979238755,0.05673758865248227
republican senators need to rise up and vote for senate republicans here mitch mcconnell here via,0.49653979238754326,0.6932624113475178
im excited for the midterms i love voting but im excited for what will come after too the push to finally begin,0.49480968858131485,0.4875886524822695
to any of the pundits or talking heads that do not give us proper credit for this great midterm election just remember two words fake news,0.49480968858131485,0.4875886524822695
some inspiration from civil rights legend,0.5034602076124568,0.6294326241134752
appreciation to all of the dsa members who turned out to support during the,0.6262975778546713,0.14893617021276595
interesting how my critique of tucker carlson is spun as an,0.49480968858131485,0.4875886524822695
most revealing about gavin down from the proud video is that clearly learned nothing from the the whole affair,0.49480968858131485,0.4875886524822695
oh and btw that feeling in the pit of your stomach that keeps you up at nightits the same one a car,0.7024221453287197,0.6737588652482269
today on we remember and honor those who have selflessly served and sacrificed those who have and,0.49480968858131485,0.4875886524822695
monday at 7pm come phone bank for and nationally endorsed candidate for ca assembly district,0.2768166089965398,0.4929078014184397
on behalf of the city of london labour party we congratulate our honorary member centenarian manny,0.08131487889273356,0.39893617021276595
there is a huge divide right across the west for 20 years the gap between rich and poor widened as global elites ignored genuine concerns brexit trump italy now these riots in france hapened because ordinary people want to feel they have some power over their own futures,0.34256055363321797,0.09574468085106383
this exchange w/ is troubling but not surprising this is authoritarian strongman behavior dangerous for our democracy keep doing what you are doing yamiche my take below,0.49480968858131485,0.4875886524822695
standing up for a i dont give a shit if its the republicans or democrats in control you,0.6349480968858131,0.6719858156028369
the mueller witch hunt is a total disgrace they are looking at supposedly stolen crooked hillary clinton emails even though they want to look at the dnc server but have no interest in the emails that hillary deleted acid washed after getting a congressional subpoena,0.12975778546712802,0.37056737588652483
when ranking democrats make excuses not to support a green new deal and you know taking fossil fuel,0.7508650519031141,0.22872340425531915
today our mp stood up in parliament and told the world made history today lloyd and,0.7179930795847751,0.3723404255319149
live president rally in charlotte nc,0.29411764705882354,0.49113475177304966
be like these guysvote your voice on nov 6th,0.6505190311418685,0.1453900709219858
with your 100000 quality allage 20000 extra affordable,0.08823529411764706,0.599290780141844
many of the ppl tear gassed at the border today are driven by desperation following the worst drought in 30 yrs they,0.889273356401384,0.49645390070921985
should someone convicted of murder as a teen be written off forever the suprct has noted that adolescent brain,0.49480968858131485,0.4875886524822695
latinas are leading the way and that includes in new 2nd district where just flipped a seat from red to blue,0.2698961937716263,0.48936170212765956
this is why we need your support please tweet to,0.7076124567474048,0.6914893617021277
the only is that of the democrats with russia and many others why the fbi take the server from the dnc they still have it check out how biased facebook google and twitter are in favor of the democrats the real collusion,0.7249134948096886,0.28900709219858156
and i agree on much but this touched me,0.3719723183391003,0.3599290780141844
is doing a great job for the people of pennsylvania he is strong on the border crime the military our vets and the 2nd amendment lloyd has my total endorsement,0.49480968858131485,0.4875886524822695
in january house democrats will reflect the diversity of the people they represent,0.7041522491349481,0.6808510638297872
workers rights are under threat from the tories botched brexit deal,0.29238754325259514,0.25886524822695034
macron was held up by liberals everywhere as the big hope for the european project they are now starting to look rather silly,0.5709342560553633,0.1595744680851064
the remainer establishment were never going to accept the to brexit is being betrayed the,0.32698961937716264,0.7092198581560284
climate change is not an issue we can afford to ignore any monday night im hosting a national town hall with,0.745674740484429,0.3102836879432624
the new york times did a phony story as usual about my relationship with mike pence they made up sources and refused to ask me the only one that would know for a quote,0.49480968858131485,0.4875886524822695
when billionaires are multiplying so are the wages of the average worker via,0.2768166089965398,0.49113475177304966
the space has been gotten so big people can financially stay in that ecosystem making them cryptolifers,0.31833910034602075,0.5
before the intellectual dark web came along we never encountered fearless outsidethebox commentary like this,0.2664359861591695,0.4875886524822695
totally clears the president thank you,0.49480968858131485,0.7358156028368794
trumps first two years in office were mitt romneys policies but with racist tweets,0.26124567474048443,0.2907801418439716
an actual brexiteer who have been campaigning for for 25 years and leader of vs the,0.33391003460207613,0.49113475177304966
the time for action on climate is,0.7647058823529411,0.23581560283687944
democratic win alert has won the race for 4th congressional district congratulations rep horsford,0.4913494809688581,0.5585106382978723
today marks 82 years since the battle of cable street when socialists stood with the jewish community against fascists i was proud to speak at the 80th anniversary 2 years will always stand with jewish people against hatred and division and resist the far right today,0.3166089965397924,0.2765957446808511
every $10 you contribute from to 12/1 gives a young dsaer a profound history of the ideas that inspired leaders from a philip randolph to bernie sanders any remaining funds will go to the ydsa scholarship fund,0.49480968858131485,0.4875886524822695
worth watching and reflecting on,0.1903114186851211,0.2978723404255319
bitcoin maximalists are nationalists is one logical leap from bitcoin maximalists are nazis lets hurry up and get this,0.49480968858131485,0.6347517730496454
next newsletter is hitting inboxes soon stay up to date with the nationwide fight for medicare for all and arm yourself,0.7197231833910035,0.6914893617021277
this thanksgiving feed your head by learning about the indigenous peoples whose land you occupy,0.49480968858131485,0.4875886524822695
tonight we should be voting on theresa botched brexit deal but to avoid a resounding defeat she pulled the vote at the very last minute,0.49480968858131485,0.4875886524822695
as rnc chair ronna mcdaniel oversaw history defying gains in the senate and unprecedented fundraising strength i have asked her to serve another term for my 2020 reelect because there is no one better for the job,0.49480968858131485,0.4875886524822695
that said tucker has developed a routine over the past year a which reveals his deeper principles and perspective i must admit script is starting to become it has always been insufficient,0.49480968858131485,0.4875886524822695
