big win alert congratulations to progressive champion on his reelection to the us senate,0.49480968858131485,0.4875886524822695
super excited to announce the launch of the gemini dollar the first regulated stablecoin so proud of our,0.49480968858131485,0.4875886524822695
had a fantastic brexit betrayal brexit means exit rally in whitehall today thousands of decent patriotic people,0.21972318339100347,0.4929078014184397
president moon and president trump reaffirmed their commitment to closely,0.22664359861591696,0.29609929078014185
how many times do we have to say it the american people deserve access to quality affordable health care,0.30103806228373703,0.425531914893617
mrs mays vassal state fakebrexit has torpedoed the possibility of a trade deal with the usa for the sake of our,0.6505190311418685,0.6985815602836879
over 10 years would plan 100% renewable federal job decarbonizing,0.49480968858131485,0.4875886524822695
spain has won on gibraltar according to its pm so may sells out northern ireland now gibraltar she must go,0.4930795847750865,0.274822695035461
in questions i raised the issue of people working from home we must increase the digital broadband,0.7318339100346021,0.299645390070922
but if a fair deal is able to be made with china one that does all of the many things we know must be finally done i will happily sign let the negotiations begin make america great again,0.6211072664359861,0.49645390070921985
the tech mobilization teams datadrove 23m voters to the polls for the 2018 midterms between our iwillvote,0.49480968858131485,0.4875886524822695
theres nothing scarier than allowing republicans to continue their attacks on vital programs like social security medicare and got 6 days to mobilize organize and get out the vote like never before make sure youre all set,0.7041522491349481,0.2925531914893617
macron patriotism is the exact opposite of nationalism nationalism is a betrayal of patriotism by saying our,0.5017301038062284,0.7039007092198581
the maga movement is dead in the water march 26 2018,0.38581314878892736,0.48226950354609927
at least one child a 20monthold guatemalan girl named mariee died after falling ill in federal custody and even those,0.25951557093425603,0.7074468085106383
black friday solidarity with all retail workers be kind shop union and fight for working people,0.19204152249134948,0.549645390070922
rumor has it that senator joe donnelly of indiana is paying for facebook ads for his socalled opponent on the libertarian ticket donnelly is trying to steal the election that what russia did,0.49480968858131485,0.4875886524822695
this is the funniest thing i have heard so far in the absurd antibrexit campaign ukip brexit rally on the 9th,0.6920415224913494,0.2801418439716312
watch x on now on,0.06920415224913495,0.35815602836879434
facebook removed 559 pages and 251 personal accounts today because these pages rules against spam and,0.7145328719723183,0.7092198581560284
ukip membership is currently over 26000 with new applications being processed,0.07612456747404844,0.37943262411347517
if charlottesville had never happened the demonization deplatforming and marginalization of the altright would have,0.6868512110726643,0.7074468085106383
every hodler of last resort have pretty gnarly battle scars war stories what are yours,0.49480968858131485,0.4875886524822695
sun 11/25 refugee caravan solidarity day of action w/,0.8062283737024222,0.6542553191489362
china talks are going very well,0.05709342560553633,0.49113475177304966
just spoke to governor jerry brown to let him know that we are with him and the people of california all the way,0.49480968858131485,0.4875886524822695
unfortunate statement why dont republicans care about unsustainable spending and debt,0.4930795847750865,0.1595744680851064
not gonna happen ann and the wall was always a symbol anyway not like cracking down on illegals is going to affect the demographic trajectory of america time to move on,0.07612456747404844,0.6046099290780141
you can have socialism too,0.29411764705882354,0.4326241134751773
inevitable that going to create jobsand we can use the transition to 100% renewable energy to achieve,0.49480968858131485,0.4875886524822695
we dont need a $32 trillion expansion in government healthcare spending when our government alone already spends more than other socialized via,0.2889273356401384,0.700354609929078
there is something rotten at the heart of this government,0.49480968858131485,0.4875886524822695
prohibition is over but over a dozen states still control alcohol sales at the retail level forcing consumers to shop at governmentrun liquor out more insane biggov alcohol laws from,0.5865051903114187,0.0797872340425532
of pennsylvania is fantastic he is strong on the border crime the military our vets and the 2nd amendment he is a powerful vote for and loves the great state of pennsylvania please get out and vote for john he has my total and very strong endorsement,0.050173010380622836,0.22695035460992907
we thank attorney general jeff sessions for his service and wish him well a permanent replacement will be nominated at a later date,0.33391003460207613,0.4769503546099291
is an opportunity to remember those lost and recommit to the fight of eliminating hiv/aids worldwide as democrats we reject stigma and embrace science we stand in solidarity with all those living with hiv/aids,0.6314878892733564,0.06560283687943262
the green new deal is one of the most policy interventions from the democratic,0.39965397923875434,0.5833333333333334
theresa may has agreed something which she said uk prime minister could ever same brazen deception,0.3408304498269896,0.43439716312056736
defied expectations in the 2017 french presidential election by offering investment instead of discussed how the dangerous rise of the far right across europe can be defeated by people coming together behind a real social and economic alternative,0.49480968858131485,0.4875886524822695
proposition a is a $250m affordable housing bond endorsed by and it passed by 70%,0.7231833910034602,0.28368794326241137
and last but not least building for the long term why invested in helping elect democratic candidates for attorney general and secretary of state across the country this year to ensure fair elections in the future,0.7439446366782007,0.23049645390070922
if you keep telling people theyre nazis at some point they might believe you,0.671280276816609,0.6595744680851063
as we head into tonight here are a few takeaways on how we got here under the leadership of the new dnc,0.25259515570934254,0.48226950354609927
based on the fact that the ships and sailors have not been returned to ukraine from russia i have decided it would be best for all parties concerned to cancel my previously scheduled meeting,0.7975778546712803,0.010638297872340425
fascinating about neocons is that unlike stodgy conservatives they actually have a messianic vision of the world and a will to implement it you can study and learn from neocons not much to learn from bob dole,0.49480968858131485,0.4875886524822695
thomas farrs nomination was another example of the lengths republicans will go to silence communities of color today is a,0.03633217993079585,0.2127659574468085
harry reid when he was sane agreed with us on birthright citizenship,0.6868512110726643,0.7092198581560284
china has agreed to reduce and remove tariffs on cars coming into china from the us currently the tariff is 40%,0.050173010380622836,0.5975177304964538
dont miss the chance to get a free cryptocurrency the link below to download cryptogiveaway bounty or use the promo code null to get an extra bonus from me the word and get more coins,0.2664359861591695,0.4858156028368794
when it comes to women of color candidates folks just talk about a glass ceiling what they describe is a,0.29238754325259514,0.648936170212766
on 245 occasions former fbi director james comey told house investigators he know recall or remember things when asked opened investigations on 4 americans not 2 know who signed off and know christopher steele all lies,0.49653979238754326,0.6985815602836879
remember florida i have been president of the united states for almost two years during that time senator bill nelson call me once rick scott called constantly requesting dollars plus for florida did a great job on hurricanes vote scott,0.0986159169550173,0.3971631205673759
tell the truth about gmos vaccines or cancer you might piss off some very powerful and well funded,0.2975778546712803,0.48936170212765956
oregon is a sanctuary state and thanks to the help of and hate groups couldnt change,0.28719723183391005,0.5
rotherham council given child gang rapists access to children born of repeated rape against the wish of their,0.7093425605536332,0.6684397163120568
phrase every announcement about the online retailers decisions as amazon the company that so harshly punishes,0.27162629757785467,0.4716312056737589
singing god bless the usa in cape girardeau missouri at,0.49480968858131485,0.4875886524822695
check out my latest articles,0.8685121107266436,0.574468085106383
to stop us repeating the mistakes of our past we must learn about our why labour will improve the teaching of black british history and establish an emancipation educational trust,0.34256055363321797,0.5106382978723404
people do not yet realize how much of the wall including really effective renovation has already been built if the democrats do not give us the votes to secure our country the military will build the remaining sections of the wall they know how important it is,0.27335640138408307,0.41312056737588654
out in the pudsey constituency to formally launch the campaign to get elected in place of the current,0.2664359861591695,0.4875886524822695
stay in in in in in in in in in,0.4913494809688581,0.725177304964539
rainbow wave it is the end of oneparty rule in the united states and the beginning of a new democratic party younger browner cooler more women more veterans,0.49480968858131485,0.4875886524822695
scott perry of pennsylvania is fantastic he is strong on the border crime the military our vets and the second,0.7301038062283737,0.2712765957446808
help us and pray for us but and our many allies may win 100k human beings locked in federal prisons the chance to,0.49480968858131485,0.4875886524822695
under the conservatives legal advice to challenge flawed benefits decisions has been cut by i asked the,0.06228373702422145,0.17907801418439717
jeremy heywood was an impressive and dedicated public servant my thoughts are with his family loved ones and colleagues at this sad time,0.10034602076124567,0.24113475177304963
transcript bob stanley the cryptolifer mentality and how eos changes everything,0.49480968858131485,0.4875886524822695
one of the few politicians i actually respect a genuine leftist a truthteller if she ran the establishment left and much fo the right would effectively treat her as cryptofascist in league with assad and putin pathetic,0.49480968858131485,0.17553191489361702
we need a criminal justice system that respects the dignity and humanity of women and girls who are incarcerated we need a,0.48961937716262977,0.599290780141844
did you ever see an investigation more in search of a crime at the same time mueller and the angry democrats even looking at the atrocious and perhaps subversive crimes that were committed by crooked hillary clinton and the democrats a total disgrace,0.43252595155709345,0.4946808510638298
trump has taken the slings and arrows of a revolutionary changeagent while not actually changing anything policywise would things be so different if jeb had been elected in 2016 not really if an actual vision i see it,0.27854671280276816,0.4716312056737589
once again wage growth failed to break out making it even harder for these hard working americans to make ends meet,0.6955017301038062,0.6968085106382979
our hotline will be open every day from 9 am to 9 pm est on election day well be here as long as polling places are open across the country just give us a call at 8333368683 already received thousands of calls are ready to answer any all voting questions,0.7041522491349481,0.6737588652482269
this week in swiss stock exchange lists crypto silvergate bank has 500 crypto swiss,0.49480968858131485,0.4875886524822695
this tweet has aged well,0.3754325259515571,0.5
will be there will you,0.7958477508650519,0.4858156028368794
your vote made this happen,0.2958477508650519,0.6950354609929078
his message was clear we must do so much more to meet our moral duty to those fleeing conflict and oppression when refugees arrive we must welcome them and support them in building a new life with us here,0.9290657439446367,0.49822695035460995
martha mcsally is a great warrior her opponent a nancy pelosi wacko,0.04325259515570934,0.1702127659574468
the contempt the tories have shown parliament and the people of this country demonstrates that they are not fit for,0.03633217993079585,0.0975177304964539
the scale of sex abuse in the uk is staggering the needs of the vulnerable are ignoredand the govt isnt doing,0.4982698961937716,0.040780141843971635
great turnout from tonight one job should be enough proud to have so much union,0.7249134948096886,0.4875886524822695
huddled with and the moment,0.49480968858131485,0.4875886524822695
thank you i hope listens to the leaders in his own backyard and brings to the,0.7941176470588235,0.18617021276595744
today laid out our vision to rebuild britain for the many not the hitting the streets on,0.49480968858131485,0.4875886524822695
why is my colleague being arrested for asking to and not leaving the capitol rotunda,0.7076124567474048,0.7163120567375887
trumps attempt to undermine the mueller investigation with the hiring of matthew whitaker as acting attorney general is a,0.7958477508650519,0.2695035460992908
four more democratic socialists on the washington dc advisory neighborhood commission thanks to,0.7041522491349481,0.4875886524822695
at a time when rents are rising to record highs endorsed measure o is desperately needed in berkeley it will create and preserve affordable housing and support affordable ownership opportunities such as coops and community land,0.49480968858131485,0.4875886524822695
regressive taxes that dont make the rich and fossil fuel companies pay their fair share are you know working class people dont want to foot the bill for crappy neoliberal policies and we know when were being screwed,0.71280276816609,0.2925531914893617
under labour the largest businesses will pay a little bit more towards the common good,0.49480968858131485,0.4875886524822695
congress has no idea what their hallways are going to look like tomorrow a sneak peak from the,0.49480968858131485,0.4875886524822695
dems gain control of the house this is a win for our future,0.27854671280276816,0.4875886524822695
on remembrance sunday we commemorate all those killed in war as we strive for a world of peace must honour our commitments to those who served in our armed,0.7179930795847751,0.25
wishing jewish families in america israel and around the world a happy hanukkah as millions light their menorahs over the next eight days let us continue to light the way forward by fighting for freedom and justice for all chag sameach,0.02422145328719723,0.14716312056737588
heelturn damn the torpedoes live at 7est with and at 8est with and gonna be a,0.3373702422145329,0.4769503546099291
the next labour government will ringfence mental health budgets invest in early years prevention for children and young people and finally put mental health on an equal footing with other clinical services,0.49480968858131485,0.4875886524822695
its actually very offensive that they think they can come in as outsiders with some bullshit journo resumes and,0.49480968858131485,0.4875886524822695
we all benefit when children are provided with the opportunity to reach their potential,0.49480968858131485,0.4875886524822695
trumps refusal to hold saudi arabia accountable sends a dangerous signal to the world that america will no longer lead,0.6833910034602076,0.4946808510638298
thanks to and for joining last night at a small gathering of friends families,0.49480968858131485,0.4875886524822695
shameful that the prime minister either know or care how many people from the windrush generation lost their homes their jobs and were denied nhs hostile environment policy is a disgrace and labour will scrap it,0.5173010380622838,0.7163120567375887
the people who are living their best life are depending on you to be lazy theyre depending on you to not got to vote like our lives depend on it,0.7179930795847751,0.2801418439716312
ive had it up to here kind of thing is exactly why we need to pass another round of tax cuts,0.07785467128027682,0.35638297872340424
new mexico just made history in their race congratulations to first latina democratic governor,0.29238754325259514,0.2712765957446808
crypto twitter the moment someone mentions a hardfork or airdrop,0.31141868512110726,0.4875886524822695
sadly the tories have made it harder to access vital mental health services and only yesterday it was reported that currently only onequarter of young people who required mental health services were able to access help from the nhs,0.6280276816608996,0.12234042553191489
nearly 4m american children lack health insurance and the number is rising incremental reforms wont reduce this intolerable,0.49480968858131485,0.4875886524822695
ukip deputy chair destroys a remainers argument about the uk paying its dues to the,0.7785467128027682,0.25177304964539005
check out my latest articles,0.49480968858131485,0.4875886524822695
federal judicial appointments should be given to those who believe in expanding access to the ballot box not restricting it thomas farr has upheld voter suppression laws in north carolina and does not deserve a lifetime appointment to the federal bench,0.2664359861591695,0.4769503546099291
we stand for change for an economy that works collaboratively and closely alongside our european partners for an,0.29930795847750863,0.29432624113475175
has spent more time negotiating with her own mps than the eu putting jobs the economy and living,0.2906574394463668,0.7163120567375887
fantastic evening in charlotte north carolina with great patriots get out and vote for and replay,0.27335640138408307,0.675531914893617
very disappointed with general motors and their ceo mary barra for closing plants in ohio michigan and maryland nothing being closed in mexico china the us saved general motors and this is the thanks we get we are now looking at cutting all subsidies including,0.33217993079584773,0.5195035460992907
new research by the finds would increase lifetime earnings for medicaid recipients,0.28027681660899656,0.2801418439716312
great to spend the day in norfolk with and here are rightly very concerned about the planned closure of so many childrens centres,0.1903114186851211,0.35815602836879434
we recorded it last weekend mark brahmin mind blowing,0.49480968858131485,0.4875886524822695
we will address the obscene accumulation of wealth and power in the hands of a few in this continent and in this world,0.49480968858131485,0.4875886524822695
be there to show you want to dump the deal that brexit means exit this is only pro brexit rally to be held,0.6903114186851211,0.6932624113475178
macron is essentially threatening us by using deal give up your entire fishing industry or well keep you,0.8217993079584776,0.06382978723404255
new native communities have shaped our history for generations proud that the core of our,0.49480968858131485,0.4875886524822695
follow lead and head to the polls early if you can check out to confirm your early voting location,0.29238754325259514,0.49113475177304966
the idea of a european military work out too well in ww i or 2 but the us was there for you and always,0.49480968858131485,0.4875886524822695
the is bigger than kavanaugh and his judicial decisions bigger than roe v wade which was of secondary importance in the debate over him bigger than partisan the hearing was a culture war which is increasingly a race war,0.3217993079584775,0.7145390070921985
just out consumer confidence hits highest level since 2000,0.7422145328719724,0.48404255319148937
georgia voters this is a really important thread,0.29411764705882354,0.4734042553191489
cant wait for this weeks show i sit down with a true inspiration what topics do you want us to cover saturday 7pm et on,0.10553633217993079,0.4627659574468085
harvey milk cas 1st openly gay elected official was assassinated 40 yrs ago today harvey knew the closet was a tool of,0.3875432525951557,0.37943262411347517
turns out pa is quite wealthy after all $46 bil to our friend amazon,0.9602076124567474,0.4787234042553192
thankful for the democratic elected officials who have spent the first two years of this administration protecting and fighting to expand access to health care,0.27335640138408307,0.75
thirdgeneration military veteran and health care champion chrissy houlahan has officially won her race for pa06 congratulations,0.4844290657439446,0.7092198581560284
the left in the us has a nearmonopoly on cultural power in the us while the right dominates the country,0.8252595155709342,0.17553191489361702
together well rebuild britain for the many not the few,0.759515570934256,0.2978723404255319
mays withdrawal deal surrenders british national security by subordinating uk defence forces to military eu,0.2647058823529412,0.4645390070921986
good luck to members of the uk youth parliament sitting in the house of commons today i look forward to listening to your important,0.2508650519031142,0.4787234042553192
we live in a world with so much data but so little on as a teacher im trying to,0.7301038062283737,0.7074468085106383
democrats made history this year because grassroots supporters stepped up and made it happen read below about how you helped make history across the country,0.2491349480968858,0.375886524822695
to me prison reform is not about being partisan it is about the people i personally know that were affected by,0.07785467128027682,0.39184397163120566
congratulations to who helped send two endorsed candidates to the city council will be the first black ventura city council member and will stand up for working class families seniors and communities who havent had a voice in the past,0.2664359861591695,0.5283687943262412
watch when they go low we go vote when they go lower we bring ten eligible friends to vote dnc chair joins at gotv florida rally for and,0.5034602076124568,0.4858156028368794
if the government cannot get a good brexit deal for this country then it should make way for those who can,0.29411764705882354,0.49113475177304966
all of america is in mourning over the mass murder of jewish americans at the tree of life synagogue in pittsburgh we pray for those who perished and their loved ones and our hearts go out to the brave police officers who sustained serious injuries,0.49480968858131485,0.4875886524822695
looks set to be another great addition to the maturing $btc market shows continue to be,0.8079584775086506,0.010638297872340425
words of wisdom likes or shares do not count as votes only votes count as votes so get out and,0.28719723183391005,0.599290780141844
drop moment first step act is anything but great rundown from on the,0.6643598615916955,0.2074468085106383
be woke on the importance of voting with,0.5397923875432526,0.2553191489361702
new york get out and vote for a great and hardworking congressman we need voice in dc his,0.49480968858131485,0.4875886524822695
monument academy is designed to meet the needs of students who have experienced adversity including foster care,0.25951557093425603,0.42021276595744683
trump said his tax law would benefit workers but that happened hear from workers who have lost their jobs and are,0.7474048442906575,0.28368794326241137
because of whom i loved dearly,0.7923875432525952,0.2322695035460993
fantastic evening in florida with great patriots at a beautiful get out and so we can continue making america safe great again,0.15397923875432526,0.8599290780141844
the caravans are made up of some very tough fighters and people fought back hard and viciously against mexico at northern border before breaking through mexican soldiers hurt were unable or unwilling to stop caravan should stop them before they reach our border but,0.3027681660899654,0.6950354609929078
we let you down nik,0.6833910034602076,0.7039007092198581
incredible that theresa may now even bother to mention the undermining of the uk armed forces contained in,0.2906574394463668,0.49113475177304966
our congressional orientation is cohosted by a corporate lobbyist group other members have quietly,0.7110726643598616,0.2127659574468085
in multiple counties in massachusetts medicare for all was on the ballot as a nonbinding question endorsed it and the response from every county was strong the people demand,0.49480968858131485,0.4875886524822695
beautiful ceremony today in paris commemorating the end of world war one many world leaders in attendance thank you to president of france now off to suresnes american cemetery to make speech in honor of our great heroes then back to the usa,0.28719723183391005,0.28191489361702127
from florida to maine to arizona and everywhere in between democratic candidates are ready to fight for all americans its up to us to get them across the finish line lets do this,0.7474048442906575,0.26595744680851063
seeing all these tweets about the bout to be folding clothes and,0.49480968858131485,0.4875886524822695
whether you are africanamerican hispanicamerican or any american at all you have the right to live in a country that puts your needs first,0.49480968858131485,0.4875886524822695
