we asked a once shropshire lad to wish telford a happy 50th birthday,0.20761245674740483,0.5567375886524822
is ready to protect the voice of wisconsinites,0.7093425605536332,0.21631205673758866
4 in fact there is no evidence suggesting that the difference between the reduced time and longer sentence results in,0.5121107266435986,0.7092198581560284
something powerful important rare and beautiful is happening please join this movement and help pass,0.28546712802768165,0.46808510638297873
i just dont see how this deal will pass on,0.49480968858131485,0.4875886524822695
thank you supervisor and cochair for coming by today and volunteering for our gotv,0.49480968858131485,0.4875886524822695
richard spencer will be joining jf on the public space on saturday november 24th at 700 pm est,0.08823529411764706,0.10106382978723404
this coincidentally timed interference is another blatant attempt by the establishment to try and block the,0.5051903114186851,0.6631205673758865
we shouldnt be turning our backs on children who are seeking safety and a better life the trump administrations immigration policies are shameful,0.7906574394463668,0.24822695035460993
shouting from the are still separating families,0.6955017301038062,0.48936170212765956
maybe will build the wall,0.49480968858131485,0.4875886524822695
when i served in congress there even a restroom near the house floor come a long,0.49480968858131485,0.4875886524822695
i wonder if our supremacist racist hitlerinchief donald trump will ever deport as many people as barack obama,0.49480968858131485,0.4875886524822695
i was there when nosql was going to solve all our computing was there when the cloud was going to solve our,0.49480968858131485,0.4875886524822695
local authorities have had their budgets slashed since 2010 and are struggling to provide the services our communities have to organise at every level to fight these cuts and i welcome the campaign,0.49480968858131485,0.4875886524822695
democratic candidate for governor of colorado and dnc chair have a message for you and your friends on why its so important for young people to head to the polls,0.49480968858131485,0.4875886524822695
we do this newsletter thing and it is good sign up at,0.24740484429065743,0.49113475177304966
several of our local members spoke before city council tonight on the new housing rights code including tacoma dsa member,0.7889273356401384,0.2553191489361702
ukip mep on theresa mays brexit deal and how it sells out british interests to the european union part 1,0.671280276816609,0.7127659574468085
ready to stand with for and being able to see a doctor,0.7162629757785467,0.24822695035460993
incredible to be with our great heroes today in california we will always be with you,0.28546712802768165,0.48404255319148937
exactly 100 years ago today on november 11th 1918 world war i came to an end we are gathered together at this hallowed resting place to pay tribute to the brave americans who gave their last breath in that mighty struggle,0.49480968858131485,0.4875886524822695
until last night colorados constitution still read that there never be in this state either slavery or involuntary servitude except as a punishment for exceptions now thanks to this amendment no slavery period,0.49480968858131485,0.4875886524822695
thanks to my friend repelect for spreading the good word about our campaign,0.29411764705882354,0.2765957446808511
nobody should be worse off and nobody should have their homes put at risk because of universal system has to change,0.20761245674740483,0.3971631205673759
we now live in a world where we have so much data so little,0.31314878892733566,0.6950354609929078
is hard to contain in words a social entrepreneur tireless advocate formerly incarcerated woman own,0.07958477508650519,0.6187943262411347
deeply appreciative of law enforcements quick response to the shooting at the yoga facility in tallahassee today,0.02422145328719723,0.1524822695035461
the un migration compact which seeks to criminalise all criticism of mass migration and completely change the definition of a refugee will be signed by many world leaders next week without ever consulting their citizens,0.2422145328719723,0.3262411347517731
congratulations to on flipping 6th district georgians have elected to send one of the strongest advocates for commonsense gun reforms to congress,0.2560553633217993,0.24645390070921985
it was inspiring to hear so many diverse ideas on how to tackle climate change use it as opportunity for jobs,0.49480968858131485,0.4875886524822695
this republican mayor leads the first city in texas powered by 100% renewable energy addressing climate change and,0.3062283737024221,0.4645390070921986
be brutally honest involved in a public altright club you should know three things you have *already* been infiltrated by antifa and/or feds if you are well known or effective you will be declared a terrorist group trump save you,0.49480968858131485,0.4875886524822695
can you say that in a video selfie,0.49480968858131485,0.4875886524822695
who do you have the most confidence in theresa may or jeremy corbyn,0.49480968858131485,0.4875886524822695
today the ukip nec voted overwhelmingly against a motion of no confidence in the leader gerard batten,0.08131487889273356,0.37943262411347517
they have really done a great job in capturing my longheld views and ideas this book is on sale now a terrific read of a really interesting subject,0.6972318339100346,0.5053191489361702
we face a national emergency in children services,0.49480968858131485,0.4875886524822695
after hurricane sandy rockway youth organized fiercely for their community know what the future will be like,0.28719723183391005,0.700354609929078
hitting the in this morning with and,0.49480968858131485,0.4875886524822695
the first step for republicans to regain american trust on fiscal responsibility is for to deliver a nationally televised speech from the oval office to announce an allhandsondeck via,0.29930795847750863,0.5088652482269503
former intelligence chief other bigwigs say parliament will surrender its sovereignty under the,0.49480968858131485,0.4875886524822695
could somebody please explain to the democrats we need their votes that our country losses 250 billion dollars a year on illegal immigration not including the terrible drug flow top border security including a wall is $25 billion pays for itself in two months get it done,0.9152249134948097,0.48404255319148937
what if the people not signing up for obamacare dont want it via,0.31141868512110726,0.4166666666666667
no jeremy the world is still waiting for action,0.49480968858131485,0.4875886524822695
republicans believe our country should be a sanctuary for lawabiding americans not criminal aliens and republicans will always stand with the heroes of and law enforcement,0.2975778546712803,0.2783687943262411
i have been saying there was never going to be a since 2014 we will be saying no deal loud and clear at,0.17128027681660898,0.40070921985815605
massachusetts upholds transgender peoples rights by voting shoutout to and for their work,0.7093425605536332,0.7021276595744681
fun fact more wealth will be created in crypto over the next 10 years than over the prior 10 years but remember,0.49480968858131485,0.4875886524822695
on 1128 climate finance day nyers will call on nyc to divest from banks that fuel climate change and invest in,0.29930795847750863,0.7074468085106383
good morning black friday deal comes at a price under capitalism retail is becoming a hellish landscape for,0.6557093425605537,0.3829787234042553
is last chance this session to turn away from failed policies reduce size/scope of federal prison system protect families and celebrate mitch mcconnell now via,0.6314878892733564,0.6294326241134752
make no mistake climate change is here now across the country extreme weather is costing lives devastating,0.759515570934256,0.2712765957446808
democrats are committed to making sure every american can access the care they need lets help all of our candidates get across the finish line,0.6730103806228374,0.22340425531914893
i am not a journalist nonpartisan i am a commentator partisan we have different roles,0.28546712802768165,0.49822695035460995
republicans have created the best economy in the history of our country and the hottest jobs market on planet earth the democrat agenda is a socialist nightmare the republican agenda is the american dream,0.2889273356401384,0.5088652482269503
i hope the discovery and eventual recovery of the argentine submarine san juan brings needed closure to the wonderful families of those brave missing sailors i look forward to hearing more from my friend president in argentina later this month,0.49480968858131485,0.4875886524822695
another way unions of working people lead in the workplace helping new moms take maternity leave,0.0,0.4858156028368794
important new report from showing the gap between housing haves and havenots is growing its why,0.5224913494809689,0.6950354609929078
sorry to disappoint owen etc more than a couple of hundred brexiteers turned up at the brexit means exit rally in central london today thank you to the many thousands who participated at the event to send a clear message to this government to dump the deal,0.7370242214532872,0.20212765957446807
why didnt we just elect jeb,0.21280276816608998,0.524822695035461
i just learned that up to 40% of people released from prison after being wrongfully incarcerated receive *no*,0.49480968858131485,0.4875886524822695
a day late but here i am on day 50 of the been joining 2700+ workers on the,0.8114186851211073,0.12056737588652482
happy thanksgiving why not take the time today to learn about indigenous american history and their struggle against,0.27162629757785467,0.48936170212765956
breaking petition to stop the uk from signing the un migration compact has now reached 100000 signatures issue will now be considered for debate in the british parliament,0.71280276816609,0.25
fact if in line to vote when your polling place closes you still get to cast your ballot if you run into any issues at the polls hit up our voter protection hotline at 8333368683 got your back,0.49480968858131485,0.4875886524822695
congrats on the win cool thing about this race the dnc made significant investments in latinx and africanamerican organizing efforts across the state communities of color are leading the fight to turn our country around,0.49480968858131485,0.4875886524822695
if you believe in the importance of human dignity and/or the constitution i hope you will agree that the process for human,0.2906574394463668,0.6081560283687943
lets have a proper debate away now under wto aka actually leaving the eu a peoples losers vote,0.08304498269896193,0.39361702127659576
catch ukip mep discussing theresa mays brexit deal from 1000am1130am on the victoria derbyshire programme on bbc 2,0.24048442906574394,0.4095744680851064
petition to reject the un global compact for migration reaches 96k signatures sign it now to squash this,0.2958477508650519,0.48226950354609927
watch ukip leader on sky news earlier discussing mrs mays brexit betrayal deal and how we should be leaving,0.49480968858131485,0.4875886524822695
austerity has always been a political will end it and rebuild all our,0.7214532871972318,0.26773049645390073
chicago has some of the most exorbitant taxes in top of taxing all amusements like theater concerts sports and movies they are now taxing via,0.7197231833910035,0.7092198581560284
transgender members of our armed forces deserve to be treated with the same respect dignity as any other service member this administration cannot continue to discriminate against our troops based on who they love how they identify,0.7335640138408305,0.28191489361702127
theresa may just said she has a duty to deliver brexit we need much more than that we need a pm who believes in brexit and in britain,0.49480968858131485,0.4875886524822695
eus own figures point to the fact that 90% of global growth will come from outside the eu an independent uk must,0.29411764705882354,0.5
there are a lot of criminals in the caravan we will stop them catch and detain judicial activism by people who know nothing about security and the safety of our citizens is putting our country in great danger not good,0.5,0.6914893617021277
you cannot keep the public safe on the cheap,0.28719723183391005,0.4946808510638298
lets remember that kavanaugh is the type of judge who would have been nominated in a jeb bush administration nevertrumpers like erickson sense correctly that trump is fighting their battles,0.25432525951557095,0.49113475177304966
ten years ago today ue local 1110 members made history by occupying their chicago factory and winning the honors,0.6799307958477508,0.625886524822695
first8 from fci herlong thanks you van jones,0.49480968858131485,0.4875886524822695
the proud boys too played a double game on one hand they were more rough and tumble and ready for a fight than any altright group including twp on the other their expressed ideology was essentially neoconservatism for morons,0.49480968858131485,0.4875886524822695
please stop me okay too much thanks,0.49480968858131485,0.4875886524822695
thank you and you are sadly correct,0.49480968858131485,0.4875886524822695
these people were tragically failed by this tory and every tory needs to read,0.49480968858131485,0.4875886524822695
watch live at labour party conference as she outlines how the next labour government will rebuild our economy so it works for the many not the,0.49480968858131485,0.4875886524822695
my brief thoughts the first step act will bring real justice to thousands of incarcerated women,0.35986159169550175,0.5
this cant go must reject the politics of division and the tories toxic hostile environment,0.2958477508650519,0.7021276595744681
the sun is shining my friend max,0.49480968858131485,0.4875886524822695
according to candace o conservatism = opportunity to get rich,0.8200692041522492,0.24645390070921985
this helps with he death of free press canada,0.6833910034602076,0.2907801418439716
when five librarians were fired for trying to unionize kristy cooper organized to hold the library board accountable and get them rehired endorsed her because of her constituent advocacy to save libraries and their workers now shes a,0.49480968858131485,0.4875886524822695
i would like to wish jewish people in britain and across the world a very happy,0.6799307958477508,0.6950354609929078
fake news the enemy of the people,0.7249134948096886,0.5106382978723404
no deal is better than theresa mays fakebrexit mps must respect the will of the people and abandon this treacherous,0.2820069204152249,0.49113475177304966
on donate to organizations doing critical support for the migrant,0.49480968858131485,0.12056737588652482
i added a video to a playlist the ability for citizens to engage with the truth is under attack,0.2958477508650519,0.4875886524822695
the record on support staff increase in violent,0.49480968858131485,0.4875886524822695
measure 104 promised to permanently end easy taxes is an easy tax you ask to the writers of this measure easy taxes are taxes for owning golf courses or heated pools among many other loopholes and helped stop,0.25432525951557095,0.6205673758865248
imagine thinking that survival is not a human right,0.49480968858131485,0.4875886524822695
some remainer clever dicks are saying my tweet is inconsistent with my often stated fact that the eu is not,0.49480968858131485,0.4875886524822695
from maine is a great congressman he is in a tough fight against a very liberal nancy pelosi democrat bruce has helped bring jobs back to his state and totally protects your great second amendment we need to keep bruce in washington he has my full endorsement,0.49480968858131485,0.4875886524822695
when was potus right wing attacked him even when he did stuff they wanted him to do he got zero credit for anything let me say if announces support for which will aid 100000 incarcerated people happily give him full credit,0.49480968858131485,0.4875886524822695
so good to hear my mother,0.49480968858131485,0.4875886524822695
catch and release is an obsolete term it is now catch and detain illegal immigrants trying to come into the usa often proudly flying the flag of their nation as they ask for us asylum will be detained or turned away dems must approve border security wall now,0.49480968858131485,0.4875886524822695
talking about immigration this kind of compassion is a far cry from the hatefilled rhetoric of today,0.6453287197231834,0.047872340425531915
the master class has always declared the wars the subject class has always fought the battles,0.49480968858131485,0.4875886524822695
we cannot allow republicans to deny the fact that climate change is real,0.2906574394463668,0.5
the time for debate and political posturing is over now time to do the right thing and pass the first step act,0.49480968858131485,0.4875886524822695
we mourn for the lives lost and we pray for the victims of the california wildfires i want to thank the firefighters and first responders for their incredible courage in the face of grave danger,0.5034602076124568,0.09574468085106383
louisiana and mississippi youve got runoff elections right around the corner to make sure your friends and family confirm their polling place at lets get ready to vote,0.49480968858131485,0.4875886524822695
its official dsa is now 55000 members strong,0.08131487889273356,0.9343971631205674
funny how lowly rated cnn and others can criticize me at will even blaming me for the current spate of bombs and ridiculously comparing this to september 11th and the oklahoma city bombing yet when i criticize them they go wild and scream just not,0.49480968858131485,0.4875886524822695
i added a video to a playlist massive information dump exposing the rulers of reality,0.28719723183391005,0.2801418439716312
current and former college democrats all across arizona put in so much effort to elect democrats this november from our,0.2958477508650519,0.6950354609929078
what offends me most about is not her neurotic antiwhite racism but the fact that mediocrities like,0.49480968858131485,0.4875886524822695
in office but not in power,0.0847750865051903,0.5921985815602837
mays deal is not brexit we should be out now under wto rules means exit not the fight,0.7249134948096886,0.7092198581560284
excellent day campaigning in the city of london huge thanks to all who turned out to meet residents in the barbican,0.49480968858131485,0.4875886524822695
i agree with their stance 100% and the united states is likewise taking a very hard line on illegal immigration the prime minister is working very hard on the economy of italy he will be successful,0.49480968858131485,0.4875886524822695
watch and discussed the british pm delaying a brexit vote and set to,0.49480968858131485,0.4875886524822695
excellent commentary from on the young diverse and exciting democratic candidates who made history last,0.28719723183391005,0.4769503546099291
changing the world ecosystem shoots beyond $12 billion in 80 days,0.49480968858131485,0.4875886524822695
we live in a world in which we have so much data but so little wisdom on,0.11937716262975778,0.41134751773049644
dont blow it this time you have a golden opportunity now to lead a brexit coalition during this national,0.49480968858131485,0.4875886524822695
last night i had a brilliant evening at the watching shakespeare plays performed by students from pooles park the bridge and islington arts and media you for your great work and i hope those who can will support you here,0.0847750865051903,0.6046099290780141
today we remember the brave actions of our troops and those of our allies during wwi honored to be spending this day,0.5034602076124568,0.28368794326241137
says his conversation with has made him even more,0.6539792387543253,0.7092198581560284
wow if a conservative said this they would be boycotted and not allowed back in the public arena hillary said,0.3027681660899654,0.4946808510638298
ukip leader speaks to about brexit and theresa mays,0.31141868512110726,0.4166666666666667
big oil billionaires spent $100 million last election to stop climate action now mobilizing their lobbyists to,0.7854671280276817,0.25
wow to 2014 this one weekend launched so many things thank you and our entire team what a journey,0.8114186851211073,0.015957446808510637
never oct 23 1983 the marine barracks bombing took the lives of 241 and,0.49480968858131485,0.4875886524822695
this cyber monday an important reminder that amazon has a $20 million contract with ice,0.6920415224913494,0.2712765957446808
we should hold politicians accountable to us we joined the dsa to fight back because these oligarchs depend on us and therein lies our power,0.6885813148788927,0.6861702127659575
my heartfelt condolences and prayers to you and your family your mama raised you well my friend,0.49480968858131485,0.4875886524822695
steel dynamics announced that it will build a brand new 3 million ton steel mill in the southwest that will create 600 goodpaying us jobs steel jobs are coming back to america just like i predicted congratulations to steel dynamics,0.49480968858131485,0.4875886524822695
aw shucks thanks you know youre blessed when your boss is one of your closest friends and your team is,0.49480968858131485,0.4875886524822695
8 years of austerity has damaged our economy and inflicted suffering on our communities next budget,0.49480968858131485,0.4875886524822695
the government needs to get its act together and stop the roll out of universal credit,0.9117647058823529,0.4875886524822695
open enrollment starts today dont miss your chance to get covered head over to to explore your options dont wait weve only got until december 15,0.5155709342560554,0.7163120567375887
cnn is currently projecting that 96 women will win seats in the house of representatives a record number,0.7820069204152249,0.5177304964539007
thread from our friends at,0.7093425605536332,0.7109929078014184
no flag waving no pleas to donald trump no black girlfriends or jewish allies could save the proud boys from their original sin of being a group that appealed to and represented the interests of white men,0.2837370242214533,0.274822695035461
new book spygate the attempted sabotage of donald j trump is terrific hes tough hes smart and he really gets it his book is on sale now i highly recommend,0.7283737024221453,0.2872340425531915
the failing to back the swansea bay tidal lagoon project was the wrong decision for our economy the wrong decision for jobs and the wrong decision for the future of our will back why,0.49480968858131485,0.4875886524822695
this is a moving story about the power and impact of struggle and jackson was one of the founders of lesbian and gays support the miners the film pride is based on his and his friends,0.3235294117647059,0.4734042553191489
a bipartisan group of senators reached a tentative deal on the most substantial rewrite of the sentencing + prison,0.49480968858131485,0.4875886524822695
our the 55000 dsa members building our movement together and telling our friends family and coworkers to,0.27162629757785467,0.4095744680851064
immigration is a privilege and not a right the uk must not sign our national sovereignty petition is at,0.916955017301038,0.4946808510638298
this were thankful for everyone who worked tirelessly to carry so many democrats to victory this year thankful that the new congress will be the most diverse in history and thankful for all the public servants fighting for a brighter future for all,0.5,0.7446808510638298
campaign inspired america and showed the world theres far more that unites us than divides us thanks to all the staff and volunteers who brought us closer to victory in texas than many thought was possible keep getting after it,0.41695501730103807,0.4875886524822695
well done signore salvini will mrs may do the same the un global compact on migration is intended to create waves,0.35294117647058826,0.6205673758865248
terrible gang of angry democrats look at their past and look where they come from the now $30000000 witch hunt continues and got nothing but ruined lives where is the server let these terrible people go back to the clinton foundation and department,0.49480968858131485,0.4875886524822695
keep all of your comrades in mind this thanksgiving if theyre near or far we are all one big socialist family,0.7491349480968859,0.20567375886524822
wait to speak to 4000+ young conservatives from across america with in just a few weeks time sign up here,0.49480968858131485,0.4875886524822695
alert has defeated republican randy hultgren lauren underwood is a millennial registered nurse and one of the youngest black women elected tonight if youre as thrilled as we are that shell be bringing her talents and abilities to the house,0.2975778546712803,0.475177304964539
i wait to see which stories you shine a light on in the next optimist issue i was thrilled to,0.28719723183391005,0.2730496453900709
expect to see more democratic socialists of america iowa chapters in concerted effort to keep democratic candidates,0.7006920415224913,0.723404255319149
cross party brexit group declares it is preparing for a second referendum,0.49480968858131485,0.4875886524822695
during the hiv outbreak of the 80s gay men were banned from giving blood in response the lesbians community in,0.4930795847750865,0.6436170212765957
congress finally has a real chance to pass bipartisan legislation to reform our outdated drug sentencing laws my bill,0.49480968858131485,0.4875886524822695
in 2018 a trend emerged only 54 percent of white voters backed republicans,0.27162629757785467,0.5141843971631206
